"title","url","stars","name","reviewUrl","text"
"Puskesmas Sewon II","https://www.google.com/maps/search/?api=1&query=Puskesmas%20Sewon%20II&query_place_id=ChIJE446Lk9Wei4RoIvHItkY-i4","5","Zulfikar Hanif","https://www.google.com/maps/reviews/data=!4m8!14m7!1m6!2m5!1sChZDSUhNMG9nS0VJQ0FnSURSdHRmT1B3EAE!2m1!1s0x0:0x2efa18d922c78ba0!3m1!1s2@1:CIHM0ogKEICAgIDRttfOPw%7C%7C?hl=id","Puskesmas Sewon II selalu melakukan perbaikan pelayanan, sebagai pasien dan pengunjung dari waktu ke waktu, perubahan sangat terasa dalam hal pelayanan, mulai dari alur screening, pendaftaran hingga periksa, sangat mudah diikuti. Keramahan staff standar, tidak baik pun tidak buruk.

Penambahan area parkir di belakang membuat semakin nyaman, sehingga tidak semrawut."
"Puskesmas Sewon II","https://www.google.com/maps/search/?api=1&query=Puskesmas%20Sewon%20II&query_place_id=ChIJE446Lk9Wei4RoIvHItkY-i4","1","Meilani WahyuP","https://www.google.com/maps/reviews/data=!4m8!14m7!1m6!2m5!1sChZDSUhNMG9nS0VJQ0FnSURSbVBhMGVREAE!2m1!1s0x0:0x2efa18d922c78ba0!3m1!1s2@1:CIHM0ogKEICAgIDRmPa0eQ%7C%7C?hl=id","Tanya baik baik mengenai faskes bpjs malah dibales dengan nada keras, saya ga budek mas cuma mau kejelasan saja saya kuat mbayar kok 😂. Pertama kesini dibikin bingung pendaftaran dimana ga dikasih arahan 😂😂😂😂"
"Puskesmas Sewon II","https://www.google.com/maps/search/?api=1&query=Puskesmas%20Sewon%20II&query_place_id=ChIJE446Lk9Wei4RoIvHItkY-i4","5","Dudy H","https://www.google.com/maps/reviews/data=!4m8!14m7!1m6!2m5!1sChZDSUhNMG9nS0VJQ0FnSURtaU5HWUdnEAE!2m1!1s0x0:0x2efa18d922c78ba0!3m1!1s2@1:CIHM0ogKEICAgIDmiNGYGg%7C%7C?hl=id","Pelayanan baik ramah
Tempat nyaman bersih
Tingkatkan pelayanan nGih."
"Puskesmas Sewon II","https://www.google.com/maps/search/?api=1&query=Puskesmas%20Sewon%20II&query_place_id=ChIJE446Lk9Wei4RoIvHItkY-i4","1","Tyand Rachmad200","https://www.google.com/maps/reviews/data=!4m8!14m7!1m6!2m5!1sChdDSUhNMG9nS0VJQ0FnSURSb0pDM3N3RRAB!2m1!1s0x0:0x2efa18d922c78ba0!3m1!1s2@1:CIHM0ogKEICAgIDRoJC3swE%7C%7C?hl=id",
"Puskesmas Sewon II","https://www.google.com/maps/search/?api=1&query=Puskesmas%20Sewon%20II&query_place_id=ChIJE446Lk9Wei4RoIvHItkY-i4","5","Jihan Luthfi Salsabila","https://www.google.com/maps/reviews/data=!4m8!14m7!1m6!2m5!1sChdDSUhNMG9nS0VJQ0FnSUNSMV9EcG5BRRAB!2m1!1s0x0:0x2efa18d922c78ba0!3m1!1s2@1:CIHM0ogKEICAgICR1_DpnAE%7C%7C?hl=id","Bagian pendaftaran ramah²"
"Puskesmas Sewon II","https://www.google.com/maps/search/?api=1&query=Puskesmas%20Sewon%20II&query_place_id=ChIJE446Lk9Wei4RoIvHItkY-i4","3","Fatichatir Rizqiya","https://www.google.com/maps/reviews/data=!4m8!14m7!1m6!2m5!1sChdDSUhNMG9nS0VJQ0FnSUNteDd1aXB3RRAB!2m1!1s0x0:0x2efa18d922c78ba0!3m1!1s2@1:CIHM0ogKEICAgICmx7uipwE%7C%7C?hl=id","Datang, parkir(bayar di akhir), menuju belakang, menulis nama di kertas antrian(reservasi), menunggu dipanggil, cek suhu dan masuk antri ke dalam, menunggu dipanggil apabila ada pemeriksaan, menunggu obat kalau diresepkan, selesai, pulang, PARKIR BAYAR Yaaa

Melihat review banyak yg mengeluh antriannya kelewat, mungkin beberapa memang dapat pelayanan apes seperti itu, tapi ada juga yg dapat pelayanan baik, tergantung ibu² pelayanannya juga(ada yg bad attitude, ada juga yg ramah, sudah biasa ya terjadi di puskesmas Indonesia hal seperti ini)

Untuk pasien yang sudah mendesak kritis kesakitan, tidak akan mendapatkan tindakan cepat dari staf puskesmas, hanya diberi instruksi untuk langsung ke rumah sakit, jadi tidak ada surat administrasi BPJS / rujukan ke rumah sakit, hanya disuruh mandiri datang ke rumah sakitnya dan akhirnya bayar mandiri juga karena tidak mendapat rujukan BPJS dari faskes 1 nya jika ambil di puskesmas ini

Alhamdulillah sekarang sudah pindah ke faskes klinik yang lebih sat set dan jelas pelayanannya, jadi gak sia sia iuran BPJS setiap bulannya"
"Puskesmas Sewon II","https://www.google.com/maps/search/?api=1&query=Puskesmas%20Sewon%20II&query_place_id=ChIJE446Lk9Wei4RoIvHItkY-i4","1","Denny Daffa Rizaldy","https://www.google.com/maps/reviews/data=!4m8!14m7!1m6!2m5!1sChZDSUhNMG9nS0VJQ0FnSURocmEyRUp3EAE!2m1!1s0x0:0x2efa18d922c78ba0!3m1!1s2@1:CIHM0ogKEICAgIDhra2EJw%7C%7C?hl=id",
"Puskesmas Sewon II","https://www.google.com/maps/search/?api=1&query=Puskesmas%20Sewon%20II&query_place_id=ChIJE446Lk9Wei4RoIvHItkY-i4","5","Kini Cheese Tea Monjali","https://www.google.com/maps/reviews/data=!4m8!14m7!1m6!2m5!1sChdDSUhNMG9nS0VJQ0FnSURoNmR6aTF3RRAB!2m1!1s0x0:0x2efa18d922c78ba0!3m1!1s2@1:CIHM0ogKEICAgIDh6dzi1wE%7C%7C?hl=id","Pelayanannya bagus, mendahulukan lansia dan yg prioritas lainnya👍🏻"
"Puskesmas Sewon II","https://www.google.com/maps/search/?api=1&query=Puskesmas%20Sewon%20II&query_place_id=ChIJE446Lk9Wei4RoIvHItkY-i4","5","Dicha Fitra Rafinda","https://www.google.com/maps/reviews/data=!4m8!14m7!1m6!2m5!1sChdDSUhNMG9nS0VJQ0FnSURob2ZURzZ3RRAB!2m1!1s0x0:0x2efa18d922c78ba0!3m1!1s2@1:CIHM0ogKEICAgIDhofTG6wE%7C%7C?hl=id",
"Puskesmas Sewon II","https://www.google.com/maps/search/?api=1&query=Puskesmas%20Sewon%20II&query_place_id=ChIJE446Lk9Wei4RoIvHItkY-i4","1","CHIN VIJA","https://www.google.com/maps/reviews/data=!4m8!14m7!1m6!2m5!1sChdDSUhNMG9nS0VJQ0FnSURodXRfQ2tnRRAB!2m1!1s0x0:0x2efa18d922c78ba0!3m1!1s2@1:CIHM0ogKEICAgIDhut_CkgE%7C%7C?hl=id","Sangat mengecewakan,pelayanan kurang bagus,datang awal tpi yg dipanggil yg baru datang,mohon perbaiki pelayanannya"
"Puskesmas Sewon II","https://www.google.com/maps/search/?api=1&query=Puskesmas%20Sewon%20II&query_place_id=ChIJE446Lk9Wei4RoIvHItkY-i4","1","Rischa Arida","https://www.google.com/maps/reviews/data=!4m8!14m7!1m6!2m5!1sChdDSUhNMG9nS0VJQ0FnSURodXZlVjl3RRAB!2m1!1s0x0:0x2efa18d922c78ba0!3m1!1s2@1:CIHM0ogKEICAgIDhuveV9wE%7C%7C?hl=id","Sangat tidak recomended. Ngantri lama tapi yang di panggil tidak sesuai nomor urut. Petugasnya juga tidak ada yang ramah 😂"
"Puskesmas Sewon II","https://www.google.com/maps/search/?api=1&query=Puskesmas%20Sewon%20II&query_place_id=ChIJE446Lk9Wei4RoIvHItkY-i4","1","Aqila&Arshaka home","https://www.google.com/maps/reviews/data=!4m8!14m7!1m6!2m5!1sChdDSUhNMG9nS0VJQ0FnSUNoM2JISXpRRRAB!2m1!1s0x0:0x2efa18d922c78ba0!3m1!1s2@1:CIHM0ogKEICAgICh3bHIzQE%7C%7C?hl=id","pgn pindah faskesnya, di sini beberapa kali badan udah lemes banget badan gak karuan rasanya minta tes darah atau cek lab, cek kolesterol biar tau kondisi sebenarnya tapi gak dikasih sama dokternya, pdhl pasien sebelumnya keluhannya kyk aku tp dikasih cek lab 😑 mohon ditingkatkan kan dan jangan pilih kasih"
"Puskesmas Sewon II","https://www.google.com/maps/search/?api=1&query=Puskesmas%20Sewon%20II&query_place_id=ChIJE446Lk9Wei4RoIvHItkY-i4","2","Fajar Sulistiyo","https://www.google.com/maps/reviews/data=!4m8!14m7!1m6!2m5!1sChZDSUhNMG9nS0VJQ0FnSUNoM1pIaVNnEAE!2m1!1s0x0:0x2efa18d922c78ba0!3m1!1s2@1:CIHM0ogKEICAgICh3ZHiSg%7C%7C?hl=id","Program skrining ke smp sewon 2, anak sy dpt rujukan kepoli gigi..jam 09.35an sy sampe disana pendaftaran sudah ditutup/ tdk dilayani..blm ada jam 10 lho pendaftaran kog sdh di close, akhirnya inisiatif ke puskesmas sewon 1, kondisi sama ramainya tp ttp dilayani...monggo yg profesional jgn spt ini..tlng diperbaiki kinerja dam sistemnya"
"Puskesmas Sewon II","https://www.google.com/maps/search/?api=1&query=Puskesmas%20Sewon%20II&query_place_id=ChIJE446Lk9Wei4RoIvHItkY-i4","5","misdi widoyo","https://www.google.com/maps/reviews/data=!4m8!14m7!1m6!2m5!1sChdDSUhNMG9nS0VJQ0FnSUNodWR1UWtBRRAB!2m1!1s0x0:0x2efa18d922c78ba0!3m1!1s2@1:CIHM0ogKEICAgIChuduQkAE%7C%7C?hl=id","Pelayanan cukup baik."
"Puskesmas Sewon II","https://www.google.com/maps/search/?api=1&query=Puskesmas%20Sewon%20II&query_place_id=ChIJE446Lk9Wei4RoIvHItkY-i4","5","mas sawabi","https://www.google.com/maps/reviews/data=!4m8!14m7!1m6!2m5!1sChdDSUhNMG9nS0VJQ0FnSUNodWJQUXZ3RRAB!2m1!1s0x0:0x2efa18d922c78ba0!3m1!1s2@1:CIHM0ogKEICAgIChubPQvwE%7C%7C?hl=id","Gedung baru, bersih, higienis, pelayanan cepat"
"Puskesmas Sewon II","https://www.google.com/maps/search/?api=1&query=Puskesmas%20Sewon%20II&query_place_id=ChIJE446Lk9Wei4RoIvHItkY-i4","1","Vivi Lutfia","https://www.google.com/maps/reviews/data=!4m8!14m7!1m6!2m5!1sChZDSUhNMG9nS0VJQ0FnSUNoX3BTMVlBEAE!2m1!1s0x0:0x2efa18d922c78ba0!3m1!1s2@1:CIHM0ogKEICAgICh_pS1YA%7C%7C?hl=id","Pelayanan ga ramah"
"Puskesmas Sewon II","https://www.google.com/maps/search/?api=1&query=Puskesmas%20Sewon%20II&query_place_id=ChIJE446Lk9Wei4RoIvHItkY-i4","1","Diti Prihanani","https://www.google.com/maps/reviews/data=!4m8!14m7!1m6!2m5!1sChZDSUhNMG9nS0VJQ0FnSURCemFfMmRnEAE!2m1!1s0x0:0x2efa18d922c78ba0!3m1!1s2@1:CIHM0ogKEICAgIDBza_2dg%7C%7C?hl=id",
"Puskesmas Sewon II","https://www.google.com/maps/search/?api=1&query=Puskesmas%20Sewon%20II&query_place_id=ChIJE446Lk9Wei4RoIvHItkY-i4","5","gita gitaa","https://www.google.com/maps/reviews/data=!4m8!14m7!1m6!2m5!1sChdDSUhNMG9nS0VJQ0FnSURCbU8yQmdBRRAB!2m1!1s0x0:0x2efa18d922c78ba0!3m1!1s2@1:CIHM0ogKEICAgIDBmO2BgAE%7C%7C?hl=id","sekarang pelayanannya lebih cepat dan teratur...tempat tunggu jg jadi lebih lega...."
"Puskesmas Sewon II","https://www.google.com/maps/search/?api=1&query=Puskesmas%20Sewon%20II&query_place_id=ChIJE446Lk9Wei4RoIvHItkY-i4","5","Nawawi Wawi","https://www.google.com/maps/reviews/data=!4m8!14m7!1m6!2m5!1sChZDSUhNMG9nS0VJQ0FnSUNCLTh5UFBnEAE!2m1!1s0x0:0x2efa18d922c78ba0!3m1!1s2@1:CIHM0ogKEICAgICB-8yPPg%7C%7C?hl=id",
"Puskesmas Sewon II","https://www.google.com/maps/search/?api=1&query=Puskesmas%20Sewon%20II&query_place_id=ChIJE446Lk9Wei4RoIvHItkY-i4","4","Akhyar Mahmud","https://www.google.com/maps/reviews/data=!4m8!14m7!1m6!2m5!1sChZDSUhNMG9nS0VJQ0FnSUNCbGRxZ1dREAE!2m1!1s0x0:0x2efa18d922c78ba0!3m1!1s2@1:CIHM0ogKEICAgICBldqgWQ%7C%7C?hl=id","Pelayanan lebih ditinggatkan..."
"Puskesmas Sewon II","https://www.google.com/maps/search/?api=1&query=Puskesmas%20Sewon%20II&query_place_id=ChIJE446Lk9Wei4RoIvHItkY-i4","1","Mur Ngatijo","https://www.google.com/maps/reviews/data=!4m8!14m7!1m6!2m5!1sChdDSUhNMG9nS0VJQ0FnSUNCanNTNHdBRRAB!2m1!1s0x0:0x2efa18d922c78ba0!3m1!1s2@1:CIHM0ogKEICAgICBjsS4wAE%7C%7C?hl=id","Ka. Apa bisa pindah rujukan dari RS A ke RS B ? Soal ya di RS A dokternya gak cocok bagi saya?🙏🙏 Mohon. Dijawab dibantu"
"Puskesmas Sewon II","https://www.google.com/maps/search/?api=1&query=Puskesmas%20Sewon%20II&query_place_id=ChIJE446Lk9Wei4RoIvHItkY-i4","1","Monica Anissya","https://www.google.com/maps/reviews/data=!4m8!14m7!1m6!2m5!1sChdDSUhNMG9nS0VJQ0FnSUNCa3IzV193RRAB!2m1!1s0x0:0x2efa18d922c78ba0!3m1!1s2@1:CIHM0ogKEICAgICBkr3W_wE%7C%7C?hl=id","Waktu sakit kesini gak lagi lagi ...Yang jaga di depan nya tidak ramah. mending yang puskemas I ramah ramah ,dari pada puskemas Sewon II bad attitude semua dan pelayanan nya sangat mengecewakan padahal dibayar"
"Puskesmas Sewon II","https://www.google.com/maps/search/?api=1&query=Puskesmas%20Sewon%20II&query_place_id=ChIJE446Lk9Wei4RoIvHItkY-i4","1","Gustaf Williyanta","https://www.google.com/maps/reviews/data=!4m8!14m7!1m6!2m5!1sChZDSUhNMG9nS0VJQ0FnSURlbThXUEZREAE!2m1!1s0x0:0x2efa18d922c78ba0!3m1!1s2@1:CIHM0ogKEICAgIDem8WPFQ%7C%7C?hl=id",
"Puskesmas Sewon II","https://www.google.com/maps/search/?api=1&query=Puskesmas%20Sewon%20II&query_place_id=ChIJE446Lk9Wei4RoIvHItkY-i4","1","Nurul Prastiwi","https://www.google.com/maps/reviews/data=!4m8!14m7!1m6!2m5!1sChdDSUhNMG9nS0VJQ0FnSURlNi1fbTVBRRAB!2m1!1s0x0:0x2efa18d922c78ba0!3m1!1s2@1:CIHM0ogKEICAgIDe6-_m5AE%7C%7C?hl=id","Gak pake bpis tapi pelayanan tidak ramah. Dokternya galak semua"
"Puskesmas Sewon II","https://www.google.com/maps/search/?api=1&query=Puskesmas%20Sewon%20II&query_place_id=ChIJE446Lk9Wei4RoIvHItkY-i4","1","arum nyunyun","https://www.google.com/maps/reviews/data=!4m8!14m7!1m6!2m5!1sChdDSUhNMG9nS0VJQ0FnSURlOGQzSGtRRRAB!2m1!1s0x0:0x2efa18d922c78ba0!3m1!1s2@1:CIHM0ogKEICAgIDe8d3HkQE%7C%7C?hl=id","Periksa hamil hanya dipegang pegang dan diukur segala macem dengan terburu buru, hasil pemeriksaan bagaimana tidak dijelaskan.
Periksa flu pilek dan demam hanya sekedar ditanta tanya lalu diberikan obat, tanpa diperiksa apapun
Minta tolong dibuatkan surat izin istirahat dari dokter hanya diberikan surat keterangan dokter saja. Mengecewakan. Tidak memuaskan. Kapok ga mau ke puskesmas lagi"
"Puskesmas Sewon II","https://www.google.com/maps/search/?api=1&query=Puskesmas%20Sewon%20II&query_place_id=ChIJE446Lk9Wei4RoIvHItkY-i4","2","murottal chanel","https://www.google.com/maps/reviews/data=!4m8!14m7!1m6!2m5!1sChZDSUhNMG9nS0VJQ0FnSUNlNTh2bGNREAE!2m1!1s0x0:0x2efa18d922c78ba0!3m1!1s2@1:CIHM0ogKEICAgICe58vlcQ%7C%7C?hl=id","Mengecewakan mau perisa hamil malah ngantri lama tempat pasien umum nunggu berjam jam tidak rekomendit"
"Puskesmas Sewon II","https://www.google.com/maps/search/?api=1&query=Puskesmas%20Sewon%20II&query_place_id=ChIJE446Lk9Wei4RoIvHItkY-i4","5","Kay Nazarite","https://www.google.com/maps/reviews/data=!4m8!14m7!1m6!2m5!1sChdDSUhNMG9nS0VJQ0FnSUNlZzR5ajJ3RRAB!2m1!1s0x0:0x2efa18d922c78ba0!3m1!1s2@1:CIHM0ogKEICAgICeg4yj2wE%7C%7C?hl=id",
"Puskesmas Sewon II","https://www.google.com/maps/search/?api=1&query=Puskesmas%20Sewon%20II&query_place_id=ChIJE446Lk9Wei4RoIvHItkY-i4","1","Khrisda Andriani","https://www.google.com/maps/reviews/data=!4m8!14m7!1m6!2m5!1sChZDSUhNMG9nS0VJQ0FnSUNldFkzS1BBEAE!2m1!1s0x0:0x2efa18d922c78ba0!3m1!1s2@1:CIHM0ogKEICAgICetY3KPA%7C%7C?hl=id","Pelayanan sangat tidak memuaskan, tidak ramah jutek galak tidak memberi arahan yang jelek, apalagi bagian skrining yng di depan full tidak ramah. Kapok ke puskesmas"
"Puskesmas Sewon II","https://www.google.com/maps/search/?api=1&query=Puskesmas%20Sewon%20II&query_place_id=ChIJE446Lk9Wei4RoIvHItkY-i4","1","kindri wierniati","https://www.google.com/maps/reviews/data=!4m8!14m7!1m6!2m5!1sChdDSUhNMG9nS0VJQ0FnSUN1cDd2QXFnRRAB!2m1!1s0x0:0x2efa18d922c78ba0!3m1!1s2@1:CIHM0ogKEICAgICup7vAqgE%7C%7C?hl=id","PELAYANAN BURUK SEKALI. INFO SIMPANG SIUR, TIDAK FLEKSIBEL DAN KAKU"
"Puskesmas Sewon II","https://www.google.com/maps/search/?api=1&query=Puskesmas%20Sewon%20II&query_place_id=ChIJE446Lk9Wei4RoIvHItkY-i4","3","Riska Fitri Nur Ainy","https://www.google.com/maps/reviews/data=!4m8!14m7!1m6!2m5!1sChZDSUhNMG9nS0VJQ0FnSURPbzYtcUFREAE!2m1!1s0x0:0x2efa18d922c78ba0!3m1!1s2@1:CIHM0ogKEICAgIDOo6-qAQ%7C%7C?hl=id",
"Puskesmas Sewon II","https://www.google.com/maps/search/?api=1&query=Puskesmas%20Sewon%20II&query_place_id=ChIJE446Lk9Wei4RoIvHItkY-i4","2","yulia aniskasari","https://www.google.com/maps/reviews/data=!4m8!14m7!1m6!2m5!1sChZDSUhNMG9nS0VJQ0FnSURPaXZDU2R3EAE!2m1!1s0x0:0x2efa18d922c78ba0!3m1!1s2@1:CIHM0ogKEICAgIDOivCSdw%7C%7C?hl=id","3 bulan lalu.. Bagian pelayanan pendaftaran tidak memuaskan. Jutek, kurang ramah, Mohon diperbaiki."
"Puskesmas Sewon II","https://www.google.com/maps/search/?api=1&query=Puskesmas%20Sewon%20II&query_place_id=ChIJE446Lk9Wei4RoIvHItkY-i4","1","vp pngstk","https://www.google.com/maps/reviews/data=!4m8!14m7!1m6!2m5!1sChdDSUhNMG9nS0VJQ0FnSUNPel9tVGtBRRAB!2m1!1s0x0:0x2efa18d922c78ba0!3m1!1s2@1:CIHM0ogKEICAgICOz_mTkAE%7C%7C?hl=id","apa guna nya punya nomer telpon kalau ditelpon berkali-kali ga diangkat"
"Puskesmas Sewon II","https://www.google.com/maps/search/?api=1&query=Puskesmas%20Sewon%20II&query_place_id=ChIJE446Lk9Wei4RoIvHItkY-i4","4","Shobat Ridwan","https://www.google.com/maps/reviews/data=!4m8!14m7!1m6!2m5!1sChZDSUhNMG9nS0VJQ0FnSUQyeThDM0FnEAE!2m1!1s0x0:0x2efa18d922c78ba0!3m1!1s2@1:CIHM0ogKEICAgID2y8C3Ag%7C%7C?hl=id",
"Puskesmas Sewon II","https://www.google.com/maps/search/?api=1&query=Puskesmas%20Sewon%20II&query_place_id=ChIJE446Lk9Wei4RoIvHItkY-i4","5","muhammad zhafran","https://www.google.com/maps/reviews/data=!4m8!14m7!1m6!2m5!1sChZDSUhNMG9nS0VJQ0FnSUQyeThERmZBEAE!2m1!1s0x0:0x2efa18d922c78ba0!3m1!1s2@1:CIHM0ogKEICAgID2y8DFfA%7C%7C?hl=id","Good place"
"Puskesmas Sewon II","https://www.google.com/maps/search/?api=1&query=Puskesmas%20Sewon%20II&query_place_id=ChIJE446Lk9Wei4RoIvHItkY-i4","1","Estri Meiastuti","https://www.google.com/maps/reviews/data=!4m8!14m7!1m6!2m5!1sChdDSUhNMG9nS0VJQ0FnSUQybXNDOHh3RRAB!2m1!1s0x0:0x2efa18d922c78ba0!3m1!1s2@1:CIHM0ogKEICAgID2msC8xwE%7C%7C?hl=id","Pertama kali datang ke sini, Pelayanan lama dan Kasir yg tidak ramah!!"
"Puskesmas Sewon II","https://www.google.com/maps/search/?api=1&query=Puskesmas%20Sewon%20II&query_place_id=ChIJE446Lk9Wei4RoIvHItkY-i4","5","Farras Widya Izadi","https://www.google.com/maps/reviews/data=!4m8!14m7!1m6!2m5!1sChdDSUhNMG9nS0VJQ0FnSUMyaDdLeXNBRRAB!2m1!1s0x0:0x2efa18d922c78ba0!3m1!1s2@1:CIHM0ogKEICAgIC2h7KysAE%7C%7C?hl=id","Mantap, vaksin disini cepet banget. Dateng jam 7.40 jam 8.05 uda beres. Pelayanannya ramah dan memuaskan👍"
"Puskesmas Sewon II","https://www.google.com/maps/search/?api=1&query=Puskesmas%20Sewon%20II&query_place_id=ChIJE446Lk9Wei4RoIvHItkY-i4","5","Niken Asmoro","https://www.google.com/maps/reviews/data=!4m8!14m7!1m6!2m5!1sChdDSUhNMG9nS0VJQ0FnSUMydmJmWWx3RRAB!2m1!1s0x0:0x2efa18d922c78ba0!3m1!1s2@1:CIHM0ogKEICAgIC2vbfYlwE%7C%7C?hl=id","Pelayanan memuaskan"
"Puskesmas Sewon II","https://www.google.com/maps/search/?api=1&query=Puskesmas%20Sewon%20II&query_place_id=ChIJE446Lk9Wei4RoIvHItkY-i4","4","nurul dwim","https://www.google.com/maps/reviews/data=!4m8!14m7!1m6!2m5!1sChdDSUhNMG9nS0VJQ0FnSUMyNWVHcDhRRRAB!2m1!1s0x0:0x2efa18d922c78ba0!3m1!1s2@1:CIHM0ogKEICAgIC25eGp8QE%7C%7C?hl=id","Pendaftaran imunisasi sudah dipisah dari pasien umum. Sebaiknya timbangan bayi bisa ditingkatkan dengan timbangan digital dan alat pengukuran panjang bayi menggunakan anthropometri yang standart, sehingga lebih akurat."
"Puskesmas Sewon II","https://www.google.com/maps/search/?api=1&query=Puskesmas%20Sewon%20II&query_place_id=ChIJE446Lk9Wei4RoIvHItkY-i4","5","Hasa Rohadi","https://www.google.com/maps/reviews/data=!4m8!14m7!1m6!2m5!1sChdDSUhNMG9nS0VJQ0FnSUMydHBuTDh3RRAB!2m1!1s0x0:0x2efa18d922c78ba0!3m1!1s2@1:CIHM0ogKEICAgIC2tpnL8wE%7C%7C?hl=id",
"Puskesmas Sewon II","https://www.google.com/maps/search/?api=1&query=Puskesmas%20Sewon%20II&query_place_id=ChIJE446Lk9Wei4RoIvHItkY-i4","5","Wara Susanti","https://www.google.com/maps/reviews/data=!4m8!14m7!1m6!2m5!1sChdDSUhNMG9nS0VJQ0FnSUMybHVEcXpRRRAB!2m1!1s0x0:0x2efa18d922c78ba0!3m1!1s2@1:CIHM0ogKEICAgIC2luDqzQE%7C%7C?hl=id","Pelayanan sangat baik, cepat dan ramah"
"Puskesmas Sewon II","https://www.google.com/maps/search/?api=1&query=Puskesmas%20Sewon%20II&query_place_id=ChIJE446Lk9Wei4RoIvHItkY-i4","5","Harun Al Rasyid","https://www.google.com/maps/reviews/data=!4m8!14m7!1m6!2m5!1sChZDSUhNMG9nS0VJQ0FnSUMycG82YlRBEAE!2m1!1s0x0:0x2efa18d922c78ba0!3m1!1s2@1:CIHM0ogKEICAgIC2po6bTA%7C%7C?hl=id",
"Puskesmas Sewon II","https://www.google.com/maps/search/?api=1&query=Puskesmas%20Sewon%20II&query_place_id=ChIJE446Lk9Wei4RoIvHItkY-i4","5","R Harto","https://www.google.com/maps/reviews/data=!4m8!14m7!1m6!2m5!1sChZDSUhNMG9nS0VJQ0FnSUMyeHFPbmNBEAE!2m1!1s0x0:0x2efa18d922c78ba0!3m1!1s2@1:CIHM0ogKEICAgIC2xqOncA%7C%7C?hl=id","Pelayanannya sangat baik dan memuaskan. Semoga selalu dipertahankan"
"Puskesmas Sewon II","https://www.google.com/maps/search/?api=1&query=Puskesmas%20Sewon%20II&query_place_id=ChIJE446Lk9Wei4RoIvHItkY-i4","5","ainur rofik","https://www.google.com/maps/reviews/data=!4m8!14m7!1m6!2m5!1sChZDSUhNMG9nS0VJQ0FnSUMyeHNtZ1V3EAE!2m1!1s0x0:0x2efa18d922c78ba0!3m1!1s2@1:CIHM0ogKEICAgIC2xsmgUw%7C%7C?hl=id","sae... 👌👍...."
"Puskesmas Sewon II","https://www.google.com/maps/search/?api=1&query=Puskesmas%20Sewon%20II&query_place_id=ChIJE446Lk9Wei4RoIvHItkY-i4","5","Muhammad Za'im","https://www.google.com/maps/reviews/data=!4m8!14m7!1m6!2m5!1sChdDSUhNMG9nS0VJQ0FnSUMyeHRIMjlRRRAB!2m1!1s0x0:0x2efa18d922c78ba0!3m1!1s2@1:CIHM0ogKEICAgIC2xtH29QE%7C%7C?hl=id","Puskesmas Sewon 2 memang top markotop joossss tenaannn.....👍👍👍"
"Puskesmas Sewon II","https://www.google.com/maps/search/?api=1&query=Puskesmas%20Sewon%20II&query_place_id=ChIJE446Lk9Wei4RoIvHItkY-i4","4","Eny Sri Haryati","https://www.google.com/maps/reviews/data=!4m8!14m7!1m6!2m5!1sChdDSUhNMG9nS0VJQ0FnSUMyeG9hQzFBRRAB!2m1!1s0x0:0x2efa18d922c78ba0!3m1!1s2@1:CIHM0ogKEICAgIC2xoaC1AE%7C%7C?hl=id","Pelayanan cukup Bagus. Mantap"
"Puskesmas Sewon II","https://www.google.com/maps/search/?api=1&query=Puskesmas%20Sewon%20II&query_place_id=ChIJE446Lk9Wei4RoIvHItkY-i4","5","Zainal Arifin","https://www.google.com/maps/reviews/data=!4m8!14m7!1m6!2m5!1sChdDSUhNMG9nS0VJQ0FnSUMyeHJLc2tRRRAB!2m1!1s0x0:0x2efa18d922c78ba0!3m1!1s2@1:CIHM0ogKEICAgIC2xrKskQE%7C%7C?hl=id",
"Puskesmas Sewon II","https://www.google.com/maps/search/?api=1&query=Puskesmas%20Sewon%20II&query_place_id=ChIJE446Lk9Wei4RoIvHItkY-i4","5","PONIJA SAJA","https://www.google.com/maps/reviews/data=!4m8!14m7!1m6!2m5!1sChdDSUhNMG9nS0VJQ0FnSUMyaHBfZC1BRRAB!2m1!1s0x0:0x2efa18d922c78ba0!3m1!1s2@1:CIHM0ogKEICAgIC2hp_d-AE%7C%7C?hl=id","pelayanan cepat dan ramah on time"
"Puskesmas Sewon II","https://www.google.com/maps/search/?api=1&query=Puskesmas%20Sewon%20II&query_place_id=ChIJE446Lk9Wei4RoIvHItkY-i4","5","suhartiyo yoyok","https://www.google.com/maps/reviews/data=!4m8!14m7!1m6!2m5!1sChZDSUhNMG9nS0VJQ0FnSUMyaHU2OVZnEAE!2m1!1s0x0:0x2efa18d922c78ba0!3m1!1s2@1:CIHM0ogKEICAgIC2hu69Vg%7C%7C?hl=id","Pelaksanaan vaksin miningitis sangat bagus pelayananya"
"Puskesmas Sewon II","https://www.google.com/maps/search/?api=1&query=Puskesmas%20Sewon%20II&query_place_id=ChIJE446Lk9Wei4RoIvHItkY-i4","5","siti alfiah","https://www.google.com/maps/reviews/data=!4m8!14m7!1m6!2m5!1sChdDSUhNMG9nS0VJQ0FnSUMyaHJycndBRRAB!2m1!1s0x0:0x2efa18d922c78ba0!3m1!1s2@1:CIHM0ogKEICAgIC2hrrrwAE%7C%7C?hl=id","Pelayanannya sudah baik mhn dipertahankan ."
"Puskesmas Sewon II","https://www.google.com/maps/search/?api=1&query=Puskesmas%20Sewon%20II&query_place_id=ChIJE446Lk9Wei4RoIvHItkY-i4","5","ismediyono yono","https://www.google.com/maps/reviews/data=!4m8!14m7!1m6!2m5!1sChdDSUhNMG9nS0VJQ0FnSUMyaHJxUWxBRRAB!2m1!1s0x0:0x2efa18d922c78ba0!3m1!1s2@1:CIHM0ogKEICAgIC2hrqQlAE%7C%7C?hl=id","Pelayanan bagus sekali, petugasnya ramah- ramah dan care"
"Puskesmas Sewon II","https://www.google.com/maps/search/?api=1&query=Puskesmas%20Sewon%20II&query_place_id=ChIJE446Lk9Wei4RoIvHItkY-i4","5","Fika Faratri","https://www.google.com/maps/reviews/data=!4m8!14m7!1m6!2m5!1sChZDSUhNMG9nS0VJQ0FnSUMyaHVxdFd3EAE!2m1!1s0x0:0x2efa18d922c78ba0!3m1!1s2@1:CIHM0ogKEICAgIC2huqtWw%7C%7C?hl=id",
"Puskesmas Sewon II","https://www.google.com/maps/search/?api=1&query=Puskesmas%20Sewon%20II&query_place_id=ChIJE446Lk9Wei4RoIvHItkY-i4","5","Intan Nida Aulia","https://www.google.com/maps/reviews/data=!4m8!14m7!1m6!2m5!1sChdDSUhNMG9nS0VJQ0FnSUMyaHZLZndRRRAB!2m1!1s0x0:0x2efa18d922c78ba0!3m1!1s2@1:CIHM0ogKEICAgIC2hvKfwQE%7C%7C?hl=id","Melayani dengan hati 🤗👍"
"Puskesmas Sewon II","https://www.google.com/maps/search/?api=1&query=Puskesmas%20Sewon%20II&query_place_id=ChIJE446Lk9Wei4RoIvHItkY-i4","5","Nabil Ahmad Febriano","https://www.google.com/maps/reviews/data=!4m8!14m7!1m6!2m5!1sChdDSUhNMG9nS0VJQ0FnSUMyaHBLa3lBRRAB!2m1!1s0x0:0x2efa18d922c78ba0!3m1!1s2@1:CIHM0ogKEICAgIC2hpKkyAE%7C%7C?hl=id","Pelayanany sangat ramah"
"Puskesmas Sewon II","https://www.google.com/maps/search/?api=1&query=Puskesmas%20Sewon%20II&query_place_id=ChIJE446Lk9Wei4RoIvHItkY-i4","1","Rizky Hermawan _Joglo","https://www.google.com/maps/reviews/data=!4m8!14m7!1m6!2m5!1sChZDSUhNMG9nS0VJQ0FnSUMyaHZpaGRREAE!2m1!1s0x0:0x2efa18d922c78ba0!3m1!1s2@1:CIHM0ogKEICAgIC2hvihdQ%7C%7C?hl=id","Pelayanan lama dan kurang ramah dengan pasien"
"Puskesmas Sewon II","https://www.google.com/maps/search/?api=1&query=Puskesmas%20Sewon%20II&query_place_id=ChIJE446Lk9Wei4RoIvHItkY-i4","5","Muhammad Fauzi Saputro","https://www.google.com/maps/reviews/data=!4m8!14m7!1m6!2m5!1sChdDSUhNMG9nS0VJQ0FnSUMyaHNEXzl3RRAB!2m1!1s0x0:0x2efa18d922c78ba0!3m1!1s2@1:CIHM0ogKEICAgIC2hsD_9wE%7C%7C?hl=id","Pelayanan semakin baik"
"Puskesmas Sewon II","https://www.google.com/maps/search/?api=1&query=Puskesmas%20Sewon%20II&query_place_id=ChIJE446Lk9Wei4RoIvHItkY-i4","5","Eni Setyawati","https://www.google.com/maps/reviews/data=!4m8!14m7!1m6!2m5!1sChZDSUhNMG9nS0VJQ0FnSURXMGRIb2ZBEAE!2m1!1s0x0:0x2efa18d922c78ba0!3m1!1s2@1:CIHM0ogKEICAgIDW0dHofA%7C%7C?hl=id","Alhamdulillah tempatnya bersih, pelayanan baik,  pegawai nya sopan dan ramah.  Area sekarang lebih luas setelah direnovasi."
"Puskesmas Sewon II","https://www.google.com/maps/search/?api=1&query=Puskesmas%20Sewon%20II&query_place_id=ChIJE446Lk9Wei4RoIvHItkY-i4","5","Irdam Priadi","https://www.google.com/maps/reviews/data=!4m8!14m7!1m6!2m5!1sChZDSUhNMG9nS0VJQ0FnSURXbE95TlRnEAE!2m1!1s0x0:0x2efa18d922c78ba0!3m1!1s2@1:CIHM0ogKEICAgIDWlOyNTg%7C%7C?hl=id","vaksin booster gercep,pelayanan ramah,ruang tunggu luas,teduh"
"Puskesmas Sewon II","https://www.google.com/maps/search/?api=1&query=Puskesmas%20Sewon%20II&query_place_id=ChIJE446Lk9Wei4RoIvHItkY-i4","1","Dhani","https://www.google.com/maps/reviews/data=!4m8!14m7!1m6!2m5!1sChZDSUhNMG9nS0VJQ0FnSUNXX2Z1NlJREAE!2m1!1s0x0:0x2efa18d922c78ba0!3m1!1s2@1:CIHM0ogKEICAgICW_fu6RQ%7C%7C?hl=id","Setelah pendaftaran suruh menunggu panggilan dari kasir, padahal di bagian kasir tidak ada orang. Terpaksa harus menunggu lama. !!!"
"Puskesmas Sewon II","https://www.google.com/maps/search/?api=1&query=Puskesmas%20Sewon%20II&query_place_id=ChIJE446Lk9Wei4RoIvHItkY-i4","1","Reza Pahlawan","https://www.google.com/maps/reviews/data=!4m8!14m7!1m6!2m5!1sChZDSUhNMG9nS0VJQ0FnSUNXa1piX1NREAE!2m1!1s0x0:0x2efa18d922c78ba0!3m1!1s2@1:CIHM0ogKEICAgICWkZb_SQ%7C%7C?hl=id","ke puskesmas disuruh tes pcr, gratis, hasil nya tpi g tau kapan, tes digunakan untuk segera tau hasilnya kemudian diberikan penanganan obat dll, apa gunanya tes hasil lama? yang ada orang sudah kesakitan, antivirus datang sudah H+3 sudah g ada guna diminum, kasihan sungguh kasihan, yang tidak ada biaya dan bisanya kepuskesmas semoga segera di berikan ksembuhan, yang punya sedikit uang relakan untuk priksa di RS yg paten agar segera diberikan penanganan"
