"title","url","stars","name","reviewUrl","text"
"Puskesmas Sewon II","https://www.google.com/maps/search/?api=1&query=Puskesmas%20Sewon%20II&query_place_id=ChIJE446Lk9Wei4RoIvHItkY-i4","1","Nazuha Salsabila","https://www.google.com/maps/reviews/data=!4m8!14m7!1m6!2m5!1sChdDSUhNMG9nS0VJQ0FnSURiNXJ1R2dnRRAB!2m1!1s0x0:0x2efa18d922c78ba0!3m1!1s2@1:CIHM0ogKEICAgIDb5ruGggE%7C%7C?hl=id","pelayanannya lama dateng jam 7.30 sampe jam 9.16 blom dipanggil panggil juga padahal cuma minta surat keterangan sehat buat Lamar kerja"
"Puskesmas Sewon II","https://www.google.com/maps/search/?api=1&query=Puskesmas%20Sewon%20II&query_place_id=ChIJE446Lk9Wei4RoIvHItkY-i4","5","vivin mahendra","https://www.google.com/maps/reviews/data=!4m8!14m7!1m6!2m5!1sChdDSUhNMG9nS0VJQ0FnSUNiNjVXVXpBRRAB!2m1!1s0x0:0x2efa18d922c78ba0!3m1!1s2@1:CIHM0ogKEICAgICb65WUzAE%7C%7C?hl=id","Priksa gigi ga perlu antri lama... Ruangan jg nyaman, petugas ramah"
"Puskesmas Sewon II","https://www.google.com/maps/search/?api=1&query=Puskesmas%20Sewon%20II&query_place_id=ChIJE446Lk9Wei4RoIvHItkY-i4","5","Arnindya Ayu N. K. A.","https://www.google.com/maps/reviews/data=!4m8!14m7!1m6!2m5!1sChZDSUhNMG9nS0VJQ0FnSUNiMmJHMFZnEAE!2m1!1s0x0:0x2efa18d922c78ba0!3m1!1s2@1:CIHM0ogKEICAgICb2bG0Vg%7C%7C?hl=id","Respon dan pelayanan yang ramah dan edukatif. Memberi informasi tentang abate. Terima kasih pelayanannya"
"Puskesmas Sewon II","https://www.google.com/maps/search/?api=1&query=Puskesmas%20Sewon%20II&query_place_id=ChIJE446Lk9Wei4RoIvHItkY-i4","5","Anestri Lintang Rachmawati","https://www.google.com/maps/reviews/data=!4m8!14m7!1m6!2m5!1sChZDSUhNMG9nS0VJQ0FnSUNycy1EVkR3EAE!2m1!1s0x0:0x2efa18d922c78ba0!3m1!1s2@1:CIHM0ogKEICAgICrs-DVDw%7C%7C?hl=id","sangat responsif dan welcome bangettt, rispekk"
"Puskesmas Sewon II","https://www.google.com/maps/search/?api=1&query=Puskesmas%20Sewon%20II&query_place_id=ChIJE446Lk9Wei4RoIvHItkY-i4","5","Andi Risdianto","https://www.google.com/maps/reviews/data=!4m8!14m7!1m6!2m5!1sChZDSUhNMG9nS0VJQ0FnSUNyczREM0ZBEAE!2m1!1s0x0:0x2efa18d922c78ba0!3m1!1s2@1:CIHM0ogKEICAgICrs4D3FA%7C%7C?hl=id","Mantapp"
"Puskesmas Sewon II","https://www.google.com/maps/search/?api=1&query=Puskesmas%20Sewon%20II&query_place_id=ChIJE446Lk9Wei4RoIvHItkY-i4","1","Defri Restu","https://www.google.com/maps/reviews/data=!4m8!14m7!1m6!2m5!1sChdDSUhNMG9nS0VJQ0FnSUNyelphVm9RRRAB!2m1!1s0x0:0x2efa18d922c78ba0!3m1!1s2@1:CIHM0ogKEICAgICrzZaVoQE%7C%7C?hl=id","Buka jam 07.30, sampe sini jam 07.30 langsung pendaftaran, habis itu nunggu karna belum siap staffnya, nunggu lama apakah bukanya jam 08.00?"
"Puskesmas Sewon II","https://www.google.com/maps/search/?api=1&query=Puskesmas%20Sewon%20II&query_place_id=ChIJE446Lk9Wei4RoIvHItkY-i4","5","S Wardono","https://www.google.com/maps/reviews/data=!4m8!14m7!1m6!2m5!1sChZDSUhNMG9nS0VJQ0FnSUNyX0pEZ1dnEAE!2m1!1s0x0:0x2efa18d922c78ba0!3m1!1s2@1:CIHM0ogKEICAgICr_JDgWg%7C%7C?hl=id","Pelayananya cukup baik"
"Puskesmas Sewon II","https://www.google.com/maps/search/?api=1&query=Puskesmas%20Sewon%20II&query_place_id=ChIJE446Lk9Wei4RoIvHItkY-i4","1","Ihsan Lisin","https://www.google.com/maps/reviews/data=!4m8!14m7!1m6!2m5!1sChdDSUhNMG9nS0VJQ0FnSURMcV9xaHdBRRAB!2m1!1s0x0:0x2efa18d922c78ba0!3m1!1s2@1:CIHM0ogKEICAgIDLq_qhwAE%7C%7C?hl=id","Kalau ada kenalan langsung tensi langsung masuk ruang periksa tanpa peduli no antrian berapa"
"Puskesmas Sewon II","https://www.google.com/maps/search/?api=1&query=Puskesmas%20Sewon%20II&query_place_id=ChIJE446Lk9Wei4RoIvHItkY-i4","5","Hatin iswara","https://www.google.com/maps/reviews/data=!4m8!14m7!1m6!2m5!1sChdDSUhNMG9nS0VJQ0FnSURMa2EydXl3RRAB!2m1!1s0x0:0x2efa18d922c78ba0!3m1!1s2@1:CIHM0ogKEICAgIDLka2uywE%7C%7C?hl=id",
"Puskesmas Sewon II","https://www.google.com/maps/search/?api=1&query=Puskesmas%20Sewon%20II&query_place_id=ChIJE446Lk9Wei4RoIvHItkY-i4","5","HERMAN YOHANES","https://www.google.com/maps/reviews/data=!4m8!14m7!1m6!2m5!1sChdDSUhNMG9nS0VJQ0FnSURMbUpLNy1BRRAB!2m1!1s0x0:0x2efa18d922c78ba0!3m1!1s2@1:CIHM0ogKEICAgIDLmJK7-AE%7C%7C?hl=id","Pelayanan farmasi dan pelayanan kasir ramah .. tingkatkan keramahannya"
"Puskesmas Sewon II","https://www.google.com/maps/search/?api=1&query=Puskesmas%20Sewon%20II&query_place_id=ChIJE446Lk9Wei4RoIvHItkY-i4","1","FATKHAN ROI AKBAR","https://www.google.com/maps/reviews/data=!4m8!14m7!1m6!2m5!1sChZDSUhNMG9nS0VJQ0FnSUNMel9QU2VBEAE!2m1!1s0x0:0x2efa18d922c78ba0!3m1!1s2@1:CIHM0ogKEICAgICLz_PSeA%7C%7C?hl=id","pelayanannya cepat"
"Puskesmas Sewon II","https://www.google.com/maps/search/?api=1&query=Puskesmas%20Sewon%20II&query_place_id=ChIJE446Lk9Wei4RoIvHItkY-i4","5","Abellia Jefrina","https://www.google.com/maps/reviews/data=!4m8!14m7!1m6!2m5!1sChZDSUhNMG9nS0VJQ0FnSUNMdFpteEdBEAE!2m1!1s0x0:0x2efa18d922c78ba0!3m1!1s2@1:CIHM0ogKEICAgICLtZmxGA%7C%7C?hl=id","Pelayanan sangat ramah , mudah , dan cepat"
"Puskesmas Sewon II","https://www.google.com/maps/search/?api=1&query=Puskesmas%20Sewon%20II&query_place_id=ChIJE446Lk9Wei4RoIvHItkY-i4","5","Athif Mahendra","https://www.google.com/maps/reviews/data=!4m8!14m7!1m6!2m5!1sChdDSUhNMG9nS0VJQ0FnSUNMaWNqT2xnRRAB!2m1!1s0x0:0x2efa18d922c78ba0!3m1!1s2@1:CIHM0ogKEICAgICLicjOlgE%7C%7C?hl=id","Bersih dan servicenya oke"
"Puskesmas Sewon II","https://www.google.com/maps/search/?api=1&query=Puskesmas%20Sewon%20II&query_place_id=ChIJE446Lk9Wei4RoIvHItkY-i4","5","Andi Risdianto","https://www.google.com/maps/reviews/data=!4m8!14m7!1m6!2m5!1sChZDSUhNMG9nS0VJQ0FnSUNMc2JYYVJ3EAE!2m1!1s0x0:0x2efa18d922c78ba0!3m1!1s2@1:CIHM0ogKEICAgICLsbXaRw%7C%7C?hl=id","Responnya cepat!!!"
"Puskesmas Sewon II","https://www.google.com/maps/search/?api=1&query=Puskesmas%20Sewon%20II&query_place_id=ChIJE446Lk9Wei4RoIvHItkY-i4","5","Tegar Aji","https://www.google.com/maps/reviews/data=!4m8!14m7!1m6!2m5!1sChZDSUhNMG9nS0VJQ0FnSUNMMGN1dkVREAE!2m1!1s0x0:0x2efa18d922c78ba0!3m1!1s2@1:CIHM0ogKEICAgICL0cuvEQ%7C%7C?hl=id","Pelayanan bagus"
"Puskesmas Sewon II","https://www.google.com/maps/search/?api=1&query=Puskesmas%20Sewon%20II&query_place_id=ChIJE446Lk9Wei4RoIvHItkY-i4","5","wahyudi nugroho","https://www.google.com/maps/reviews/data=!4m8!14m7!1m6!2m5!1sChZDSUhNMG9nS0VJQ0FnSUNMMGNQWFV3EAE!2m1!1s0x0:0x2efa18d922c78ba0!3m1!1s2@1:CIHM0ogKEICAgICL0cPXUw%7C%7C?hl=id",
"Puskesmas Sewon II","https://www.google.com/maps/search/?api=1&query=Puskesmas%20Sewon%20II&query_place_id=ChIJE446Lk9Wei4RoIvHItkY-i4","5","Masha Allah","https://www.google.com/maps/reviews/data=!4m8!14m7!1m6!2m5!1sChZDSUhNMG9nS0VJQ0FnSUNMa1pUZlVBEAE!2m1!1s0x0:0x2efa18d922c78ba0!3m1!1s2@1:CIHM0ogKEICAgICLkZTfUA%7C%7C?hl=id","Ruang poli giginya luas, dan nyaman. Setelah pendaftaran, langsung masuk ke poli gigi karena pas tidak ramai."
"Puskesmas Sewon II","https://www.google.com/maps/search/?api=1&query=Puskesmas%20Sewon%20II&query_place_id=ChIJE446Lk9Wei4RoIvHItkY-i4","4","Idha Ningrum","https://www.google.com/maps/reviews/data=!4m8!14m7!1m6!2m5!1sChZDSUhNMG9nS0VJQ0FnSUNMNGVLWlN3EAE!2m1!1s0x0:0x2efa18d922c78ba0!3m1!1s2@1:CIHM0ogKEICAgICL4eKZSw%7C%7C?hl=id","Pelayanan bapak berkacamata di pendaftaran best bintang 100"
"Puskesmas Sewon II","https://www.google.com/maps/search/?api=1&query=Puskesmas%20Sewon%20II&query_place_id=ChIJE446Lk9Wei4RoIvHItkY-i4","1","Wardana Beck","https://www.google.com/maps/reviews/data=!4m8!14m7!1m6!2m5!1sChZDSUhNMG9nS0VJQ0FnSUR6LWMzNUtBEAE!2m1!1s0x0:0x2efa18d922c78ba0!3m1!1s2@1:CIHM0ogKEICAgIDz-c35KA%7C%7C?hl=id","Masak outdoor ac di kasih di depan penunggu anak bikin gak nyaman buat nunggu , padahal bawa bayi harusnya di kasih di luar agak jauh"
"Puskesmas Sewon II","https://www.google.com/maps/search/?api=1&query=Puskesmas%20Sewon%20II&query_place_id=ChIJE446Lk9Wei4RoIvHItkY-i4","5","Islhakhul Latifah","https://www.google.com/maps/reviews/data=!4m8!14m7!1m6!2m5!1sChdDSUhNMG9nS0VJQ0FnSUN6ODRHWnZnRRAB!2m1!1s0x0:0x2efa18d922c78ba0!3m1!1s2@1:CIHM0ogKEICAgICz84GZvgE%7C%7C?hl=id","Pelayanan sangat bagus dan kewajaran biaya / tarif terhitung murah, kompetensi / kemampuan petugas dalam melayani sangat kompeten."
"Puskesmas Sewon II","https://www.google.com/maps/search/?api=1&query=Puskesmas%20Sewon%20II&query_place_id=ChIJE446Lk9Wei4RoIvHItkY-i4","5","Salfa Della","https://www.google.com/maps/reviews/data=!4m8!14m7!1m6!2m5!1sChdDSUhNMG9nS0VJQ0FnSUN6ODc2RXBnRRAB!2m1!1s0x0:0x2efa18d922c78ba0!3m1!1s2@1:CIHM0ogKEICAgICz876EpgE%7C%7C?hl=id","pelayanan sangat bagus dan cepat perawat di puskesmas sewon 2 sangat ramah dan sopan"
"Puskesmas Sewon II","https://www.google.com/maps/search/?api=1&query=Puskesmas%20Sewon%20II&query_place_id=ChIJE446Lk9Wei4RoIvHItkY-i4","1","Aprillio Akbar","https://www.google.com/maps/reviews/data=!4m8!14m7!1m6!2m5!1sChZDSUhNMG9nS0VJQ0FnSUN6NVBhV01REAE!2m1!1s0x0:0x2efa18d922c78ba0!3m1!1s2@1:CIHM0ogKEICAgICz5PaWMQ%7C%7C?hl=id","Tingkat pelayanan masih buruk dan tidak ada peningkatan yg signifikan. Skrining awal tidak langsung mengklasifikasikan pasien harus masuk antrean poli apa, yg mengakibatkan pasien harus antri 2x yg tentu saja membuang waktu pasien untuk antri."
"Puskesmas Sewon II","https://www.google.com/maps/search/?api=1&query=Puskesmas%20Sewon%20II&query_place_id=ChIJE446Lk9Wei4RoIvHItkY-i4","1","Esra Sinaga","https://www.google.com/maps/reviews/data=!4m8!14m7!1m6!2m5!1sChZDSUhNMG9nS0VJQ0FnSURUbDd1bEt3EAE!2m1!1s0x0:0x2efa18d922c78ba0!3m1!1s2@1:CIHM0ogKEICAgIDTl7ulKw%7C%7C?hl=id","MASAK SCALING GIGI DIMINTA DUIT PDHL DH JELAS TERCOVER BPJS
dan saya pernah minta surat rujukan dipersulitnya minta ampunnn👏👏👏"
"Puskesmas Sewon II","https://www.google.com/maps/search/?api=1&query=Puskesmas%20Sewon%20II&query_place_id=ChIJE446Lk9Wei4RoIvHItkY-i4","1","Arfian Rega","https://www.google.com/maps/reviews/data=!4m8!14m7!1m6!2m5!1sChdDSUhNMG9nS0VJQ0FnSUNqM3ZDQnl3RRAB!2m1!1s0x0:0x2efa18d922c78ba0!3m1!1s2@1:CIHM0ogKEICAgICj3vCBywE%7C%7C?hl=id","Pelayanan buruk, lelet! Tidak ada kursi tunggu untuk pasien. Ndaftar jam 8 baru diperiksa jam 10. Keburu sakit"
"Puskesmas Sewon II","https://www.google.com/maps/search/?api=1&query=Puskesmas%20Sewon%20II&query_place_id=ChIJE446Lk9Wei4RoIvHItkY-i4","1","Faet Oktadea Rahmat","https://www.google.com/maps/reviews/data=!4m8!14m7!1m6!2m5!1sChdDSUhNMG9nS0VJQ0FnSUNqaElTUm1RRRAB!2m1!1s0x0:0x2efa18d922c78ba0!3m1!1s2@1:CIHM0ogKEICAgICjhISRmQE%7C%7C?hl=id","Memberikan informasi simpang siurrr"
"Puskesmas Sewon II","https://www.google.com/maps/search/?api=1&query=Puskesmas%20Sewon%20II&query_place_id=ChIJE446Lk9Wei4RoIvHItkY-i4","5","Bagus Muhammad R","https://www.google.com/maps/reviews/data=!4m8!14m7!1m6!2m5!1sChdDSUhNMG9nS0VJQ0FnSUREeFk2RnR3RRAB!2m1!1s0x0:0x2efa18d922c78ba0!3m1!1s2@1:CIHM0ogKEICAgIDDxY6FtwE%7C%7C?hl=id","Pembersihan luka pasca operasi disini, pelayanan sangat cepat dan baik, ramah-ramah juga. Mungkin hanya tempat ruang tunggu di dalam puskes yang terasa kurang banyak jadi saat sedikit ramai sering penuh. Tapi saya tetep puas 3 x pembersihan luka pasca operasi disini."
"Puskesmas Sewon II","https://www.google.com/maps/search/?api=1&query=Puskesmas%20Sewon%20II&query_place_id=ChIJE446Lk9Wei4RoIvHItkY-i4","5","Am Am","https://www.google.com/maps/reviews/data=!4m8!14m7!1m6!2m5!1sChdDSUhNMG9nS0VJQ0FnSUQ5bWFlWHRRRRAB!2m1!1s0x0:0x2efa18d922c78ba0!3m1!1s2@1:CIHM0ogKEICAgID9maeXtQE%7C%7C?hl=id","pelayanan cukup baik ramah dan sangat membantu, pelayanan obat pun cepat"
"Puskesmas Sewon II","https://www.google.com/maps/search/?api=1&query=Puskesmas%20Sewon%20II&query_place_id=ChIJE446Lk9Wei4RoIvHItkY-i4","1","Khansa Anindya","https://www.google.com/maps/reviews/data=!4m8!14m7!1m6!2m5!1sChZDSUhNMG9nS0VJQ0FnSUM5dzgtcWJREAE!2m1!1s0x0:0x2efa18d922c78ba0!3m1!1s2@1:CIHM0ogKEICAgIC9w8-qbQ%7C%7C?hl=id","Pelayan buruk, pertama kesana masih buka pendaftaran tapi ditolak dengan alasan mepet. Harusnya introspeksi."
"Puskesmas Sewon II","https://www.google.com/maps/search/?api=1&query=Puskesmas%20Sewon%20II&query_place_id=ChIJE446Lk9Wei4RoIvHItkY-i4","5","VraRikaAsakiVembrika11 rika","https://www.google.com/maps/reviews/data=!4m8!14m7!1m6!2m5!1sChZDSUhNMG9nS0VJQ0FnSUM5OVk3WUdREAE!2m1!1s0x0:0x2efa18d922c78ba0!3m1!1s2@1:CIHM0ogKEICAgIC99Y7YGQ%7C%7C?hl=id",
"Puskesmas Sewon II","https://www.google.com/maps/search/?api=1&query=Puskesmas%20Sewon%20II&query_place_id=ChIJE446Lk9Wei4RoIvHItkY-i4","2","Agustina Nurul","https://www.google.com/maps/reviews/data=!4m8!14m7!1m6!2m5!1sChZDSUhNMG9nS0VJQ0FnSUMyNVBpeUdnEAE!2m1!1s0x0:0x2efa18d922c78ba0!3m1!1s2@1:CIHM0ogKEICAgIC25PiyGg%7C%7C?hl=id","CS wanita yang mengangat telfon sangat tidak ramah. Ditanya baik2 malah jawab dengan nada tinggi. Mohon lebih diperhatikan untuk excellent servicenya.

Ibu saya sakit perut bolak balik minta rujukan ke RS gak dikasih. Sampai periksa di dokter luar dikasih catatan minta rujukan usg perut pun tetep tidak dikasih. Dibilang cuma sakit perut biasa. Obatnya ya sama saja dikasih obat asam lambung yang sama sekali ga ngaruh dan ibu saya sampai sekarang tetep masih sakit perut. Kenapa sll dipersulit sekali untuk minta rujukan ke RS. Ini masalah nyawa orang"
"Puskesmas Sewon II","https://www.google.com/maps/search/?api=1&query=Puskesmas%20Sewon%20II&query_place_id=ChIJE446Lk9Wei4RoIvHItkY-i4","1","etheldreda maerel","https://www.google.com/maps/reviews/data=!4m8!14m7!1m6!2m5!1sChdDSUhNMG9nS0VJQ0FnSUROMTg2SzlBRRAB!2m1!1s0x0:0x2efa18d922c78ba0!3m1!1s2@1:CIHM0ogKEICAgIDN186K9AE%7C%7C?hl=id","pertama kali dan terakhir kesini sekitar 2 tahun yg lalu tp sekarang baru inget mau kasih review

puskesmas ini yg bikin saya kapok dtg ke puskesmas, pertama bagian pendaftaran KETUS SEKALI. posisi saya sedang sakit dan lemes terus diketusin sama org itu gaenak banget.
kedua, diperiksanya cuma ditanya keluhannya apa tiba-tiba dikasih obat, entah dokternya atau siapa keluarin obat banyak banget dari laci mejanya terus dipilihkan mana yang cocok untuk saya.
2 alasan yang bikin saya kapok gak akan datang lagi, mending ke dokter praktek umum keluar uang dikit tp meyakinkan"
"Puskesmas Sewon II","https://www.google.com/maps/search/?api=1&query=Puskesmas%20Sewon%20II&query_place_id=ChIJE446Lk9Wei4RoIvHItkY-i4","3","Tutik Supatmiyati","https://www.google.com/maps/reviews/data=!4m8!14m7!1m6!2m5!1sChdDSUhNMG9nS0VJQ0FnSURObDQyQTlRRRAB!2m1!1s0x0:0x2efa18d922c78ba0!3m1!1s2@1:CIHM0ogKEICAgIDNl42A9QE%7C%7C?hl=id","Terus dimaksmalkan potensi SDMnya agar masyarakat terlayani dg baik & nyaman nggih !"
"Puskesmas Sewon II","https://www.google.com/maps/search/?api=1&query=Puskesmas%20Sewon%20II&query_place_id=ChIJE446Lk9Wei4RoIvHItkY-i4","5","Estianna Khoirunnisa","https://www.google.com/maps/reviews/data=!4m8!14m7!1m6!2m5!1sChZDSUhNMG9nS0VJQ0FnSUROZzdTQllnEAE!2m1!1s0x0:0x2efa18d922c78ba0!3m1!1s2@1:CIHM0ogKEICAgIDNg7SBYg%7C%7C?hl=id","Pelayanan dr muthia oke ramah profesional sip bgt"
"Puskesmas Sewon II","https://www.google.com/maps/search/?api=1&query=Puskesmas%20Sewon%20II&query_place_id=ChIJE446Lk9Wei4RoIvHItkY-i4","1","Nur Halisah Sabriani","https://www.google.com/maps/reviews/data=!4m8!14m7!1m6!2m5!1sChdDSUhNMG9nS0VJQ0FnSUMxaDdXMGhRRRAB!2m1!1s0x0:0x2efa18d922c78ba0!3m1!1s2@1:CIHM0ogKEICAgIC1h7W0hQE%7C%7C?hl=id",
"Puskesmas Sewon II","https://www.google.com/maps/search/?api=1&query=Puskesmas%20Sewon%20II&query_place_id=ChIJE446Lk9Wei4RoIvHItkY-i4","4","ikfina kamilatun ni'mah","https://www.google.com/maps/reviews/data=!4m8!14m7!1m6!2m5!1sChdDSUhNMG9nS0VJQ0FnSUMxazQ3dXdRRRAB!2m1!1s0x0:0x2efa18d922c78ba0!3m1!1s2@1:CIHM0ogKEICAgIC1k47uwQE%7C%7C?hl=id","Perbaiki pelayanan gigi"
"Puskesmas Sewon II","https://www.google.com/maps/search/?api=1&query=Puskesmas%20Sewon%20II&query_place_id=ChIJE446Lk9Wei4RoIvHItkY-i4","1","Regiena Umi Hanna","https://www.google.com/maps/reviews/data=!4m8!14m7!1m6!2m5!1sChZDSUhNMG9nS0VJQ0FnSUMxaXBEM0RREAE!2m1!1s0x0:0x2efa18d922c78ba0!3m1!1s2@1:CIHM0ogKEICAgIC1ipD3DQ%7C%7C?hl=id",
"Puskesmas Sewon II","https://www.google.com/maps/search/?api=1&query=Puskesmas%20Sewon%20II&query_place_id=ChIJE446Lk9Wei4RoIvHItkY-i4","2","Narsiyo Pawiro","https://www.google.com/maps/reviews/data=!4m8!14m7!1m6!2m5!1sChdDSUhNMG9nS0VJQ0FnSURWNjZfZTFnRRAB!2m1!1s0x0:0x2efa18d922c78ba0!3m1!1s2@1:CIHM0ogKEICAgIDV66_e1gE%7C%7C?hl=id","pengalaman buruk sma dr laki yg di poli batuk. g ramah.dbilg ibuk sehat..hny krn tensi normal pdhl herpes bibir perih skit ..lah klo g skit ngapain mw antri lama di puskesmas. dkira qt ini g ada kerjaan apa?mana bawa2 ank usia 1.5 th..dlu skit herpes kyk gni priksa di klinik pratama lgsg diksh rujukan..ini malah dbilg sehat hny berdasar tensi normal.
q diem krn nunggu dia ngejelasin q kira dia msh mw ngomong. krn kan biasanya dr bilg ada lg yg mw dtanyakan? klo sdh bisa kluar. lha q blm disuruhnya kluar eh dr nya jg malah bengong2..smbl blg iya apa lgi? klo sdh y kluar. g sopan bgt. dah gtu minta obat herpes katanya bakal diksh tp g dikasih oy. akhirnya beli sndiri di apotek wlo hrgnya mahal. malah g ush antri lama di puskesmas. sma yg di antrian obat umum ngapain sih pke dtnya tgl lahir anak sgala dah brasa ujian sekolah aja pdhl mw ambil obat."
"Puskesmas Sewon II","https://www.google.com/maps/search/?api=1&query=Puskesmas%20Sewon%20II&query_place_id=ChIJE446Lk9Wei4RoIvHItkY-i4","1","Indah Ayu Puspitasari","https://www.google.com/maps/reviews/data=!4m8!14m7!1m6!2m5!1sChdDSUhNMG9nS0VJQ0FnSURWX2Z6X2dBRRAB!2m1!1s0x0:0x2efa18d922c78ba0!3m1!1s2@1:CIHM0ogKEICAgIDV_fz_gAE%7C%7C?hl=id","Pelayanan kurang ramah. Udah tanggung jawabnya di tanyain kok njawabnya ga enakin hati. Kalo pengen di baikin yo berlakulah yg baik !!!!!"
"Puskesmas Sewon II","https://www.google.com/maps/search/?api=1&query=Puskesmas%20Sewon%20II&query_place_id=ChIJE446Lk9Wei4RoIvHItkY-i4","5","Aisyah Nur Aini Putri","https://www.google.com/maps/reviews/data=!4m8!14m7!1m6!2m5!1sChZDSUhNMG9nS0VJQ0FnSURWM1l5OUpREAE!2m1!1s0x0:0x2efa18d922c78ba0!3m1!1s2@1:CIHM0ogKEICAgIDV3Yy9JQ%7C%7C?hl=id","Saya periksa disini pakai jaminan BPJS Ketenagakerjaan daftar melalui aplikasi mobile JKN via online H-1 sebelum periksa, pelayanan sangat cepat saya datang pukul 08.13 WIB selesai sampai ambil obat pukul 08.24 WIB, petugas ramah dan mengarahkan setiap alur, dokter jg menjelaskan dengan rinci dan baik. Terimakasih"
"Puskesmas Sewon II","https://www.google.com/maps/search/?api=1&query=Puskesmas%20Sewon%20II&query_place_id=ChIJE446Lk9Wei4RoIvHItkY-i4","5","Aisyah Nur Aini Putri","https://www.google.com/maps/reviews/data=!4m8!14m7!1m6!2m5!1sChdDSUhNMG9nS0VJQ0FnSURWM2JqZzNnRRAB!2m1!1s0x0:0x2efa18d922c78ba0!3m1!1s2@1:CIHM0ogKEICAgIDV3bjg3gE%7C%7C?hl=id",
"Puskesmas Sewon II","https://www.google.com/maps/search/?api=1&query=Puskesmas%20Sewon%20II&query_place_id=ChIJE446Lk9Wei4RoIvHItkY-i4","3","Justforfun","https://www.google.com/maps/reviews/data=!4m8!14m7!1m6!2m5!1sChZDSUhNMG9nS0VJQ0FnSURsaWFXZWVBEAE!2m1!1s0x0:0x2efa18d922c78ba0!3m1!1s2@1:CIHM0ogKEICAgIDliaWeeA%7C%7C?hl=id","Periksa gigi disini direkomendasikan buat dicabut, setelah periksa ga bisa langsung cabut akhirnya dikasih obat dulu seminggu lagi kontrol, setelah seminggu kontrol harusnya pencabutan gigi ternyata alat ga memadai makanya dikasih surat rujukan ke rs. Setelah ke rs ternyata sama aja gabisa langsung cabut gigi harus dikasih obat dulu nunggu seminggu lagi baru bisa cabut, hadehh seharusnya pas diperiksa tau alat ga memadai mah langsung kasih rujukan ke rs aja jadi ga nunggu kelamaan, padahal pengen cepet cepet dicabut soalnya kadang kalau kambuh sakitnya minta ampun"
"Puskesmas Sewon II","https://www.google.com/maps/search/?api=1&query=Puskesmas%20Sewon%20II&query_place_id=ChIJE446Lk9Wei4RoIvHItkY-i4","2","Aldo Candra winardi","https://www.google.com/maps/reviews/data=!4m8!14m7!1m6!2m5!1sChZDSUhNMG9nS0VJQ0FnSURsanNXSFFREAE!2m1!1s0x0:0x2efa18d922c78ba0!3m1!1s2@1:CIHM0ogKEICAgIDljsWHQQ%7C%7C?hl=id","Pelayanan di poli batuk sangat tidak ramah .
Pasien bertanya itu arti nya belum paham atau tidak tau ..
Nahh,, kok dokter nya jawab dengan nada ketus sangat menjengkelkan ..

Pendaftaran lama .
harus kesana sini ribet ..."
"Puskesmas Sewon II","https://www.google.com/maps/search/?api=1&query=Puskesmas%20Sewon%20II&query_place_id=ChIJE446Lk9Wei4RoIvHItkY-i4","1","Dhea Isnaini","https://www.google.com/maps/reviews/data=!4m8!14m7!1m6!2m5!1sChdDSUhNMG9nS0VJQ0FnSUNsNF9lMDFnRRAB!2m1!1s0x0:0x2efa18d922c78ba0!3m1!1s2@1:CIHM0ogKEICAgICl4_e01gE%7C%7C?hl=id","Bagian KIA omongan nya suka bikin down. Kesalahan dari sana hitung usia kehamilan lebih dari yg aslinya. Sehingga BB bayi yg aslinya cukup tapi dibilang kurang banyak dan harus di rujuk ke RS."
"Puskesmas Sewon II","https://www.google.com/maps/search/?api=1&query=Puskesmas%20Sewon%20II&query_place_id=ChIJE446Lk9Wei4RoIvHItkY-i4","1","Arga Evan dwi Ramadhan","https://www.google.com/maps/reviews/data=!4m8!14m7!1m6!2m5!1sChdDSUhNMG9nS0VJQ0FnSUNsNXBETXBRRRAB!2m1!1s0x0:0x2efa18d922c78ba0!3m1!1s2@1:CIHM0ogKEICAgICl5pDMpQE%7C%7C?hl=id","Td pagi sy antar ibu cari rujukan di Puskesmas II Sewon.Jujur sy bener² sangat kecewa dengan pelayanan di Puskesmas II Sewon.Pelayanannya tdk baik,tdk ramah,nada bicara tinggi,ngomongnya nyolot bikin jengkel.Sdh 2x(pd bulan agustus&bulan november) ini sy di layani dengan tdk ramah dengan org yg sama.Apakah karena kami hanya menggunakan kartu BPJS sehingga melayani kami dengan seenaknya.Mohon dengan sangat tolong di tingkatkan lagi untuk pelayanannya agar kami bisa merasa enak dan nyaman.Bukankah seharusnya seorang pelayan itu hrs bersikap dengan baik,ramah,sabar,sumeh.Terimakasih"
"Puskesmas Sewon II","https://www.google.com/maps/search/?api=1&query=Puskesmas%20Sewon%20II&query_place_id=ChIJE446Lk9Wei4RoIvHItkY-i4","5","Caesar Odie Wicaksono","https://www.google.com/maps/reviews/data=!4m8!14m7!1m6!2m5!1sChdDSUhNMG9nS0VJQ0FnSUNsaHFyWXV3RRAB!2m1!1s0x0:0x2efa18d922c78ba0!3m1!1s2@1:CIHM0ogKEICAgIClhqrYuwE%7C%7C?hl=id",
"Puskesmas Sewon II","https://www.google.com/maps/search/?api=1&query=Puskesmas%20Sewon%20II&query_place_id=ChIJE446Lk9Wei4RoIvHItkY-i4","5","Raffa Muyassar","https://www.google.com/maps/reviews/data=!4m8!14m7!1m6!2m5!1sChZDSUhNMG9nS0VJQ0FnSUNscXZueUxREAE!2m1!1s0x0:0x2efa18d922c78ba0!3m1!1s2@1:CIHM0ogKEICAgIClqvnyLQ%7C%7C?hl=id","Makin bagus pelayanan ny, semoga bisa lebih bagus lagi buat Puskesmas Sewon II"
"Puskesmas Sewon II","https://www.google.com/maps/search/?api=1&query=Puskesmas%20Sewon%20II&query_place_id=ChIJE446Lk9Wei4RoIvHItkY-i4","1","deza fadillona","https://www.google.com/maps/reviews/data=!4m8!14m7!1m6!2m5!1sChdDSUhNMG9nS0VJQ0FnSURGcDZtS3lRRRAB!2m1!1s0x0:0x2efa18d922c78ba0!3m1!1s2@1:CIHM0ogKEICAgIDFp6mKyQE%7C%7C?hl=id",
"Puskesmas Sewon II","https://www.google.com/maps/search/?api=1&query=Puskesmas%20Sewon%20II&query_place_id=ChIJE446Lk9Wei4RoIvHItkY-i4","1","Fatikaa Dewii","https://www.google.com/maps/reviews/data=!4m8!14m7!1m6!2m5!1sChZDSUhNMG9nS0VJQ0FnSURGaTl5bU9nEAE!2m1!1s0x0:0x2efa18d922c78ba0!3m1!1s2@1:CIHM0ogKEICAgIDFi9ymOg%7C%7C?hl=id","pelayanan kurang ramah, dokternya juga pas periksa nadanya tinggi bikin jengkel. pas periksa juga ngomongnya nyolot bangett.. tolong dong lebih di tingkatkan lagi pelayanan nya biar ramah. walaupun tercover bpjs kita juga bayar"
"Puskesmas Sewon II","https://www.google.com/maps/search/?api=1&query=Puskesmas%20Sewon%20II&query_place_id=ChIJE446Lk9Wei4RoIvHItkY-i4","5","db dyah","https://www.google.com/maps/reviews/data=!4m8!14m7!1m6!2m5!1sChZDSUhNMG9nS0VJQ0FnSURGNmRqTkV3EAE!2m1!1s0x0:0x2efa18d922c78ba0!3m1!1s2@1:CIHM0ogKEICAgIDF6djNEw%7C%7C?hl=id",
"Puskesmas Sewon II","https://www.google.com/maps/search/?api=1&query=Puskesmas%20Sewon%20II&query_place_id=ChIJE446Lk9Wei4RoIvHItkY-i4","5","Farah Dina","https://www.google.com/maps/reviews/data=!4m8!14m7!1m6!2m5!1sChZDSUhNMG9nS0VJQ0FnSURGNmVqMGJ3EAE!2m1!1s0x0:0x2efa18d922c78ba0!3m1!1s2@1:CIHM0ogKEICAgIDF6ej0bw%7C%7C?hl=id","T4 strategis"
"Puskesmas Sewon II","https://www.google.com/maps/search/?api=1&query=Puskesmas%20Sewon%20II&query_place_id=ChIJE446Lk9Wei4RoIvHItkY-i4","3","Bulek Titik","https://www.google.com/maps/reviews/data=!4m8!14m7!1m6!2m5!1sChZDSUhNMG9nS0VJQ0FnSURGNmFpQWJnEAE!2m1!1s0x0:0x2efa18d922c78ba0!3m1!1s2@1:CIHM0ogKEICAgIDF6aiAbg%7C%7C?hl=id",
"Puskesmas Sewon II","https://www.google.com/maps/search/?api=1&query=Puskesmas%20Sewon%20II&query_place_id=ChIJE446Lk9Wei4RoIvHItkY-i4","2","Mio Beat","https://www.google.com/maps/reviews/data=!4m8!14m7!1m6!2m5!1sChZDSUhNMG9nS0VJQ0FnSUNGemI3dGN3EAE!2m1!1s0x0:0x2efa18d922c78ba0!3m1!1s2@1:CIHM0ogKEICAgICFzb7tcw%7C%7C?hl=id","Pelayanan sangat kurang,kalau kenal orang dalam bisa masuk tanpa nomor antrian,,,,"
"Puskesmas Sewon II","https://www.google.com/maps/search/?api=1&query=Puskesmas%20Sewon%20II&query_place_id=ChIJE446Lk9Wei4RoIvHItkY-i4","1","Nurani Khasanah","https://www.google.com/maps/reviews/data=!4m8!14m7!1m6!2m5!1sChZDSUhNMG9nS0VJQ0FnSUNGenQ2Y01BEAE!2m1!1s0x0:0x2efa18d922c78ba0!3m1!1s2@1:CIHM0ogKEICAgICFzt6cMA%7C%7C?hl=id","Pelayanan buruk.
Tempat duduk kurang.
Ribet.
Cari surat rujukan disini. Dari pagi sampe siang,sudah antri 2,5 jam hasilnya Zonk.Di poli umum disuruh carinya tgl 10,karna dipakainya tgl 14. Kenapa gak di infokan saat dipendaftaran?"
"Puskesmas Sewon II","https://www.google.com/maps/search/?api=1&query=Puskesmas%20Sewon%20II&query_place_id=ChIJE446Lk9Wei4RoIvHItkY-i4","5","yoshie rachma","https://www.google.com/maps/reviews/data=!4m8!14m7!1m6!2m5!1sChdDSUhNMG9nS0VJQ0FnSUQ1LXNYSTlBRRAB!2m1!1s0x0:0x2efa18d922c78ba0!3m1!1s2@1:CIHM0ogKEICAgID5-sXI9AE%7C%7C?hl=id","Puskesmas yg memiliki pelayanan yg sangat baik, dan petugasnya ramah bisa membantu dan menangani segala keluhan serta kebutuhan pasien. Ruangan yg ada di puskesmas jg bersih dan nyaman. Tempat parkir luas sehingga memudahkan pasien yg ingin berobat untuk memarkir kendaraan"
"Puskesmas Sewon II","https://www.google.com/maps/search/?api=1&query=Puskesmas%20Sewon%20II&query_place_id=ChIJE446Lk9Wei4RoIvHItkY-i4","5","Dafi Yasin Addafi","https://www.google.com/maps/reviews/data=!4m8!14m7!1m6!2m5!1sChZDSUhNMG9nS0VJQ0FnSUQ1LW9uUk9nEAE!2m1!1s0x0:0x2efa18d922c78ba0!3m1!1s2@1:CIHM0ogKEICAgID5-onROg%7C%7C?hl=id","Alhamdulillah semuanya ramah"
