"title","url","stars","name","reviewUrl","text"
"Puskesmas Pleret","https://www.google.com/maps/search/?api=1&query=Puskesmas%20Pleret&query_place_id=ChIJj4ZDADZUei4R85Qc5_bhuRg","5","Nadia Salsabila","https://www.google.com/maps/reviews/data=!4m8!14m7!1m6!2m5!1sCi9DQUlRQUNvZENodHljRjlvT21wWU5FWndXbVF0YldaS1ZETjVWWGt3YVZOMU9GRRAB!2m1!1s0x0:0x18b9e1f6e71c94f3!3m1!1s2@1:CAIQACodChtycF9oOmpYNEZwWmQtbWZKVDN5VXkwaVN1OFE%7C%7C?hl=id","Pelayanan Ramah Apoteker nya Murah senyum dan Pelayanan juga cepat tepat Dan tempat nya bersih asri dan nyaman 🤗"
"Puskesmas Pleret","https://www.google.com/maps/search/?api=1&query=Puskesmas%20Pleret&query_place_id=ChIJj4ZDADZUei4R85Qc5_bhuRg","4","Rima Fitri","https://www.google.com/maps/reviews/data=!4m8!14m7!1m6!2m5!1sCi9DQUlRQUNvZENodHljRjlvT25SMFNWUk1OVU00TXpBMFZEVTVaV2R1VjBwR1NsRRAB!2m1!1s0x0:0x18b9e1f6e71c94f3!3m1!1s2@1:CAIQACodChtycF9oOnR0SVRMNUM4MzA0VDU5ZWduV0pGSlE%7C%7C?hl=id","Pelayananya bagus, staf juga sangat ramah, tapi utk pelayanan kia 1 dan kia 2 kayanya harus dipisah. Soalnya no urut sama. Misal KIA 2 sdah no 6 tapi di KIA 1 baru no 4. Untung bidannya sabar dan mau berulang menjelaskan. Terimakasih banyak atas pelayanan yg ramah dan top markotop. ."
"Puskesmas Pleret","https://www.google.com/maps/search/?api=1&query=Puskesmas%20Pleret&query_place_id=ChIJj4ZDADZUei4R85Qc5_bhuRg","5","rini rindawati","https://www.google.com/maps/reviews/data=!4m8!14m7!1m6!2m5!1sCi9DQUlRQUNvZENodHljRjlvT2xSVWJUWjVhMko0YVhwaVkxVTNXbWh1ZGtWcWRtYxAB!2m1!1s0x0:0x18b9e1f6e71c94f3!3m1!1s2@1:CAIQACodChtycF9oOlRUbTZ5a2J4aXpiY1U3WmhudkVqdmc%7C%7C?hl=id",
"Puskesmas Pleret","https://www.google.com/maps/search/?api=1&query=Puskesmas%20Pleret&query_place_id=ChIJj4ZDADZUei4R85Qc5_bhuRg","5","Ritni Kusuma","https://www.google.com/maps/reviews/data=!4m8!14m7!1m6!2m5!1sCi9DQUlRQUNvZENodHljRjlvT2kxcGFqRXdhbHAxY2t4R2RsWmFPVGhLVkhWeGFrRRAB!2m1!1s0x0:0x18b9e1f6e71c94f3!3m1!1s2@1:CAIQACodChtycF9oOi1pajEwalp1ckxGdlZaOThKVHVxakE%7C%7C?hl=id","pelayanan poli giginya mantap xixixixiixi dr gigi nya ramah polll, bisa diajak bercanda, telaten, rapi bgt pengerjaannya, sabar jg pastinya🫰🏻 sehat selalu drg ignatia🫰🏻"
"Puskesmas Pleret","https://www.google.com/maps/search/?api=1&query=Puskesmas%20Pleret&query_place_id=ChIJj4ZDADZUei4R85Qc5_bhuRg","5","Tri Yono","https://www.google.com/maps/reviews/data=!4m8!14m7!1m6!2m5!1sCi9DQUlRQUNvZENodHljRjlvT25GemVWQnVWbDlHTUZkMldFdHNTMG93VDNFNWFrRRAB!2m1!1s0x0:0x18b9e1f6e71c94f3!3m1!1s2@1:CAIQACodChtycF9oOnFzeVBuVl9GMFd2WEtsS0owT3E5akE%7C%7C?hl=id",
"Puskesmas Pleret","https://www.google.com/maps/search/?api=1&query=Puskesmas%20Pleret&query_place_id=ChIJj4ZDADZUei4R85Qc5_bhuRg","5","Chanis Sukma","https://www.google.com/maps/reviews/data=!4m8!14m7!1m6!2m5!1sChZDSUhNMG9nS0VJQ0FnSURWbXRyUVlREAE!2m1!1s0x0:0x18b9e1f6e71c94f3!3m1!1s2@1:CIHM0ogKEICAgIDVmtrQYQ%7C%7C?hl=id",
"Puskesmas Pleret","https://www.google.com/maps/search/?api=1&query=Puskesmas%20Pleret&query_place_id=ChIJj4ZDADZUei4R85Qc5_bhuRg","5","Emi Narimawati","https://www.google.com/maps/reviews/data=!4m8!14m7!1m6!2m5!1sChdDSUhNMG9nS0VJQ0FnSUNtdVpqenh3RRAB!2m1!1s0x0:0x18b9e1f6e71c94f3!3m1!1s2@1:CIHM0ogKEICAgICmuZjzxwE%7C%7C?hl=id","Bisa konsul lewat hotline"
"Puskesmas Pleret","https://www.google.com/maps/search/?api=1&query=Puskesmas%20Pleret&query_place_id=ChIJj4ZDADZUei4R85Qc5_bhuRg","5","Elfen Elfarengga","https://www.google.com/maps/reviews/data=!4m8!14m7!1m6!2m5!1sCi9DQUlRQUNvZENodHljRjlvT2xOVlJqTnFRMmxrVjNGclpWRk5Ubm8wVm5rNVgxRRAB!2m1!1s0x0:0x18b9e1f6e71c94f3!3m1!1s2@1:CAIQACodChtycF9oOlNVRjNqQ2lkV3FrZVFNTno0Vnk5X1E%7C%7C?hl=id","Hampir seminggu bolak balik kesini karena harus tambal gigi😅 tapi gak masalah karena pelayanan di poli giginya bagus banget apalagi dokternya juga ramah."
"Puskesmas Pleret","https://www.google.com/maps/search/?api=1&query=Puskesmas%20Pleret&query_place_id=ChIJj4ZDADZUei4R85Qc5_bhuRg","5","al azhar","https://www.google.com/maps/reviews/data=!4m8!14m7!1m6!2m5!1sCi9DQUlRQUNvZENodHljRjlvT2toa1NIZGxUMTk1Wlc5ZmNsaGtVall6TWtsMVIxRRAB!2m1!1s0x0:0x18b9e1f6e71c94f3!3m1!1s2@1:CAIQACodChtycF9oOkhkSHdlT195ZW9fclhkUjYzMkl1R1E%7C%7C?hl=id","Ramah dan Komunikatif"
"Puskesmas Pleret","https://www.google.com/maps/search/?api=1&query=Puskesmas%20Pleret&query_place_id=ChIJj4ZDADZUei4R85Qc5_bhuRg","5","Fathiyyah Nurul Hadi","https://www.google.com/maps/reviews/data=!4m8!14m7!1m6!2m5!1sCi9DQUlRQUNvZENodHljRjlvT25oMFZWcDNWRVZxVFV0YU5YSTVUVEZNU21KSVNWRRAB!2m1!1s0x0:0x18b9e1f6e71c94f3!3m1!1s2@1:CAIQACodChtycF9oOnh0VVp3VEVqTUtaNXI5TTFMSmJISVE%7C%7C?hl=id","Pelayanan sangat baik, semua staffnya ramah dan penjelasannya rinci, kesini karna ada ibu bidan Emi udah nyaman konsul sama beliau juga🥰"
"Puskesmas Pleret","https://www.google.com/maps/search/?api=1&query=Puskesmas%20Pleret&query_place_id=ChIJj4ZDADZUei4R85Qc5_bhuRg","5","Dhea alfiani","https://www.google.com/maps/reviews/data=!4m8!14m7!1m6!2m5!1sCi9DQUlRQUNvZENodHljRjlvT2pneE5YSlRWMVpITFcxbFluazVibnBDYVhwUFpYYxAB!2m1!1s0x0:0x18b9e1f6e71c94f3!3m1!1s2@1:CAIQACodChtycF9oOjgxNXJTV1ZHLW1lYnk5bnpCaXpPZXc%7C%7C?hl=id","pelayanan ramah, informasi cepat"
"Puskesmas Pleret","https://www.google.com/maps/search/?api=1&query=Puskesmas%20Pleret&query_place_id=ChIJj4ZDADZUei4R85Qc5_bhuRg","1","Isty Isty","https://www.google.com/maps/reviews/data=!4m8!14m7!1m6!2m5!1sCi9DQUlRQUNvZENodHljRjlvT2w5VFoyOWpNR2RoUW5KRWVsTm1TVFV6YUhwcWFIYxAB!2m1!1s0x0:0x18b9e1f6e71c94f3!3m1!1s2@1:CAIQACodChtycF9oOl9TZ29jMGdhQnJEelNmSTUzaHpqaHc%7C%7C?hl=id","Dipoli gigi minta rujukan malah dijudesin...nyinyir bgt ya Alloh..."
"Puskesmas Pleret","https://www.google.com/maps/search/?api=1&query=Puskesmas%20Pleret&query_place_id=ChIJj4ZDADZUei4R85Qc5_bhuRg","5","aileen acintya","https://www.google.com/maps/reviews/data=!4m8!14m7!1m6!2m5!1sCi9DQUlRQUNvZENodHljRjlvT2kxU2QweE5Oa3AzTjA1bVJtRlJXRVJJV0VKWlVGRRAB!2m1!1s0x0:0x18b9e1f6e71c94f3!3m1!1s2@1:CAIQACodChtycF9oOi1Sd0xNNkp3N05mRmFRWERIWEJZUFE%7C%7C?hl=id",
"Puskesmas Pleret","https://www.google.com/maps/search/?api=1&query=Puskesmas%20Pleret&query_place_id=ChIJj4ZDADZUei4R85Qc5_bhuRg","5","Lusiana","https://www.google.com/maps/reviews/data=!4m8!14m7!1m6!2m5!1sCi9DQUlRQUNvZENodHljRjlvT25oV1gzUlpRMWhRYWpkRlVtMWpNRUpUY21scmFGRRAB!2m1!1s0x0:0x18b9e1f6e71c94f3!3m1!1s2@1:CAIQACodChtycF9oOnhWX3RZQ1hQajdFUm1jMEJTcmlraFE%7C%7C?hl=id",
"Puskesmas Pleret","https://www.google.com/maps/search/?api=1&query=Puskesmas%20Pleret&query_place_id=ChIJj4ZDADZUei4R85Qc5_bhuRg","5","Debika Saputra","https://www.google.com/maps/reviews/data=!4m8!14m7!1m6!2m5!1sCi9DQUlRQUNvZENodHljRjlvT2psbllqUTViVWgzVkd3d1UwSnFhMms0Y1RSR2RrRRAB!2m1!1s0x0:0x18b9e1f6e71c94f3!3m1!1s2@1:CAIQACodChtycF9oOjlnYjQ5bUh3VGwwU0Jqa2k4cTRGdkE%7C%7C?hl=id","Alhamdulillah hari ini imunisasi bcg anak ku.. petugas bidan nya ramah semua senang rasanya .. kami dilayani dengan baik disini .. terimakasih banyak puskesmas pleret 😍😍"
"Puskesmas Pleret","https://www.google.com/maps/search/?api=1&query=Puskesmas%20Pleret&query_place_id=ChIJj4ZDADZUei4R85Qc5_bhuRg","5","Khoiruzahrani Aprinela","https://www.google.com/maps/reviews/data=!4m8!14m7!1m6!2m5!1sCi9DQUlRQUNvZENodHljRjlvT2tVeVVISXhVVlEzVWxOQk1WSlFjR1JvZERCUFJrRRAB!2m1!1s0x0:0x18b9e1f6e71c94f3!3m1!1s2@1:CAIQACodChtycF9oOkUyUHIxUVQ3UlNBMVJQcGRodDBPRkE%7C%7C?hl=id","Pelayananya di poli gigi bagus banget, apalagi dokternya ramah sekali👍👌"
"Puskesmas Pleret","https://www.google.com/maps/search/?api=1&query=Puskesmas%20Pleret&query_place_id=ChIJj4ZDADZUei4R85Qc5_bhuRg","5","Shelly Rutia","https://www.google.com/maps/reviews/data=!4m8!14m7!1m6!2m5!1sCi9DQUlRQUNvZENodHljRjlvT2xwSFkzWlVRek00ZUZnelUxTk9XVkUyU0RkVGVWRRAB!2m1!1s0x0:0x18b9e1f6e71c94f3!3m1!1s2@1:CAIQACodChtycF9oOlpHY3ZUQzM4eFgzU1NOWVE2SDdTeVE%7C%7C?hl=id",
"Puskesmas Pleret","https://www.google.com/maps/search/?api=1&query=Puskesmas%20Pleret&query_place_id=ChIJj4ZDADZUei4R85Qc5_bhuRg","5","Abi Dina","https://www.google.com/maps/reviews/data=!4m8!14m7!1m6!2m5!1sChZDSUhNMG9nS0VLdjc1b0xHNVpHa2VnEAE!2m1!1s0x0:0x18b9e1f6e71c94f3!3m1!1s2@1:CIHM0ogKEKv75oLG5ZGkeg%7C%7C?hl=id","Cek kesehatan buat syarat PPPK disini, pelayanannya sangat ramah."
"Puskesmas Pleret","https://www.google.com/maps/search/?api=1&query=Puskesmas%20Pleret&query_place_id=ChIJj4ZDADZUei4R85Qc5_bhuRg","5","Ika sir'ana","https://www.google.com/maps/reviews/data=!4m8!14m7!1m6!2m5!1sChZDSUhNMG9nS0VQLXAxTV81OHRMd0JREAE!2m1!1s0x0:0x18b9e1f6e71c94f3!3m1!1s2@1:CIHM0ogKEP-p1M_58tLwBQ%7C%7C?hl=id","Bolak balik kesini buat periksain gigi anak dan harus ditambal. Pelayanannya bagus banget. Petugas di bagian pendaftarannya ramah, tenaga medisnya profesional dan sabar. Anak nyaman karena dokternya super ramah dan super ngemong. Terima kasih banyak, drg. Ignatia Lidya Handayani. Sukses dan sehat selalu ❤️❤️❤️"
"Puskesmas Pleret","https://www.google.com/maps/search/?api=1&query=Puskesmas%20Pleret&query_place_id=ChIJj4ZDADZUei4R85Qc5_bhuRg","5","dezka prabandary","https://www.google.com/maps/reviews/data=!4m8!14m7!1m6!2m5!1sChZDSUhNMG9nS0VMTzJ2ZjZiMHBQU0RBEAE!2m1!1s0x0:0x18b9e1f6e71c94f3!3m1!1s2@1:CIHM0ogKELO2vf6b0pPSDA%7C%7C?hl=id","Saya selalu priksain anak2 saya di Puskesmas Pleret. Bulan februari 2025 lalu anak saya yang usia 4 tahun scaling dan tambal gigi di poli gigi Puskesmas Pleret, kebetulan ditangani oleh dokter Ignatia Lidya.
Wah dokternya ramah dan sabar sekali sm anak. Pemeriksaannya teliti, scalingnya bersih, dan tambalan kedua gigi geraham anak saya juga bagus. Ternyata dokter Ignatia jg praktek di Peri Gigi loh, cekatan sekali ✨
Anak saya sampe sekarang masih ingat dengan dokter Ignatia, masih suka cerita pengalamannya ketika priksa gigi, sangat menyenangkan, tanpa drama 🥰
Terimakasih dokter Ignatia, terimakasih Puskesmas Pleret Bantul 🤍"
"Puskesmas Pleret","https://www.google.com/maps/search/?api=1&query=Puskesmas%20Pleret&query_place_id=ChIJj4ZDADZUei4R85Qc5_bhuRg","1","Kebun Mba Tias","https://www.google.com/maps/reviews/data=!4m8!14m7!1m6!2m5!1sChZDSUhNMG9nS0VJQ0FnTUNZOHJXY0VnEAE!2m1!1s0x0:0x18b9e1f6e71c94f3!3m1!1s2@1:CIHM0ogKEICAgMCY8rWcEg%7C%7C?hl=id","Aku kecewa berat karena bidannya tidak ramah dan bisanya cuma ngatain aja. Kecewa berat karena mau periksa lab anc malah alasan antri padahal sudah aku antri dr jam 7.30 sampai jam 12.45 malah cuma di USG aja hadeh. Aku bayar bukan gratisan. Kecewa. Jdi trauma mau periksa lagi disitu"
"Puskesmas Pleret","https://www.google.com/maps/search/?api=1&query=Puskesmas%20Pleret&query_place_id=ChIJj4ZDADZUei4R85Qc5_bhuRg","1","Septyan Wck","https://www.google.com/maps/reviews/data=!4m8!14m7!1m6!2m5!1sChZDSUhNMG9nS0VJQ0FnTURvNlpDNkN3EAE!2m1!1s0x0:0x18b9e1f6e71c94f3!3m1!1s2@1:CIHM0ogKEICAgMDo6ZC6Cw%7C%7C?hl=id","Pernah uap disini 2 kali karna sesak napas otomatis langsung masuk ugd, tapi yang saya heran ada ruangan khusus ugd kok saya di uap nyaa di luar ruangan dan di liat orang lewat,,trus fungsinya ugd buat apa ?kok aneh bangett puskesmas nyaa bagian ugd perwatnya gak jelas . Penanganan gak umum buat ugd mending di hapus aja klo gitu."
"Puskesmas Pleret","https://www.google.com/maps/search/?api=1&query=Puskesmas%20Pleret&query_place_id=ChIJj4ZDADZUei4R85Qc5_bhuRg","1","Mas Koko","https://www.google.com/maps/reviews/data=!4m8!14m7!1m6!2m5!1sChZDSUhNMG9nS0VJQ0FnTURJbnZQUUhREAE!2m1!1s0x0:0x18b9e1f6e71c94f3!3m1!1s2@1:CIHM0ogKEICAgMDInvPQHQ%7C%7C?hl=id","poli KIA lambat"
"Puskesmas Pleret","https://www.google.com/maps/search/?api=1&query=Puskesmas%20Pleret&query_place_id=ChIJj4ZDADZUei4R85Qc5_bhuRg","5","Markonah Markonah2","https://www.google.com/maps/reviews/data=!4m8!14m7!1m6!2m5!1sChdDSUhNMG9nS0VJQ0FnTURJN3YzZ3JnRRAB!2m1!1s0x0:0x18b9e1f6e71c94f3!3m1!1s2@1:CIHM0ogKEICAgMDI7v3grgE%7C%7C?hl=id","Sangat baguss"
"Puskesmas Pleret","https://www.google.com/maps/search/?api=1&query=Puskesmas%20Pleret&query_place_id=ChIJj4ZDADZUei4R85Qc5_bhuRg","5","Dhian Nurrohmah","https://www.google.com/maps/reviews/data=!4m8!14m7!1m6!2m5!1sChZDSUhNMG9nS0VJQ0FnTUR3dVpQZ1JBEAE!2m1!1s0x0:0x18b9e1f6e71c94f3!3m1!1s2@1:CIHM0ogKEICAgMDwuZPgRA%7C%7C?hl=id","Pelayanan di poli gigi puskesmas pleret sangat baik! dokternya bener-bener memberikan solusi yg tepat dan terbaik! dokter dokternya ramah-ramah dan asik😍"
"Puskesmas Pleret","https://www.google.com/maps/search/?api=1&query=Puskesmas%20Pleret&query_place_id=ChIJj4ZDADZUei4R85Qc5_bhuRg","5","Azzam Adhomah","https://www.google.com/maps/reviews/data=!4m8!14m7!1m6!2m5!1sChdDSUhNMG9nS0VJQ0FnTUN3czQ3emt3RRAB!2m1!1s0x0:0x18b9e1f6e71c94f3!3m1!1s2@1:CIHM0ogKEICAgMCws47zkwE%7C%7C?hl=id","Pelayanan Ramah, Luar biasa 👍🏼 sukses terus Puskesmas Pleret"
"Puskesmas Pleret","https://www.google.com/maps/search/?api=1&query=Puskesmas%20Pleret&query_place_id=ChIJj4ZDADZUei4R85Qc5_bhuRg","5","Wahyu Nia Kurnia Sari","https://www.google.com/maps/reviews/data=!4m8!14m7!1m6!2m5!1sChZDSUhNMG9nS0VJQ0FnTURRNTh2QWFnEAE!2m1!1s0x0:0x18b9e1f6e71c94f3!3m1!1s2@1:CIHM0ogKEICAgMDQ58vAag%7C%7C?hl=id","Pelayanann sangat bagus, dokter giginya ramah dan komunikatif jadi pasien bisa nyaman periksa di sana, semoga terus konsisten"
"Puskesmas Pleret","https://www.google.com/maps/search/?api=1&query=Puskesmas%20Pleret&query_place_id=ChIJj4ZDADZUei4R85Qc5_bhuRg","5","niswatul ulum","https://www.google.com/maps/reviews/data=!4m8!14m7!1m6!2m5!1sChdDSUhNMG9nS0VJQ0FnSURuMnJXTXdBRRAB!2m1!1s0x0:0x18b9e1f6e71c94f3!3m1!1s2@1:CIHM0ogKEICAgIDn2rWMwAE%7C%7C?hl=id","Pertama kalinya kesini karena minta buku KIA harus di puskesmas daerah. Pelayanannya unexpectedly memuaskan, semuanya ramah, padahal kalau puskesmas rame biasanya pegawainya judes², ini ga ada yang judes sama sekali, dan gercep semua. Ada indikasi masalah yang beresiko langsung dirujuk ke RS besar padahal faskes saya bukan disini

Poli²nya termasuk lengkap sih menurut saya, bahkan ada fisioterapi dan psikolog juga

Dokter giginya juga oke bangeet, tambal² gercep, cabut gigi juga ga sakit sama sekali, bahkan suntik biusnya pun ga kerasa (cuma kerasa kaya makan makanan yang agak keras terus kena gusi). Padahal pernah cabut gigi di tempat lain itu rasanya kaya sakaratul maut 😭😭😭"
"Puskesmas Pleret","https://www.google.com/maps/search/?api=1&query=Puskesmas%20Pleret&query_place_id=ChIJj4ZDADZUei4R85Qc5_bhuRg","5","blarak villa","https://www.google.com/maps/reviews/data=!4m8!14m7!1m6!2m5!1sChZDSUhNMG9nS0VJQ0FnTURncGRIZFZREAE!2m1!1s0x0:0x18b9e1f6e71c94f3!3m1!1s2@1:CIHM0ogKEICAgMDgpdHdVQ%7C%7C?hl=id","Pelayanan yang ramah oleh semua petugasnya,"
"Puskesmas Pleret","https://www.google.com/maps/search/?api=1&query=Puskesmas%20Pleret&query_place_id=ChIJj4ZDADZUei4R85Qc5_bhuRg","1","Man 02","https://www.google.com/maps/reviews/data=!4m8!14m7!1m6!2m5!1sChZDSUhNMG9nS0VJQ0FnTUNBbDhlU2ZBEAE!2m1!1s0x0:0x18b9e1f6e71c94f3!3m1!1s2@1:CIHM0ogKEICAgMCAl8eSfA%7C%7C?hl=id","Dokter umum nyaa yang cowo bikin emosi minta rujukan kesini malah di paksa ke sini, debat terus drama .. pdahal udah ada riwayat prnyakit nya mlah di pindah ke dokter yg beda penyakit nya"
"Puskesmas Pleret","https://www.google.com/maps/search/?api=1&query=Puskesmas%20Pleret&query_place_id=ChIJj4ZDADZUei4R85Qc5_bhuRg","5","Asih Setiyani","https://www.google.com/maps/reviews/data=!4m8!14m7!1m6!2m5!1sChdDSUhNMG9nS0VJQ0FnTUNBdVpTMWt3RRAB!2m1!1s0x0:0x18b9e1f6e71c94f3!3m1!1s2@1:CIHM0ogKEICAgMCAuZS1kwE%7C%7C?hl=id",
"Puskesmas Pleret","https://www.google.com/maps/search/?api=1&query=Puskesmas%20Pleret&query_place_id=ChIJj4ZDADZUei4R85Qc5_bhuRg","5","Stella Carova","https://www.google.com/maps/reviews/data=!4m8!14m7!1m6!2m5!1sChZDSUhNMG9nS0VJQ0FnTUNBX3VQZ1hREAE!2m1!1s0x0:0x18b9e1f6e71c94f3!3m1!1s2@1:CIHM0ogKEICAgMCA_uPgXQ%7C%7C?hl=id",
"Puskesmas Pleret","https://www.google.com/maps/search/?api=1&query=Puskesmas%20Pleret&query_place_id=ChIJj4ZDADZUei4R85Qc5_bhuRg","5","Andy Misti82","https://www.google.com/maps/reviews/data=!4m8!14m7!1m6!2m5!1sChdDSUhNMG9nS0VJQ0FnTUNBN3A2YXpRRRAB!2m1!1s0x0:0x18b9e1f6e71c94f3!3m1!1s2@1:CIHM0ogKEICAgMCA7p6azQE%7C%7C?hl=id","Untuk poli anak terkadang pelayanan kurang apa karna Gonta ganti petugas nya ya ,kemarin2 bagus loh dan terkadang kalau minta surat rujukan riweh dan harus berdebat dulu dengan drama2 tidak jelas petugas yg satu bilang gini yg satunya bilang gitu .
Ada peningkatan sekarang di kasih wifi gratis buat pengunjung keren lah
Selebihnya pelayanan bagus"
"Puskesmas Pleret","https://www.google.com/maps/search/?api=1&query=Puskesmas%20Pleret&query_place_id=ChIJj4ZDADZUei4R85Qc5_bhuRg","1","Dorin Renos","https://www.google.com/maps/reviews/data=!4m8!14m7!1m6!2m5!1sChdDSUhNMG9nS0VJQ0FnSURfenRDZXhRRRAB!2m1!1s0x0:0x18b9e1f6e71c94f3!3m1!1s2@1:CIHM0ogKEICAgID_ztCexQE%7C%7C?hl=id","Yang bayar rakyat.
Harus nya ada effort memperjuangkan kesehatan rakyat.. Buka 24 jam dong..
Orang sakit ga bisa nunggu waktu.."
"Puskesmas Pleret","https://www.google.com/maps/search/?api=1&query=Puskesmas%20Pleret&query_place_id=ChIJj4ZDADZUei4R85Qc5_bhuRg","5","DZAKY ARDIYANNA","https://www.google.com/maps/reviews/data=!4m8!14m7!1m6!2m5!1sChdDSUhNMG9nS0VJQ0FnSUNfcDhxay1nRRAB!2m1!1s0x0:0x18b9e1f6e71c94f3!3m1!1s2@1:CIHM0ogKEICAgIC_p8qk-gE%7C%7C?hl=id","Untuk ibu hamil ada senam yoga tidak ya?"
"Puskesmas Pleret","https://www.google.com/maps/search/?api=1&query=Puskesmas%20Pleret&query_place_id=ChIJj4ZDADZUei4R85Qc5_bhuRg","5","Qatrunada Rowi","https://www.google.com/maps/reviews/data=!4m8!14m7!1m6!2m5!1sChdDSUhNMG9nS0VJQ0FnSUNfcEpyVXl3RRAB!2m1!1s0x0:0x18b9e1f6e71c94f3!3m1!1s2@1:CIHM0ogKEICAgIC_pJrUywE%7C%7C?hl=id","Bagus ,bersih ,pelayanan sabar,ramah"
"Puskesmas Pleret","https://www.google.com/maps/search/?api=1&query=Puskesmas%20Pleret&query_place_id=ChIJj4ZDADZUei4R85Qc5_bhuRg","5","Puja Zalia","https://www.google.com/maps/reviews/data=!4m8!14m7!1m6!2m5!1sChZDSUhNMG9nS0VJQ0FnSURmXzR1Wk5nEAE!2m1!1s0x0:0x18b9e1f6e71c94f3!3m1!1s2@1:CIHM0ogKEICAgIDf_4uZNg%7C%7C?hl=id",
"Puskesmas Pleret","https://www.google.com/maps/search/?api=1&query=Puskesmas%20Pleret&query_place_id=ChIJj4ZDADZUei4R85Qc5_bhuRg","5","Nia Rusmiati","https://www.google.com/maps/reviews/data=!4m8!14m7!1m6!2m5!1sChZDSUhNMG9nS0VJQ0FnSURmenNIUlB3EAE!2m1!1s0x0:0x18b9e1f6e71c94f3!3m1!1s2@1:CIHM0ogKEICAgIDfzsHRPw%7C%7C?hl=id","Alhamdulillah sudah selesai praktik di puskesmas Pleret 😍
Kondisinya sangat bersih, pelayanan nya bagus dan semua petugasnya baik-baik dan ramah ramah, Ter the best"
"Puskesmas Pleret","https://www.google.com/maps/search/?api=1&query=Puskesmas%20Pleret&query_place_id=ChIJj4ZDADZUei4R85Qc5_bhuRg","3","Yuni Iswanti","https://www.google.com/maps/reviews/data=!4m8!14m7!1m6!2m5!1sChZDSUhNMG9nS0VJQ0FnSUNmNWNLVVpREAE!2m1!1s0x0:0x18b9e1f6e71c94f3!3m1!1s2@1:CIHM0ogKEICAgICf5cKUZQ%7C%7C?hl=id","Pelayanan periksa umum baguss
Cuman yang di mtbs pelayanan buruk
Pasien nunggu di luar lama sedangkan bidan dan perawat di dalam cuma main hp lama banget gak satset melayani pasien"
"Puskesmas Pleret","https://www.google.com/maps/search/?api=1&query=Puskesmas%20Pleret&query_place_id=ChIJj4ZDADZUei4R85Qc5_bhuRg","1","Kawulo Alit","https://www.google.com/maps/reviews/data=!4m8!14m7!1m6!2m5!1sChZDSUhNMG9nS0VJQ0FnSUR5ckphd2NnEAE!2m1!1s0x0:0x18b9e1f6e71c94f3!3m1!1s2@1:CIHM0ogKEICAgIDyrJawcg%7C%7C?hl=id","Bidannya ada yg judes ketus yg pakai kacamata, apa krna pakai bpjs jadi melayaninya kurang ramah..
Tolong yg baik sama pasien, pasien datang baik2 mau periksa bukan mau ngajakin ribut jadi tolong lebih ramah!!!! Sangat Tidak Ramah!!!"
"Puskesmas Pleret","https://www.google.com/maps/search/?api=1&query=Puskesmas%20Pleret&query_place_id=ChIJj4ZDADZUei4R85Qc5_bhuRg","5","Hafidh Syahputra","https://www.google.com/maps/reviews/data=!4m8!14m7!1m6!2m5!1sChZDSUhNMG9nS0VJQ0FnSUR2Ni1LZWV3EAE!2m1!1s0x0:0x18b9e1f6e71c94f3!3m1!1s2@1:CIHM0ogKEICAgIDv6-Keew%7C%7C?hl=id","Pelayanan poli gigi 👍👍 ramah dan mantappp"
"Puskesmas Pleret","https://www.google.com/maps/search/?api=1&query=Puskesmas%20Pleret&query_place_id=ChIJj4ZDADZUei4R85Qc5_bhuRg","5","CINDY ADELIA","https://www.google.com/maps/reviews/data=!4m8!14m7!1m6!2m5!1sChZDSUhNMG9nS0VJQ0FnSUN2dy12WFV3EAE!2m1!1s0x0:0x18b9e1f6e71c94f3!3m1!1s2@1:CIHM0ogKEICAgICvw-vXUw%7C%7C?hl=id","Alhamdulillah saya selama berobat di puskesmas, bagian pelayanan obat tersebut pelayanan obat nya cepat , ramah, di beri penjelasan tentang pemakaian obat nya."
"Puskesmas Pleret","https://www.google.com/maps/search/?api=1&query=Puskesmas%20Pleret&query_place_id=ChIJj4ZDADZUei4R85Qc5_bhuRg","5","CAMELIA ROHAYYA C. BARUS","https://www.google.com/maps/reviews/data=!4m8!14m7!1m6!2m5!1sChdDSUhNMG9nS0VJQ0FnSUN2dy11RXBnRRAB!2m1!1s0x0:0x18b9e1f6e71c94f3!3m1!1s2@1:CIHM0ogKEICAgICvw-uEpgE%7C%7C?hl=id","Puskesmas nya pelayanannya cukup cepat,mba yang jelasin pelayanan obatnya juga sangat jelas, puskesmas juga bersih 🥰"
"Puskesmas Pleret","https://www.google.com/maps/search/?api=1&query=Puskesmas%20Pleret&query_place_id=ChIJj4ZDADZUei4R85Qc5_bhuRg","5","DHEA PUTRI PRAMUDHANY","https://www.google.com/maps/reviews/data=!4m8!14m7!1m6!2m5!1sChdDSUhNMG9nS0VJQ0FnSUN2d19QcXVRRRAB!2m1!1s0x0:0x18b9e1f6e71c94f3!3m1!1s2@1:CIHM0ogKEICAgICvw_PquQE%7C%7C?hl=id","puskesmas pleret tempat nya bersih, pelayanan obat nya cepat dan ramah, ruang tunggunya juga banyak, dan penjelasannya saat penyerahan obat sangat jelas dan mudah di pahami jika bertanya mengenai obat yang kurang kita pahami dijelaskan sampai kita paham ❤️"
"Puskesmas Pleret","https://www.google.com/maps/search/?api=1&query=Puskesmas%20Pleret&query_place_id=ChIJj4ZDADZUei4R85Qc5_bhuRg","5","Antarisa Riski","https://www.google.com/maps/reviews/data=!4m8!14m7!1m6!2m5!1sChdDSUhNMG9nS0VJQ0FnSUN2dzVPcHNBRRAB!2m1!1s0x0:0x18b9e1f6e71c94f3!3m1!1s2@1:CIHM0ogKEICAgICvw5OpsAE%7C%7C?hl=id","Pelayanannya baik, ramah, pengambilan obat di farmasinya lumayan cepat dan penyampaian mengenai penggunaan obatnya mudah dipahami."
"Puskesmas Pleret","https://www.google.com/maps/search/?api=1&query=Puskesmas%20Pleret&query_place_id=ChIJj4ZDADZUei4R85Qc5_bhuRg","5","Rahma Suryani","https://www.google.com/maps/reviews/data=!4m8!14m7!1m6!2m5!1sChdDSUhNMG9nS0VJQ0FnSURQeGJhYXVnRRAB!2m1!1s0x0:0x18b9e1f6e71c94f3!3m1!1s2@1:CIHM0ogKEICAgIDPxbaaugE%7C%7C?hl=id","Pertahankan keramahtamahannya..!"
"Puskesmas Pleret","https://www.google.com/maps/search/?api=1&query=Puskesmas%20Pleret&query_place_id=ChIJj4ZDADZUei4R85Qc5_bhuRg","1","Al Fajri Muhammad","https://www.google.com/maps/reviews/data=!4m8!14m7!1m6!2m5!1sChdDSUhNMG9nS0VJQ0FnSURQa2F6cXp3RRAB!2m1!1s0x0:0x18b9e1f6e71c94f3!3m1!1s2@1:CIHM0ogKEICAgIDPkazqzwE%7C%7C?hl=id","Pelayanan kurang ramah"
"Puskesmas Pleret","https://www.google.com/maps/search/?api=1&query=Puskesmas%20Pleret&query_place_id=ChIJj4ZDADZUei4R85Qc5_bhuRg","5","Putri Wafa","https://www.google.com/maps/reviews/data=!4m8!14m7!1m6!2m5!1sChZDSUhNMG9nS0VJQ0FnSURQdHNQOVZBEAE!2m1!1s0x0:0x18b9e1f6e71c94f3!3m1!1s2@1:CIHM0ogKEICAgIDPtsP9VA%7C%7C?hl=id","Dalam membantu penelitian mahasiswa pelayanan nya sangat cepat sehingga mempermudah mahasiswa dalam melakukan penelitian"
"Puskesmas Pleret","https://www.google.com/maps/search/?api=1&query=Puskesmas%20Pleret&query_place_id=ChIJj4ZDADZUei4R85Qc5_bhuRg","5","Dwi fatma","https://www.google.com/maps/reviews/data=!4m8!14m7!1m6!2m5!1sChZDSUhNMG9nS0VJQ0FnSURQM05ydWVREAE!2m1!1s0x0:0x18b9e1f6e71c94f3!3m1!1s2@1:CIHM0ogKEICAgIDP3NrueQ%7C%7C?hl=id","berkunjung ke poli gigi, dokter nya ramah² sama sekali tidak sakit, pelayanan ramah sekali
love 💕💕 terima kasih dok 💕"
"Puskesmas Pleret","https://www.google.com/maps/search/?api=1&query=Puskesmas%20Pleret&query_place_id=ChIJj4ZDADZUei4R85Qc5_bhuRg","5","Nurrahmi Suffiani","https://www.google.com/maps/reviews/data=!4m8!14m7!1m6!2m5!1sChZDSUhNMG9nS0VJQ0FnSURQM0t5blZnEAE!2m1!1s0x0:0x18b9e1f6e71c94f3!3m1!1s2@1:CIHM0ogKEICAgIDP3KynVg%7C%7C?hl=id","pelayanan gigi manteb banget pokoknya, buat mbaknya yg jaga di poli gigi juga asik banget deh SUKAKK❤️❤️"
"Puskesmas Pleret","https://www.google.com/maps/search/?api=1&query=Puskesmas%20Pleret&query_place_id=ChIJj4ZDADZUei4R85Qc5_bhuRg","5","Elaula fq","https://www.google.com/maps/reviews/data=!4m8!14m7!1m6!2m5!1sChZDSUhNMG9nS0VJQ0FnSUNQam9xX1NnEAE!2m1!1s0x0:0x18b9e1f6e71c94f3!3m1!1s2@1:CIHM0ogKEICAgICPjoq_Sg%7C%7C?hl=id","Sangat memuaskan , pelayanan nya sangat baik dan dokternya sangat ramah, terutama Bu dokter gigi yang baik dan cantik jelita we love you❤️❤️"
"Puskesmas Pleret","https://www.google.com/maps/search/?api=1&query=Puskesmas%20Pleret&query_place_id=ChIJj4ZDADZUei4R85Qc5_bhuRg","5","Maulana Respati","https://www.google.com/maps/reviews/data=!4m8!14m7!1m6!2m5!1sChZDSUhNMG9nS0VJQ0FnSUQzOTlxN1NBEAE!2m1!1s0x0:0x18b9e1f6e71c94f3!3m1!1s2@1:CIHM0ogKEICAgID399q7SA%7C%7C?hl=id","pertama kali priksa, petugas ramah dan pelayanan cepat"
"Puskesmas Pleret","https://www.google.com/maps/search/?api=1&query=Puskesmas%20Pleret&query_place_id=ChIJj4ZDADZUei4R85Qc5_bhuRg","5","Fathul Barriy","https://www.google.com/maps/reviews/data=!4m8!14m7!1m6!2m5!1sChZDSUhNMG9nS0VJQ0FnSUQzeXFPMUV3EAE!2m1!1s0x0:0x18b9e1f6e71c94f3!3m1!1s2@1:CIHM0ogKEICAgID3yqO1Ew%7C%7C?hl=id","DOKTER GIGI NYA RAMAH BAGUS DAN NYAMAN 😘🤟🤙🦷"
"Puskesmas Pleret","https://www.google.com/maps/search/?api=1&query=Puskesmas%20Pleret&query_place_id=ChIJj4ZDADZUei4R85Qc5_bhuRg","4","Darinem S. Pd.","https://www.google.com/maps/reviews/data=!4m8!14m7!1m6!2m5!1sChdDSUhNMG9nS0VJQ0FnSUQzeW8yeS13RRAB!2m1!1s0x0:0x18b9e1f6e71c94f3!3m1!1s2@1:CIHM0ogKEICAgID3yo2y-wE%7C%7C?hl=id","Alhamdulillah saat kami sowan bersama pengurus IGABA Kapanewon Pleret, dalam rangka menyampaikan informasi organisasi Ikatan Guru Bustanul Athfal mandiri, diterima dg ramah dan menyejukkan, barakallah utk semuanya...Aamiin"
"Puskesmas Pleret","https://www.google.com/maps/search/?api=1&query=Puskesmas%20Pleret&query_place_id=ChIJj4ZDADZUei4R85Qc5_bhuRg","5","Rahma Nur Aditya","https://www.google.com/maps/reviews/data=!4m8!14m7!1m6!2m5!1sChZDSUhNMG9nS0VJQ0FnSUQzM09TQlRREAE!2m1!1s0x0:0x18b9e1f6e71c94f3!3m1!1s2@1:CIHM0ogKEICAgID33OSBTQ%7C%7C?hl=id",
