"title","url","stars","name","reviewUrl","text"
"Puskesmas Pleret","https://www.google.com/maps/search/?api=1&query=Puskesmas%20Pleret&query_place_id=ChIJj4ZDADZUei4R85Qc5_bhuRg","5","Dava Trirangga","https://www.google.com/maps/reviews/data=!4m8!14m7!1m6!2m5!1sChdDSUhNMG9nS0VJQ0FnSUQzbk0tOXlnRRAB!2m1!1s0x0:0x18b9e1f6e71c94f3!3m1!1s2@1:CIHM0ogKEICAgID3nM-9ygE%7C%7C?hl=id","pelayanan puskesmas nya sangat baik"
"Puskesmas Pleret","https://www.google.com/maps/search/?api=1&query=Puskesmas%20Pleret&query_place_id=ChIJj4ZDADZUei4R85Qc5_bhuRg","5","lyna zuan","https://www.google.com/maps/reviews/data=!4m8!14m7!1m6!2m5!1sChdDSUhNMG9nS0VJQ0FnSUQzN052S3R3RRAB!2m1!1s0x0:0x18b9e1f6e71c94f3!3m1!1s2@1:CIHM0ogKEICAgID37NvKtwE%7C%7C?hl=id","Pelayanannya sangat baik,, ramah juga,, mantab pokoknya 👍"
"Puskesmas Pleret","https://www.google.com/maps/search/?api=1&query=Puskesmas%20Pleret&query_place_id=ChIJj4ZDADZUei4R85Qc5_bhuRg","2","ajeng Mar'atu","https://www.google.com/maps/reviews/data=!4m8!14m7!1m6!2m5!1sChdDSUhNMG9nS0VJQ0FnSUQzN0l1QjBRRRAB!2m1!1s0x0:0x18b9e1f6e71c94f3!3m1!1s2@1:CIHM0ogKEICAgID37IuB0QE%7C%7C?hl=id","Urus surat keterangan sehat dari jam set 8 sampe jam set 10 belum selesai juga. Lambreta"
"Puskesmas Pleret","https://www.google.com/maps/search/?api=1&query=Puskesmas%20Pleret&query_place_id=ChIJj4ZDADZUei4R85Qc5_bhuRg","5","rizky rizky","https://www.google.com/maps/reviews/data=!4m8!14m7!1m6!2m5!1sChZDSUhNMG9nS0VJQ0FnSUQzLU4zWFBBEAE!2m1!1s0x0:0x18b9e1f6e71c94f3!3m1!1s2@1:CIHM0ogKEICAgID3-N3XPA%7C%7C?hl=id","gratis"
"Puskesmas Pleret","https://www.google.com/maps/search/?api=1&query=Puskesmas%20Pleret&query_place_id=ChIJj4ZDADZUei4R85Qc5_bhuRg","5","Nur Iman Muhammad 8F","https://www.google.com/maps/reviews/data=!4m8!14m7!1m6!2m5!1sChZDSUhNMG9nS0VJQ0FnSUQzLUszc0pREAE!2m1!1s0x0:0x18b9e1f6e71c94f3!3m1!1s2@1:CIHM0ogKEICAgID3-K3sJQ%7C%7C?hl=id","gratis lek"
"Puskesmas Pleret","https://www.google.com/maps/search/?api=1&query=Puskesmas%20Pleret&query_place_id=ChIJj4ZDADZUei4R85Qc5_bhuRg","5","Ike Puspita","https://www.google.com/maps/reviews/data=!4m8!14m7!1m6!2m5!1sChdDSUhNMG9nS0VJQ0FnSUQzLU0ybjNBRRAB!2m1!1s0x0:0x18b9e1f6e71c94f3!3m1!1s2@1:CIHM0ogKEICAgID3-M2n3AE%7C%7C?hl=id",
"Puskesmas Pleret","https://www.google.com/maps/search/?api=1&query=Puskesmas%20Pleret&query_place_id=ChIJj4ZDADZUei4R85Qc5_bhuRg","5","Andri Kurniawan Praditya","https://www.google.com/maps/reviews/data=!4m8!14m7!1m6!2m5!1sChdDSUhNMG9nS0VJQ0FnSUQzb05HMzNRRRAB!2m1!1s0x0:0x18b9e1f6e71c94f3!3m1!1s2@1:CIHM0ogKEICAgID3oNG33QE%7C%7C?hl=id","pelayanan bagus bidan nya ramah"
"Puskesmas Pleret","https://www.google.com/maps/search/?api=1&query=Puskesmas%20Pleret&query_place_id=ChIJj4ZDADZUei4R85Qc5_bhuRg","5","RIZKY RIZKY","https://www.google.com/maps/reviews/data=!4m8!14m7!1m6!2m5!1sChdDSUhNMG9nS0VJQ0FnSUMzZ2J5eGxnRRAB!2m1!1s0x0:0x18b9e1f6e71c94f3!3m1!1s2@1:CIHM0ogKEICAgIC3gbyxlgE%7C%7C?hl=id",
"Puskesmas Pleret","https://www.google.com/maps/search/?api=1&query=Puskesmas%20Pleret&query_place_id=ChIJj4ZDADZUei4R85Qc5_bhuRg","5","Yudhan Adhi","https://www.google.com/maps/reviews/data=!4m8!14m7!1m6!2m5!1sChZDSUhNMG9nS0VJQ0FnSUMzZ1p5dWVREAE!2m1!1s0x0:0x18b9e1f6e71c94f3!3m1!1s2@1:CIHM0ogKEICAgIC3gZyueQ%7C%7C?hl=id",
"Puskesmas Pleret","https://www.google.com/maps/search/?api=1&query=Puskesmas%20Pleret&query_place_id=ChIJj4ZDADZUei4R85Qc5_bhuRg","5","hihammmppp","https://www.google.com/maps/reviews/data=!4m8!14m7!1m6!2m5!1sChdDSUhNMG9nS0VJQ0FnSUMzZ2V5bWdBRRAB!2m1!1s0x0:0x18b9e1f6e71c94f3!3m1!1s2@1:CIHM0ogKEICAgIC3geymgAE%7C%7C?hl=id",
"Puskesmas Pleret","https://www.google.com/maps/search/?api=1&query=Puskesmas%20Pleret&query_place_id=ChIJj4ZDADZUei4R85Qc5_bhuRg","5","Farid nur Rohiddin","https://www.google.com/maps/reviews/data=!4m8!14m7!1m6!2m5!1sChdDSUhNMG9nS0VJQ0FnSUMzaHQtY21nRRAB!2m1!1s0x0:0x18b9e1f6e71c94f3!3m1!1s2@1:CIHM0ogKEICAgIC3ht-cmgE%7C%7C?hl=id","Pelayanan e jos jiss pokok e tidak mengecewakan"
"Puskesmas Pleret","https://www.google.com/maps/search/?api=1&query=Puskesmas%20Pleret&query_place_id=ChIJj4ZDADZUei4R85Qc5_bhuRg","5","listya fauziyah","https://www.google.com/maps/reviews/data=!4m8!14m7!1m6!2m5!1sChdDSUhNMG9nS0VJQ0FnSURYd2JQUXNBRRAB!2m1!1s0x0:0x18b9e1f6e71c94f3!3m1!1s2@1:CIHM0ogKEICAgIDXwbPQsAE%7C%7C?hl=id","Kemahiran dokter gigi pukesmas Pleret sangat tidak diragukan..pelayanannya yang ramah dan sangat  tlaten . trimakasih utk pelayanannya 🙏"
"Puskesmas Pleret","https://www.google.com/maps/search/?api=1&query=Puskesmas%20Pleret&query_place_id=ChIJj4ZDADZUei4R85Qc5_bhuRg","1","Keysha ayu","https://www.google.com/maps/reviews/data=!4m8!14m7!1m6!2m5!1sChdDSUhNMG9nS0VJQ0FnSURYa0xYYXNRRRAB!2m1!1s0x0:0x18b9e1f6e71c94f3!3m1!1s2@1:CIHM0ogKEICAgIDXkLXasQE%7C%7C?hl=id",
"Puskesmas Pleret","https://www.google.com/maps/search/?api=1&query=Puskesmas%20Pleret&query_place_id=ChIJj4ZDADZUei4R85Qc5_bhuRg","5","Ade Sumiati","https://www.google.com/maps/reviews/data=!4m8!14m7!1m6!2m5!1sChdDSUhNMG9nS0VJQ0FnSUNYZ2M2VW9BRRAB!2m1!1s0x0:0x18b9e1f6e71c94f3!3m1!1s2@1:CIHM0ogKEICAgICXgc6UoAE%7C%7C?hl=id","Alhamdulillah , dokter nya baik baik, pelayanan nya ok , kalo wa sama dokter nya konsultasi langsung di jawab , pokok nya Puskesmas Pleret the best , terimakasih Bu dokter"
"Puskesmas Pleret","https://www.google.com/maps/search/?api=1&query=Puskesmas%20Pleret&query_place_id=ChIJj4ZDADZUei4R85Qc5_bhuRg","2","Bagas Saputro","https://www.google.com/maps/reviews/data=!4m8!14m7!1m6!2m5!1sChZDSUhNMG9nS0VJQ0FnSUNYOHA2NUhBEAE!2m1!1s0x0:0x18b9e1f6e71c94f3!3m1!1s2@1:CIHM0ogKEICAgICX8p65HA%7C%7C?hl=id","Pelayanan bagian administrasinya sangat bagus, tapi untuk bagian pemeriksaan dokternya tidak ramah banget."
"Puskesmas Pleret","https://www.google.com/maps/search/?api=1&query=Puskesmas%20Pleret&query_place_id=ChIJj4ZDADZUei4R85Qc5_bhuRg","5","chandra karuna","https://www.google.com/maps/reviews/data=!4m8!14m7!1m6!2m5!1sChZDSUhNMG9nS0VJQ0FnSURINHBId1p3EAE!2m1!1s0x0:0x18b9e1f6e71c94f3!3m1!1s2@1:CIHM0ogKEICAgIDH4pHwZw%7C%7C?hl=id","Pelayanan baik and sopan"
"Puskesmas Pleret","https://www.google.com/maps/search/?api=1&query=Puskesmas%20Pleret&query_place_id=ChIJj4ZDADZUei4R85Qc5_bhuRg","5","Tabita Nina","https://www.google.com/maps/reviews/data=!4m8!14m7!1m6!2m5!1sChdDSUhNMG9nS0VJQ0FnSURIbE0ta3hnRRAB!2m1!1s0x0:0x18b9e1f6e71c94f3!3m1!1s2@1:CIHM0ogKEICAgIDHlM-kxgE%7C%7C?hl=id","Pelayanan Poli gigi nya bagus, kemarin saya buat gigi palsu di sini bisa menggunakan bpjs dan hasilnya bagus, walopun sempet direvisi tp kualitasnya gak kalah kaya d RS,dokternya ramah, dan bisa menangani saya yg sgt sensitif klo diutek2 giginya. :)terimakasih drg. Ignatia lidya handayani, the best.

Seminggu lalu anak saya dilarikan ke UGD jm 12 siang, dan gercep penanganannya.

Poli fisioterapinya bagus: komunikatif, nyaman saat konsultasi n gak mburu mburu, disinar dan diajari gerakan untuk latihan dirumah.

Poli anak untuk imunisasi pelayanannya rada kurang anak di bawah 1tahun di suntik sampai keluar darah dibiarkan saja bahkan suruh bawa keluar untuk gantian dg yg lain krn rame.Tidak dibersihkan dl darahnya atau d beri plester :(
Oia klo ada anak magang hanya ngerubung lihatin jd malah tambah riweh.

MTBS : minta rujukan k dsa cukup ribet n ada perdebatan, krn menurut buku kia klo 3bulan naik BB tidak sesuai seharusnya perlu d curigai bsa rujuk. sampe suruh cek darah d laboratorium puskesmas krn d blg gpp. Tp setelah ngotot Akhirnya bisa ke DSA dan di cek darah lagi di Rumah sakit : hasil cek darah sangat berbeda dg yg d puskesmas n treatmen atas penyakit jg berbeda.

Fases ke 1saya disini, jd bsa koment banyak berdasarkan pengalaman.
Over all terimakasih puskesmas pleret"
"Puskesmas Pleret","https://www.google.com/maps/search/?api=1&query=Puskesmas%20Pleret&query_place_id=ChIJj4ZDADZUei4R85Qc5_bhuRg","5","Nadira Azzahra Abadi","https://www.google.com/maps/reviews/data=!4m8!14m7!1m6!2m5!1sChZDSUhNMG9nS0VJQ0FnSUNINmQzcGVnEAE!2m1!1s0x0:0x18b9e1f6e71c94f3!3m1!1s2@1:CIHM0ogKEICAgICH6d3peg%7C%7C?hl=id","Minggu lalu anak saya cabut gigi dengan drg hani, walau ada sedikit kendala(agak lama krn kasus akar giginya tiga) , tp alhamdulillah tertangani dengan cepat,,dokter nya ramah dan juga baik,,makasih dokter hani"
"Puskesmas Pleret","https://www.google.com/maps/search/?api=1&query=Puskesmas%20Pleret&query_place_id=ChIJj4ZDADZUei4R85Qc5_bhuRg","1","Rahayu ai","https://www.google.com/maps/reviews/data=!4m8!14m7!1m6!2m5!1sChZDSUhNMG9nS0VJQ0FnSUNMc1pxSlV3EAE!2m1!1s0x0:0x18b9e1f6e71c94f3!3m1!1s2@1:CIHM0ogKEICAgICLsZqJUw%7C%7C?hl=id","IGD sekedar pajangan, tidak ada dokter jaga. Poli KIA dan mtbs antre lama bnget (jeda pasien keluar ke panggilan berikutnya lama), tidak ada tempat duduk untuk tunggu antrean. Tidak diberitahu diagnosis, langsung dioper ke farmasi. Nunggu obat kaya nunggu berangkat haji, LAMAAAA

Minta rujukan pdhl sudah bawa pengantar dan tembusan dari DSA RS tapi dipersulit, pdhl faskes 1 di sini, akhirnya baru dapat rujukan setelah 3 jam lebih nunggu."
"Puskesmas Pleret","https://www.google.com/maps/search/?api=1&query=Puskesmas%20Pleret&query_place_id=ChIJj4ZDADZUei4R85Qc5_bhuRg","1","Najwa Nur Anifa","https://www.google.com/maps/reviews/data=!4m8!14m7!1m6!2m5!1sChZDSUhNMG9nS0VJQ0FnSURiX3BPOExBEAE!2m1!1s0x0:0x18b9e1f6e71c94f3!3m1!1s2@1:CIHM0ogKEICAgIDb_pO8LA%7C%7C?hl=id","poli gigi tidak ramah dan pelayanan kurang, padahal saya bayar sendiri ngga bpjs"
"Puskesmas Pleret","https://www.google.com/maps/search/?api=1&query=Puskesmas%20Pleret&query_place_id=ChIJj4ZDADZUei4R85Qc5_bhuRg","5","Amalina Kurniasari","https://www.google.com/maps/reviews/data=!4m8!14m7!1m6!2m5!1sChZDSUhNMG9nS0VJQ0FnSUNiMkpQckd3EAE!2m1!1s0x0:0x18b9e1f6e71c94f3!3m1!1s2@1:CIHM0ogKEICAgICb2JPrGw%7C%7C?hl=id","Instagramnya sangat informatif. Saya bukan warga pleret namun selalu update informasi dari akun instagram Puskesmas Pleret. Terima kasih."
"Puskesmas Pleret","https://www.google.com/maps/search/?api=1&query=Puskesmas%20Pleret&query_place_id=ChIJj4ZDADZUei4R85Qc5_bhuRg","5","Kamelia Lina","https://www.google.com/maps/reviews/data=!4m8!14m7!1m6!2m5!1sChZDSUhNMG9nS0VJQ0FnSURya0p5X0JBEAE!2m1!1s0x0:0x18b9e1f6e71c94f3!3m1!1s2@1:CIHM0ogKEICAgIDrkJy_BA%7C%7C?hl=id",
"Puskesmas Pleret","https://www.google.com/maps/search/?api=1&query=Puskesmas%20Pleret&query_place_id=ChIJj4ZDADZUei4R85Qc5_bhuRg","5","Devi Shan","https://www.google.com/maps/reviews/data=!4m8!14m7!1m6!2m5!1sChZDSUhNMG9nS0VJQ0FnSUNyMy16T0V3EAE!2m1!1s0x0:0x18b9e1f6e71c94f3!3m1!1s2@1:CIHM0ogKEICAgICr3-zOEw%7C%7C?hl=id","maaf kak mau tanya apakah di puskesmas pleret ada tes IQ untuk anak??"
"Puskesmas Pleret","https://www.google.com/maps/search/?api=1&query=Puskesmas%20Pleret&query_place_id=ChIJj4ZDADZUei4R85Qc5_bhuRg","2","dinta indriana1","https://www.google.com/maps/reviews/data=!4m8!14m7!1m6!2m5!1sChdDSUhNMG9nS0VJQ0FnSUNyNEllcWlRRRAB!2m1!1s0x0:0x18b9e1f6e71c94f3!3m1!1s2@1:CIHM0ogKEICAgICr4IeqiQE%7C%7C?hl=id","Bohong kalo buka sampe jam 14:30.
Saya td kesana sekitar jam 12... Tanya d bagian pendaftaran...mbaknya bilang udah tutup...dan tutup jam 11..."
"Puskesmas Pleret","https://www.google.com/maps/search/?api=1&query=Puskesmas%20Pleret&query_place_id=ChIJj4ZDADZUei4R85Qc5_bhuRg","5","rossiana dewi","https://www.google.com/maps/reviews/data=!4m8!14m7!1m6!2m5!1sChdDSUhNMG9nS0VJQ0FnSURMdDRpc2d3RRAB!2m1!1s0x0:0x18b9e1f6e71c94f3!3m1!1s2@1:CIHM0ogKEICAgIDLt4isgwE%7C%7C?hl=id","puas sekali karena pelayanannya sangat baik, dan gercep, nakesnya juga ramah"" sekali"
"Puskesmas Pleret","https://www.google.com/maps/search/?api=1&query=Puskesmas%20Pleret&query_place_id=ChIJj4ZDADZUei4R85Qc5_bhuRg","5","Intan Rahma dani","https://www.google.com/maps/reviews/data=!4m8!14m7!1m6!2m5!1sChZDSUhNMG9nS0VJQ0FnSURMdDRpQUxREAE!2m1!1s0x0:0x18b9e1f6e71c94f3!3m1!1s2@1:CIHM0ogKEICAgIDLt4iALQ%7C%7C?hl=id","Pelayanan baik, dan tenaga kesehatannya ramah-ramah, melayani dengan baik, petugas parkirnya pun ramah dan sangat membantu."
"Puskesmas Pleret","https://www.google.com/maps/search/?api=1&query=Puskesmas%20Pleret&query_place_id=ChIJj4ZDADZUei4R85Qc5_bhuRg","5","Asih DFG","https://www.google.com/maps/reviews/data=!4m8!14m7!1m6!2m5!1sChZDSUhNMG9nS0VJQ0FnSURMZzdTWkZnEAE!2m1!1s0x0:0x18b9e1f6e71c94f3!3m1!1s2@1:CIHM0ogKEICAgIDLg7SZFg%7C%7C?hl=id","Semakin kesini Puskesmas Pleret semakin memberikan pelayanan yang baik.
Petugas 95% Ramah, Komunikatif, dan Sat set.
Dokternya juga sangat baik semua dokter selalu menjelaskan penyakit dengan bahasa yg mudah sehingga bisa sangat dimengerti oleh pasien.

Yg masih menjadi kekurangan menurut saya:
-Layar monitor (TV) antrian yang mati
-Mbak2 yg bertugas sebelum masuk ke dokter umum, mungkin bisa agak sedikit dipelankan suaranya (Disini sy hanya melihat dan mendengar krn kebetulan pas barengan). Ada ibu2 yg sudah sepuh dan mngkin sudah dipanggil bbrp kali kurg mendengar (Ibunya jg lagi sakit), tp si mbak ngmng nya agak dengan emosi.

Kami juga memahami di Puskesmas pasti capek dan sllu ramai. Cuma mungkin bisa ditambh kesabarannya...

Terima kasih Puskesmas Pleret"
"Puskesmas Pleret","https://www.google.com/maps/search/?api=1&query=Puskesmas%20Pleret&query_place_id=ChIJj4ZDADZUei4R85Qc5_bhuRg","5","Wahyu S. Murti","https://www.google.com/maps/reviews/data=!4m8!14m7!1m6!2m5!1sChdDSUhNMG9nS0VJQ0FnSURMb3FpUHpRRRAB!2m1!1s0x0:0x18b9e1f6e71c94f3!3m1!1s2@1:CIHM0ogKEICAgIDLoqiPzQE%7C%7C?hl=id","2x ke sini, pelayanan cukup memuaskan. Secara keseluruhan, petugas melayani dengan baik dan ramah tanpa diskriminasi, konsultasi pun interaktif. Permintaan informasi dari WA juga direspon dengan baik."
"Puskesmas Pleret","https://www.google.com/maps/search/?api=1&query=Puskesmas%20Pleret&query_place_id=ChIJj4ZDADZUei4R85Qc5_bhuRg","5","Dian Dwi Rahmawati","https://www.google.com/maps/reviews/data=!4m8!14m7!1m6!2m5!1sChdDSUhNMG9nS0VJQ0FnSUNMXzhpM3J3RRAB!2m1!1s0x0:0x18b9e1f6e71c94f3!3m1!1s2@1:CIHM0ogKEICAgICL_8i3rwE%7C%7C?hl=id","puskesmasnya bagus banget,  pelayanannya oke, nakesnya ramah ramah,  top lah pokoknyaa"
"Puskesmas Pleret","https://www.google.com/maps/search/?api=1&query=Puskesmas%20Pleret&query_place_id=ChIJj4ZDADZUei4R85Qc5_bhuRg","5","Ratih Setya","https://www.google.com/maps/reviews/data=!4m8!14m7!1m6!2m5!1sChdDSUhNMG9nS0VJQ0FnSUNMdl8zZV93RRAB!2m1!1s0x0:0x18b9e1f6e71c94f3!3m1!1s2@1:CIHM0ogKEICAgICLv_3e_wE%7C%7C?hl=id","Pelayanan sudah bagus dan nakesnya ramah ramah dalam membantu pasien dan keluarga"
"Puskesmas Pleret","https://www.google.com/maps/search/?api=1&query=Puskesmas%20Pleret&query_place_id=ChIJj4ZDADZUei4R85Qc5_bhuRg","5","Novita Andriani","https://www.google.com/maps/reviews/data=!4m8!14m7!1m6!2m5!1sChZDSUhNMG9nS0VJQ0FnSUNMdjUtcmVBEAE!2m1!1s0x0:0x18b9e1f6e71c94f3!3m1!1s2@1:CIHM0ogKEICAgICLv5-reA%7C%7C?hl=id","Tempat bersih fasilitas bagus, pelayanan ramah"
"Puskesmas Pleret","https://www.google.com/maps/search/?api=1&query=Puskesmas%20Pleret&query_place_id=ChIJj4ZDADZUei4R85Qc5_bhuRg","5","Johanis Reinchart Narayaman","https://www.google.com/maps/reviews/data=!4m8!14m7!1m6!2m5!1sChZDSUhNMG9nS0VJQ0FnSUNMdjRmWmF3EAE!2m1!1s0x0:0x18b9e1f6e71c94f3!3m1!1s2@1:CIHM0ogKEICAgICLv4fZaw%7C%7C?hl=id","Pelayanannya bagus, perawatnya juga ramah ke pasien"
"Puskesmas Pleret","https://www.google.com/maps/search/?api=1&query=Puskesmas%20Pleret&query_place_id=ChIJj4ZDADZUei4R85Qc5_bhuRg","5","azizah_ 06","https://www.google.com/maps/reviews/data=!4m8!14m7!1m6!2m5!1sChZDSUhNMG9nS0VJQ0FnSUNMdjl1U2ZREAE!2m1!1s0x0:0x18b9e1f6e71c94f3!3m1!1s2@1:CIHM0ogKEICAgICLv9uSfQ%7C%7C?hl=id","Pelayanan yang terbaik, dengan petugas yang ramah, dan lingkungan yang sangat nyaman😇"
"Puskesmas Pleret","https://www.google.com/maps/search/?api=1&query=Puskesmas%20Pleret&query_place_id=ChIJj4ZDADZUei4R85Qc5_bhuRg","5","Aliyah Nur Sani","https://www.google.com/maps/reviews/data=!4m8!14m7!1m6!2m5!1sChZDSUhNMG9nS0VJQ0FnSUNMdjZ2NVFBEAE!2m1!1s0x0:0x18b9e1f6e71c94f3!3m1!1s2@1:CIHM0ogKEICAgICLv6v5QA%7C%7C?hl=id","Pelayanan ramah dan bisa menggunakan BPJS"
"Puskesmas Pleret","https://www.google.com/maps/search/?api=1&query=Puskesmas%20Pleret&query_place_id=ChIJj4ZDADZUei4R85Qc5_bhuRg","5","Clowi","https://www.google.com/maps/reviews/data=!4m8!14m7!1m6!2m5!1sChZDSUhNMG9nS0VJQ0FnSUNMdi1PNWZnEAE!2m1!1s0x0:0x18b9e1f6e71c94f3!3m1!1s2@1:CIHM0ogKEICAgICLv-O5fg%7C%7C?hl=id","Pelayanan bagus ,untuk perawat nya juga sabar dan ramah pada pasien"
"Puskesmas Pleret","https://www.google.com/maps/search/?api=1&query=Puskesmas%20Pleret&query_place_id=ChIJj4ZDADZUei4R85Qc5_bhuRg","1","Luki Canda31","https://www.google.com/maps/reviews/data=!4m8!14m7!1m6!2m5!1sChZDSUhNMG9nS0VJQ0FnSUNMOGE2SERBEAE!2m1!1s0x0:0x18b9e1f6e71c94f3!3m1!1s2@1:CIHM0ogKEICAgICL8a6HDA%7C%7C?hl=id","anjirr pelayanannya UGD sangat sadis sekali"
"Puskesmas Pleret","https://www.google.com/maps/search/?api=1&query=Puskesmas%20Pleret&query_place_id=ChIJj4ZDADZUei4R85Qc5_bhuRg","5","Fryten Kybie","https://www.google.com/maps/reviews/data=!4m8!14m7!1m6!2m5!1sChZDSUhNMG9nS0VJQ0FnSUNMOXJqc1N3EAE!2m1!1s0x0:0x18b9e1f6e71c94f3!3m1!1s2@1:CIHM0ogKEICAgICL9rjsSw%7C%7C?hl=id","Terbaiklah pokoknya.."
"Puskesmas Pleret","https://www.google.com/maps/search/?api=1&query=Puskesmas%20Pleret&query_place_id=ChIJj4ZDADZUei4R85Qc5_bhuRg","1","013 Streetfood","https://www.google.com/maps/reviews/data=!4m8!14m7!1m6!2m5!1sChdDSUhNMG9nS0VJQ0FnSUNUOHZPSTNRRRAB!2m1!1s0x0:0x18b9e1f6e71c94f3!3m1!1s2@1:CIHM0ogKEICAgICT8vOI3QE%7C%7C?hl=id","Ra masuk blas, seko jam 7.30 - 12.00 layanan e koyo bekicot, gremeeet ra ketulungan"
"Puskesmas Pleret","https://www.google.com/maps/search/?api=1&query=Puskesmas%20Pleret&query_place_id=ChIJj4ZDADZUei4R85Qc5_bhuRg","5","cihuy ww","https://www.google.com/maps/reviews/data=!4m8!14m7!1m6!2m5!1sChZDSUhNMG9nS0VJQ0FnSURqdU52YVhBEAE!2m1!1s0x0:0x18b9e1f6e71c94f3!3m1!1s2@1:CIHM0ogKEICAgIDjuNvaXA%7C%7C?hl=id",
"Puskesmas Pleret","https://www.google.com/maps/search/?api=1&query=Puskesmas%20Pleret&query_place_id=ChIJj4ZDADZUei4R85Qc5_bhuRg","1","OTNIEL NGURAHRAI MALATUNI","https://www.google.com/maps/reviews/data=!4m8!14m7!1m6!2m5!1sChdDSUhNMG9nS0VJQ0FnSUNEci1uRmxnRRAB!2m1!1s0x0:0x18b9e1f6e71c94f3!3m1!1s2@1:CIHM0ogKEICAgICDr-nFlgE%7C%7C?hl=id","Pelayanan harus di tingkatkan lagi"
"Puskesmas Pleret","https://www.google.com/maps/search/?api=1&query=Puskesmas%20Pleret&query_place_id=ChIJj4ZDADZUei4R85Qc5_bhuRg","3","Siti Mawadaturrohmah","https://www.google.com/maps/reviews/data=!4m8!14m7!1m6!2m5!1sChZDSUhNMG9nS0VJQ0FnSUNEd2FiN1p3EAE!2m1!1s0x0:0x18b9e1f6e71c94f3!3m1!1s2@1:CIHM0ogKEICAgICDwab7Zw%7C%7C?hl=id","pas cek anc trpadu dpt antrian no 2,setelah cek smua lab,gigi,gizi dan trakhir dpoli KIA antrian no 1 kluar jam 10.40 sy antrian no 2 dpanggil lbh dr jam 12,alhasil tensi makin tinggi karena kesel,sebel,lapar,mana lg hamil 2,5bln.alhasil berangkat jam 7 pulang jam 1,sampe semua poli dh tutup,pintu dpn puskesmas jg dah dtutup.bikin trauma"
"Puskesmas Pleret","https://www.google.com/maps/search/?api=1&query=Puskesmas%20Pleret&query_place_id=ChIJj4ZDADZUei4R85Qc5_bhuRg","5","Rina tri Winarti","https://www.google.com/maps/reviews/data=!4m8!14m7!1m6!2m5!1sChdDSUhNMG9nS0VJQ0FnSUNEN0xxSHhBRRAB!2m1!1s0x0:0x18b9e1f6e71c94f3!3m1!1s2@1:CIHM0ogKEICAgICD7LqHxAE%7C%7C?hl=id","Tadi nganterin temen berobat di puskesmas, pas nungguin aku di deket ruang farmasi, petugas pelayanan farmasi nya ramah banget dan sopan, di jelasin banget cara minum obatnya, berapa lama diminum nya juga di jelasin, antrian ambil obat nya juga cepet."
"Puskesmas Pleret","https://www.google.com/maps/search/?api=1&query=Puskesmas%20Pleret&query_place_id=ChIJj4ZDADZUei4R85Qc5_bhuRg","5","Elna Christy","https://www.google.com/maps/reviews/data=!4m8!14m7!1m6!2m5!1sChdDSUhNMG9nS0VJQ0FnSUNENEl6STdRRRAB!2m1!1s0x0:0x18b9e1f6e71c94f3!3m1!1s2@1:CIHM0ogKEICAgICD4IzI7QE%7C%7C?hl=id","Pelayanan obatnya cepat dan ramah, ruang tunggu nyaman."
"Puskesmas Pleret","https://www.google.com/maps/search/?api=1&query=Puskesmas%20Pleret&query_place_id=ChIJj4ZDADZUei4R85Qc5_bhuRg","5","warda izatul isma","https://www.google.com/maps/reviews/data=!4m8!14m7!1m6!2m5!1sChZDSUhNMG9nS0VJQ0FnSUQ5ejg3blZ3EAE!2m1!1s0x0:0x18b9e1f6e71c94f3!3m1!1s2@1:CIHM0ogKEICAgID9z87nVw%7C%7C?hl=id","pelayanan farmasinya cepat, untuk tempat antrinya nyaman, penyampaian informasi obatnya juga jelas"
"Puskesmas Pleret","https://www.google.com/maps/search/?api=1&query=Puskesmas%20Pleret&query_place_id=ChIJj4ZDADZUei4R85Qc5_bhuRg","5","ifa ayuwandika","https://www.google.com/maps/reviews/data=!4m8!14m7!1m6!2m5!1sChZDSUhNMG9nS0VJQ0FnSUM5czdTWFpREAE!2m1!1s0x0:0x18b9e1f6e71c94f3!3m1!1s2@1:CIHM0ogKEICAgIC9s7SXZQ%7C%7C?hl=id","Pelayanannya cepat, petugas baik dan ramah"
"Puskesmas Pleret","https://www.google.com/maps/search/?api=1&query=Puskesmas%20Pleret&query_place_id=ChIJj4ZDADZUei4R85Qc5_bhuRg","5","Alfi Nur","https://www.google.com/maps/reviews/data=!4m8!14m7!1m6!2m5!1sChZDSUhNMG9nS0VJQ0FnSUM5MmV1S2N3EAE!2m1!1s0x0:0x18b9e1f6e71c94f3!3m1!1s2@1:CIHM0ogKEICAgIC92euKcw%7C%7C?hl=id","Pelayanan Farmasi disini sangat ramah, terkondisikan tempatnya, tempat mengantri obat nyaman."
"Puskesmas Pleret","https://www.google.com/maps/search/?api=1&query=Puskesmas%20Pleret&query_place_id=ChIJj4ZDADZUei4R85Qc5_bhuRg","5","Nabila 23","https://www.google.com/maps/reviews/data=!4m8!14m7!1m6!2m5!1sChdDSUhNMG9nS0VJQ0FnSUM5MmR2Tl9BRRAB!2m1!1s0x0:0x18b9e1f6e71c94f3!3m1!1s2@1:CIHM0ogKEICAgIC92dvN_AE%7C%7C?hl=id","Pelayanan farmasi di puskesmas ini bagusss ramah ramah"
"Puskesmas Pleret","https://www.google.com/maps/search/?api=1&query=Puskesmas%20Pleret&query_place_id=ChIJj4ZDADZUei4R85Qc5_bhuRg","5","Allya Arum","https://www.google.com/maps/reviews/data=!4m8!14m7!1m6!2m5!1sChdDSUhNMG9nS0VJQ0FnSUM5MmF2VzhRRRAB!2m1!1s0x0:0x18b9e1f6e71c94f3!3m1!1s2@1:CIHM0ogKEICAgIC92avW8QE%7C%7C?hl=id","Pelayanan farmasi di puskesmas pelret cepat, tidak menunggu lama, penyerahan obat juga ramah bangett"
"Puskesmas Pleret","https://www.google.com/maps/search/?api=1&query=Puskesmas%20Pleret&query_place_id=ChIJj4ZDADZUei4R85Qc5_bhuRg","5","Aprilia Dwi Iriani","https://www.google.com/maps/reviews/data=!4m8!14m7!1m6!2m5!1sChdDSUhNMG9nS0VJQ0FnSUM5c1p5dnN3RRAB!2m1!1s0x0:0x18b9e1f6e71c94f3!3m1!1s2@1:CIHM0ogKEICAgIC9sZyvswE%7C%7C?hl=id",
"Puskesmas Pleret","https://www.google.com/maps/search/?api=1&query=Puskesmas%20Pleret&query_place_id=ChIJj4ZDADZUei4R85Qc5_bhuRg","5","Hasna Na'ifah (Hasna)","https://www.google.com/maps/reviews/data=!4m8!14m7!1m6!2m5!1sChZDSUhNMG9nS0VJQ0FnSURkMUwzY2RnEAE!2m1!1s0x0:0x18b9e1f6e71c94f3!3m1!1s2@1:CIHM0ogKEICAgIDd1L3cdg%7C%7C?hl=id","Pelayanan baik ramah"", lingkungan bersih, nyaman"
"Puskesmas Pleret","https://www.google.com/maps/search/?api=1&query=Puskesmas%20Pleret&query_place_id=ChIJj4ZDADZUei4R85Qc5_bhuRg","5","Fika Handayani","https://www.google.com/maps/reviews/data=!4m8!14m7!1m6!2m5!1sChZDSUhNMG9nS0VJQ0FnSURkMVBtLVdnEAE!2m1!1s0x0:0x18b9e1f6e71c94f3!3m1!1s2@1:CIHM0ogKEICAgIDd1Pm-Wg%7C%7C?hl=id","Lokasi sesuai 👍"
"Puskesmas Pleret","https://www.google.com/maps/search/?api=1&query=Puskesmas%20Pleret&query_place_id=ChIJj4ZDADZUei4R85Qc5_bhuRg","4","Diah F","https://www.google.com/maps/reviews/data=!4m8!14m7!1m6!2m5!1sChdDSUhNMG9nS0VJQ0FnSUR0NjVpdDNnRRAB!2m1!1s0x0:0x18b9e1f6e71c94f3!3m1!1s2@1:CIHM0ogKEICAgIDt65it3gE%7C%7C?hl=id","pelayanan baik
bagus,hanya saja untuk pengambilan obat agak lamaa,tapi untuk pelayanan sudah baik atau bisa ditingkatkan lagi biar tambah oke hehe"
"Puskesmas Pleret","https://www.google.com/maps/search/?api=1&query=Puskesmas%20Pleret&query_place_id=ChIJj4ZDADZUei4R85Qc5_bhuRg","1","Runi Rulanggi","https://www.google.com/maps/reviews/data=!4m8!14m7!1m6!2m5!1sChZDSUhNMG9nS0VJQ0FnSUROLWFqd2FREAE!2m1!1s0x0:0x18b9e1f6e71c94f3!3m1!1s2@1:CIHM0ogKEICAgIDN-ajwaQ%7C%7C?hl=id","Pelayanan imunisasi perlu perbaikan, nakes perlu memberikan layanan yg lebih ramah kepada pasien"
"Puskesmas Pleret","https://www.google.com/maps/search/?api=1&query=Puskesmas%20Pleret&query_place_id=ChIJj4ZDADZUei4R85Qc5_bhuRg","1","Alfian Santuy","https://www.google.com/maps/reviews/data=!4m8!14m7!1m6!2m5!1sChdDSUhNMG9nS0VJQ0FnSUNOLWNlWjV3RRAB!2m1!1s0x0:0x18b9e1f6e71c94f3!3m1!1s2@1:CIHM0ogKEICAgICN-ceZ5wE%7C%7C?hl=id","Pelayanan lama sekali"
"Puskesmas Pleret","https://www.google.com/maps/search/?api=1&query=Puskesmas%20Pleret&query_place_id=ChIJj4ZDADZUei4R85Qc5_bhuRg","2","Malikush","https://www.google.com/maps/reviews/data=!4m8!14m7!1m6!2m5!1sChdDSUhNMG9nS0VJQ0FnSURRclptcm9nRRAB!2m1!1s0x0:0x18b9e1f6e71c94f3!3m1!1s2@1:CIHM0ogKEICAgIDQrZmrogE%7C%7C?hl=id","Perlu dievaluasi antrian polinya, terutama poli luar.

Saya daftar dikasih antrian poli umum, cukup lama antrinya. Oke lah gpp krn datang agak siang.

Tp setelah dipanggil, cek tensi dll, dilempar ke poli luar.

Dapat antrian belakang, alamaaak knp ngga dari awal dikasih nomor antrian poli luar???"
"Puskesmas Pleret","https://www.google.com/maps/search/?api=1&query=Puskesmas%20Pleret&query_place_id=ChIJj4ZDADZUei4R85Qc5_bhuRg","5","Riin Ain","https://www.google.com/maps/reviews/data=!4m8!14m7!1m6!2m5!1sChZDSUhNMG9nS0VJQ0FnSUMxd29INFRREAE!2m1!1s0x0:0x18b9e1f6e71c94f3!3m1!1s2@1:CIHM0ogKEICAgIC1woH4TQ%7C%7C?hl=id",
"Puskesmas Pleret","https://www.google.com/maps/search/?api=1&query=Puskesmas%20Pleret&query_place_id=ChIJj4ZDADZUei4R85Qc5_bhuRg","3","Bro Socha","https://www.google.com/maps/reviews/data=!4m8!14m7!1m6!2m5!1sChdDSUhNMG9nS0VJQ0FnSUMxd3NhX29BRRAB!2m1!1s0x0:0x18b9e1f6e71c94f3!3m1!1s2@1:CIHM0ogKEICAgIC1wsa_oAE%7C%7C?hl=id","Terkadang menunggu antriannya terlalu lama untuk ke nomor antrian berikutnya"
"Puskesmas Pleret","https://www.google.com/maps/search/?api=1&query=Puskesmas%20Pleret&query_place_id=ChIJj4ZDADZUei4R85Qc5_bhuRg","5","Yogi P","https://www.google.com/maps/reviews/data=!4m8!14m7!1m6!2m5!1sChdDSUhNMG9nS0VJQ0FnSURWci1IYndBRRAB!2m1!1s0x0:0x18b9e1f6e71c94f3!3m1!1s2@1:CIHM0ogKEICAgIDVr-HbwAE%7C%7C?hl=id",
