"title","url","stars","name","reviewUrl","text"
"Puskesmas Pleret","https://www.google.com/maps/search/?api=1&query=Puskesmas%20Pleret&query_place_id=ChIJj4ZDADZUei4R85Qc5_bhuRg","1","Rizal Arifki","https://www.google.com/maps/reviews/data=!4m8!14m7!1m6!2m5!1sCi9DQUlRQUNvZENodHljRjlvT2t4dlVHSklkRzlFVEU5T1lVRjFTbnBHTkU1VFJVRRAB!2m1!1s0x0:0x18b9e1f6e71c94f3!3m1!1s2@1:CAIQACodChtycF9oOkxvUGJIdG9ETE9OYUF1SnpGNE5TRUE%7C%7C?hl=id","petugas cekikak cekikik ketawa mondar mandir antrian lama banget hampir 4 jam, pdhl udh dftr dijkn, gajelas"
"Puskesmas Pleret","https://www.google.com/maps/search/?api=1&query=Puskesmas%20Pleret&query_place_id=ChIJj4ZDADZUei4R85Qc5_bhuRg","5","sari permata","https://www.google.com/maps/reviews/data=!4m8!14m7!1m6!2m5!1sCi9DQUlRQUNvZENodHljRjlvT21kcVRYSXpTSFZrV2tKdFdWSjRUemRmU1RNNGFVRRAB!2m1!1s0x0:0x18b9e1f6e71c94f3!3m1!1s2@1:CAIQACodChtycF9oOmdqTXIzSHVkWkJtWVJ4TzdfSTM4aUE%7C%7C?hl=id","masyallah Luar biasa sekali pelayanannya, benar-benar pengalaman yang sangat memuaskan! Sejak pertama kali datang, suasana ramah sudah terasa mulai dari bagian pendaftaran yang sangat membantu dan informatif.
​Bidan-bidannya pun sangat profesional namun tetap hangat, mereka sabar dalam menjelaskan, telaten saat pemeriksaan, dan benar-benar mendengarkan keluhan kita sehingga saya merasa sangat tenang dan nyaman. Tidak hanya itu, seluruh staf lainnya juga sangat baik dan sopan, benar-benar membuat pasien merasa dihargai.
​Tempatnya pun bersih dan tertata, membuat kita tidak ragu untuk kembali lagi. Terima kasih untuk dedikasinya dalam melayani masyarakat. Sukses terus dan tetap pertahankan kualitas pelayanan terbaiknya!"
"Puskesmas Pleret","https://www.google.com/maps/search/?api=1&query=Puskesmas%20Pleret&query_place_id=ChIJj4ZDADZUei4R85Qc5_bhuRg","5","Adela Suryani","https://www.google.com/maps/reviews/data=!4m8!14m7!1m6!2m5!1sCi9DQUlRQUNvZENodHljRjlvT214UlJuY3hOMDFqV1UxRFZYcHljWFY0TkdoUllYYxAB!2m1!1s0x0:0x18b9e1f6e71c94f3!3m1!1s2@1:CAIQACodChtycF9oOmxRRncxN01jWU1DVXpycXV4NGhRYXc%7C%7C?hl=id","terimakasih puskesmas pleret, tempat bagus, bersih juga"
"Puskesmas Pleret","https://www.google.com/maps/search/?api=1&query=Puskesmas%20Pleret&query_place_id=ChIJj4ZDADZUei4R85Qc5_bhuRg","5","Riyanti Bintu Sam","https://www.google.com/maps/reviews/data=!4m8!14m7!1m6!2m5!1sCi9DQUlRQUNvZENodHljRjlvT2pCMU0yOHhMVkExY1U1S1ZFbGlObkZVYlZGWE9FRRAB!2m1!1s0x0:0x18b9e1f6e71c94f3!3m1!1s2@1:CAIQACodChtycF9oOjB1M28xLVA1cU5KVEliNnFUbVFXOEE%7C%7C?hl=id","Pelayanan baik, ramah, informatif... Jadi gak kapok kalau² berkunjung lagi. Terimakasih..."
"Puskesmas Pleret","https://www.google.com/maps/search/?api=1&query=Puskesmas%20Pleret&query_place_id=ChIJj4ZDADZUei4R85Qc5_bhuRg","1","lala fatma","https://www.google.com/maps/reviews/data=!4m8!14m7!1m6!2m5!1sCi9DQUlRQUNvZENodHljRjlvT2tNdGIwRkJkVGhEVDA4d2EzTkpjMnBpVERKMU1YYxAB!2m1!1s0x0:0x18b9e1f6e71c94f3!3m1!1s2@1:CAIQACodChtycF9oOkMtb0FBdThDT08wa3NJc2piTDJ1MXc%7C%7C?hl=id","Gk heran kalau bintangnya jelek. Pelayanan di pendaftaran pasien yg samping kasir, super judes. Ditanya baik2 jawabnya kek gk ikhlas bangeet... kog yo iseh dipertahankan yg seperti itu. Sayang banget.."
"Puskesmas Pleret","https://www.google.com/maps/search/?api=1&query=Puskesmas%20Pleret&query_place_id=ChIJj4ZDADZUei4R85Qc5_bhuRg","5","Aisa Nur Aini","https://www.google.com/maps/reviews/data=!4m8!14m7!1m6!2m5!1sCi9DQUlRQUNvZENodHljRjlvT21oemIxTjBZbVJCY1RGSGNsaExXRzQyYUVObVJXYxAB!2m1!1s0x0:0x18b9e1f6e71c94f3!3m1!1s2@1:CAIQACodChtycF9oOmhzb1N0YmRBcTFHclhLWG42aENmRWc%7C%7C?hl=id","pelayanan bagus dan ramah ramah"
"Puskesmas Pleret","https://www.google.com/maps/search/?api=1&query=Puskesmas%20Pleret&query_place_id=ChIJj4ZDADZUei4R85Qc5_bhuRg","5","Mlvi Rahmadani","https://www.google.com/maps/reviews/data=!4m8!14m7!1m6!2m5!1sCi9DQUlRQUNvZENodHljRjlvT2xwaE5rdFlMVVp1VUZWUmVURjVWbFZ3U2prd2RrRRAB!2m1!1s0x0:0x18b9e1f6e71c94f3!3m1!1s2@1:CAIQACodChtycF9oOlphNktYLUZuUFVReTF5VlVwSjkwdkE%7C%7C?hl=id","di puskesmas Pleret ternyata petugas nya baik baik dan Ramah"
"Puskesmas Pleret","https://www.google.com/maps/search/?api=1&query=Puskesmas%20Pleret&query_place_id=ChIJj4ZDADZUei4R85Qc5_bhuRg","1","Mino Mino","https://www.google.com/maps/reviews/data=!4m8!14m7!1m6!2m5!1sCi9DQUlRQUNvZENodHljRjlvT2toM2FIRmZiVXcxY2w5MFEzZHNZM1JqYlVkcGQzYxAB!2m1!1s0x0:0x18b9e1f6e71c94f3!3m1!1s2@1:CAIQACodChtycF9oOkh3aHFfbUw1cl90Q3dsY3RjbUdpd3c%7C%7C?hl=id","Kasir sangat tidak profesional dan integritas dalam bekerja .jam 8.18 kasir blm Dateng dan waktu kami harus dikorbankan karena hanya menunggu kasir blm Dateng.."
"Puskesmas Pleret","https://www.google.com/maps/search/?api=1&query=Puskesmas%20Pleret&query_place_id=ChIJj4ZDADZUei4R85Qc5_bhuRg","1","Tsania Muna","https://www.google.com/maps/reviews/data=!4m8!14m7!1m6!2m5!1sCi9DQUlRQUNvZENodHljRjlvT2tSMFVGaDZVbll6VWpoNWN6ZEpaV05QTkhvd2FFRRAB!2m1!1s0x0:0x18b9e1f6e71c94f3!3m1!1s2@1:CAIQACodChtycF9oOkR0UFh6UnYzUjh5czdJZWNPNHowaEE%7C%7C?hl=id","Daftar di pendaftaran kta petugasnya bisa langsung ke UGD, ternyata ditunggu di UGD 1,5 jam dari UGD bilang disuruh ke poli infeksi. Dari instruksi awal sudah salah tapi tidak ada bilang minta maaf 1 kalipun. Sangat mengecewakan pelayanannya, kapok 2 kali kesini seperti itu terus. Sangat sangat buruk."
"Puskesmas Pleret","https://www.google.com/maps/search/?api=1&query=Puskesmas%20Pleret&query_place_id=ChIJj4ZDADZUei4R85Qc5_bhuRg","5","Hesti Setyaningsih","https://www.google.com/maps/reviews/data=!4m8!14m7!1m6!2m5!1sCi9DQUlRQUNvZENodHljRjlvT2tGNFluVmhjVWRXUXpoM1JVVXdOVkIxYUROd01VRRAB!2m1!1s0x0:0x18b9e1f6e71c94f3!3m1!1s2@1:CAIQACodChtycF9oOkF4YnVhcUdWQzh3RUUwNVB1aDNwMUE%7C%7C?hl=id","Pelayanan baik dan ramah, fasilitas lumayan lengkap, terkhusus untuk bagian pendaftaran serta dokter dokternya kooperatif tulus, sabar dan ramah melayani pasien. Juga untuk petugas parkir nya sangat baik dalam membantu melayani pasien. Puskesmas Pleret memang ok👍👍🥰🥰"
"Puskesmas Pleret","https://www.google.com/maps/search/?api=1&query=Puskesmas%20Pleret&query_place_id=ChIJj4ZDADZUei4R85Qc5_bhuRg","1","endang isnawati","https://www.google.com/maps/reviews/data=!4m8!14m7!1m6!2m5!1sCi9DQUlRQUNvZENodHljRjlvT25Jd1ZFaFlOak5CVFhSRldHUjRTVWhOYUhkcFpVRRAB!2m1!1s0x0:0x18b9e1f6e71c94f3!3m1!1s2@1:CAIQACodChtycF9oOnIwVEhYNjNBTXRFWGR4SUhNaHdpZUE%7C%7C?hl=id","Sumpah lama banget ya pelayanannya, terus poli umum kok kaya jebusan poli lansia, tambah lama polllllll"
"Puskesmas Pleret","https://www.google.com/maps/search/?api=1&query=Puskesmas%20Pleret&query_place_id=ChIJj4ZDADZUei4R85Qc5_bhuRg","1","khusni tanal","https://www.google.com/maps/reviews/data=!4m8!14m7!1m6!2m5!1sCi9DQUlRQUNvZENodHljRjlvT2xFd01UTmtlRko1VmpGUVpGRklkMVp2Y0doeFJYYxAB!2m1!1s0x0:0x18b9e1f6e71c94f3!3m1!1s2@1:CAIQACodChtycF9oOlEwMTNkeFJ5VjFQZFFId1ZvcGhxRXc%7C%7C?hl=id","Kenapa sekarang Jam 10 sudah tidak melayani layanan pendaftaran..padahal sudah cari2 waktu buat periksa..eee ternyata malah sudah tutup..masak jam 10 udah gak melayani pendaftaran..katanya hari jumat sama sabtu tutup pendaftaran jam 10 pagi..enak banget jam kerjanya.."
"Puskesmas Pleret","https://www.google.com/maps/search/?api=1&query=Puskesmas%20Pleret&query_place_id=ChIJj4ZDADZUei4R85Qc5_bhuRg","5","Ando","https://www.google.com/maps/reviews/data=!4m8!14m7!1m6!2m5!1sCi9DQUlRQUNvZENodHljRjlvT2pod05WVnNZMEpRZW0xUU5ubEVRMVZJU2s1MWNGRRAB!2m1!1s0x0:0x18b9e1f6e71c94f3!3m1!1s2@1:CAIQACodChtycF9oOjhwNVVsY0JQem1QNnlEQ1VISk51cFE%7C%7C?hl=id","Saya periksa di poli infeksius dan pelayanannya sangat bagus"
"Puskesmas Pleret","https://www.google.com/maps/search/?api=1&query=Puskesmas%20Pleret&query_place_id=ChIJj4ZDADZUei4R85Qc5_bhuRg","5","fathinatul umamah","https://www.google.com/maps/reviews/data=!4m8!14m7!1m6!2m5!1sCi9DQUlRQUNvZENodHljRjlvT2kwMWRtbEpObEkyVlVjeVVuazBTR1pNY2tGVGVrRRAB!2m1!1s0x0:0x18b9e1f6e71c94f3!3m1!1s2@1:CAIQACodChtycF9oOi01dmlJNlI2VUcyUnk0SGZMckFTekE%7C%7C?hl=id",
"Puskesmas Pleret","https://www.google.com/maps/search/?api=1&query=Puskesmas%20Pleret&query_place_id=ChIJj4ZDADZUei4R85Qc5_bhuRg","5","Intan Ardesta Cahyatama","https://www.google.com/maps/reviews/data=!4m8!14m7!1m6!2m5!1sCi9DQUlRQUNvZENodHljRjlvT2pkVlFWRXpjMGwxYmpKaVYzVjNlbTVtV1ZCQmVtYxAB!2m1!1s0x0:0x18b9e1f6e71c94f3!3m1!1s2@1:CAIQACodChtycF9oOjdVQVEzc0l1bjJiV3V3em5mWVBBemc%7C%7C?hl=id","Pelayanan cepat dan ramah, petugas profesional, tempat bersih dan nyaman"
"Puskesmas Pleret","https://www.google.com/maps/search/?api=1&query=Puskesmas%20Pleret&query_place_id=ChIJj4ZDADZUei4R85Qc5_bhuRg","5","kknt kanggotan20","https://www.google.com/maps/reviews/data=!4m8!14m7!1m6!2m5!1sCi9DQUlRQUNvZENodHljRjlvT2twbWNqSXRWMVoxVW0wMlZEbFBSR3RPY1RaSlVsRRAB!2m1!1s0x0:0x18b9e1f6e71c94f3!3m1!1s2@1:CAIQACodChtycF9oOkpmcjItV1Z1Um02VDlPRGtOcTZJUlE%7C%7C?hl=id",
"Puskesmas Pleret","https://www.google.com/maps/search/?api=1&query=Puskesmas%20Pleret&query_place_id=ChIJj4ZDADZUei4R85Qc5_bhuRg","5","ANI ROIHATUL JANAH","https://www.google.com/maps/reviews/data=!4m8!14m7!1m6!2m5!1sCi9DQUlRQUNvZENodHljRjlvT2s1RWVGcG5jbXMwYW5SblIwUm1hMW8zVnpRemIwRRAB!2m1!1s0x0:0x18b9e1f6e71c94f3!3m1!1s2@1:CAIQACodChtycF9oOk5EeFpncms0anRnR0Rma1o3VzQzb0E%7C%7C?hl=id",
"Puskesmas Pleret","https://www.google.com/maps/search/?api=1&query=Puskesmas%20Pleret&query_place_id=ChIJj4ZDADZUei4R85Qc5_bhuRg","5","Ani Roihatul Janah","https://www.google.com/maps/reviews/data=!4m8!14m7!1m6!2m5!1sCi9DQUlRQUNvZENodHljRjlvT21SemRYTklUSFIxWDBwV1VIa3ROa0pvV1hZMGNrRRAB!2m1!1s0x0:0x18b9e1f6e71c94f3!3m1!1s2@1:CAIQACodChtycF9oOmRzdXNITHR1X0pWUHktNkJoWXY0ckE%7C%7C?hl=id",
"Puskesmas Pleret","https://www.google.com/maps/search/?api=1&query=Puskesmas%20Pleret&query_place_id=ChIJj4ZDADZUei4R85Qc5_bhuRg","1","Ilopet id","https://www.google.com/maps/reviews/data=!4m8!14m7!1m6!2m5!1sCi9DQUlRQUNvZENodHljRjlvT2xCMFRHaHhPV1ZmVFRaNGVYaFhMVzV6U0RCRVZIYxAB!2m1!1s0x0:0x18b9e1f6e71c94f3!3m1!1s2@1:CAIQACodChtycF9oOlB0TGhxOWVfTTZ4eXhXLW5zSDBEVHc%7C%7C?hl=id","Jam pelayanan tidak sesuai, siang pendaftaran sudah tutup"
"Puskesmas Pleret","https://www.google.com/maps/search/?api=1&query=Puskesmas%20Pleret&query_place_id=ChIJj4ZDADZUei4R85Qc5_bhuRg","1","Destiyana","https://www.google.com/maps/reviews/data=!4m8!14m7!1m6!2m5!1sCi9DQUlRQUNvZENodHljRjlvT2xKaWRYSnJOM0I0ZFV0RGFVaG9SRkIzWVcxeE1rRRAB!2m1!1s0x0:0x18b9e1f6e71c94f3!3m1!1s2@1:CAIQACodChtycF9oOlJidXJrN3B4dUtDaUhoRFB3YW1xMkE%7C%7C?hl=id","Tolong di rubah waktu buka di google mapnya kalau siang sudah tidak dapat mendaftar lagi."
"Puskesmas Pleret","https://www.google.com/maps/search/?api=1&query=Puskesmas%20Pleret&query_place_id=ChIJj4ZDADZUei4R85Qc5_bhuRg","1","MUHAMMAD NURIY NUHA NAUFAL","https://www.google.com/maps/reviews/data=!4m8!14m7!1m6!2m5!1sCi9DQUlRQUNvZENodHljRjlvT2tOMFFWcFpTV04zYUV4d1pEZEVVRFYwVjNGMFRFRRAB!2m1!1s0x0:0x18b9e1f6e71c94f3!3m1!1s2@1:CAIQACodChtycF9oOkN0QVpZSWN3aExwZDdEUDV0V3F0TEE%7C%7C?hl=id","Kalau memang pendaftaran buka sampai jam 11 siang tolong di ubah jadwal di google map nya, jangan sampai pasien yang tidak tahu harus pulang lagi karena pendaftaran sudah ditutup. Kasihan pasien yang rumahnya jauh."
"Puskesmas Pleret","https://www.google.com/maps/search/?api=1&query=Puskesmas%20Pleret&query_place_id=ChIJj4ZDADZUei4R85Qc5_bhuRg","1","Muhammad Nuriy Nuha Naufal","https://www.google.com/maps/reviews/data=!4m8!14m7!1m6!2m5!1sCi9DQUlRQUNvZENodHljRjlvT2xOdGJWZERTVzFpY3pFNGN6VlVkbXRoV2toR2QyYxAB!2m1!1s0x0:0x18b9e1f6e71c94f3!3m1!1s2@1:CAIQACodChtycF9oOlNtbVdDSW1iczE4czVUdmthWkhGd2c%7C%7C?hl=id","28 januari 2026, Jam 13.40 saya kesini untuk membuat surat sehat sudah tidak bisa, katanya pendaftaran tutup. Pdhl di jadwal tutupnya jam 14.30. Pegawainya sedang santai2, kondisi tidak ada pasien lain. Saya juga dokter, tetapi saya membutuhkan surat sehat dari instansi pemerintah. Cukup tau bagaimana pelayanan fasilitas kesehatan milik pemerintah kepada masyarakat 🥲. Kasihan masyarakat bayar pajak untuk menggaji malah pelayanannya seperti ini."
"Puskesmas Pleret","https://www.google.com/maps/search/?api=1&query=Puskesmas%20Pleret&query_place_id=ChIJj4ZDADZUei4R85Qc5_bhuRg","1","Rasi bintang Sagara","https://www.google.com/maps/reviews/data=!4m8!14m7!1m6!2m5!1sCi9DQUlRQUNvZENodHljRjlvT2xKSVdHaDVWMVpmUlRSMlFVNVFlRkp5V1ZwMVdXYxAB!2m1!1s0x0:0x18b9e1f6e71c94f3!3m1!1s2@1:CAIQACodChtycF9oOlJIWGh5V1ZfRTR2QU5QeFJyWVp1WWc%7C%7C?hl=id","Petugas screening BPJS nya attitude nya harus lebih dijaga lisannya"
"Puskesmas Pleret","https://www.google.com/maps/search/?api=1&query=Puskesmas%20Pleret&query_place_id=ChIJj4ZDADZUei4R85Qc5_bhuRg","5","Sri Atmi","https://www.google.com/maps/reviews/data=!4m8!14m7!1m6!2m5!1sCi9DQUlRQUNvZENodHljRjlvT2sxelMzSkRNV0ZJUWxCeVFrRnBkRXBRY2pnME4xRRAB!2m1!1s0x0:0x18b9e1f6e71c94f3!3m1!1s2@1:CAIQACodChtycF9oOk1zS3JDMWFIQlByQkFpdEpQcjg0N1E%7C%7C?hl=id",
"Puskesmas Pleret","https://www.google.com/maps/search/?api=1&query=Puskesmas%20Pleret&query_place_id=ChIJj4ZDADZUei4R85Qc5_bhuRg","5","Mboh Sopo","https://www.google.com/maps/reviews/data=!4m8!14m7!1m6!2m5!1sChZDSUhNMG9nS0VJQ0FnSUNjcS0tM1RnEAE!2m1!1s0x0:0x18b9e1f6e71c94f3!3m1!1s2@1:CIHM0ogKEICAgICcq--3Tg%7C%7C?hl=id","Desember 2025 Pelayanan GIGI baik. Dokter setiti .. perawat sat set ...

Karyawan ramah ..
Jangan takut datang kesini ..

Walau pakai bpjs ttep bagus pelayanannya"
"Puskesmas Pleret","https://www.google.com/maps/search/?api=1&query=Puskesmas%20Pleret&query_place_id=ChIJj4ZDADZUei4R85Qc5_bhuRg","5","nor wijayanti","https://www.google.com/maps/reviews/data=!4m8!14m7!1m6!2m5!1sCi9DQUlRQUNvZENodHljRjlvT2t4M09UQmpXbUpWUjFreVVXZFhMWFJWWkZSVmRVRRAB!2m1!1s0x0:0x18b9e1f6e71c94f3!3m1!1s2@1:CAIQACodChtycF9oOkx3OTBjWmJVR1kyUWdXLXRVZFRVdUE%7C%7C?hl=id","Ramah pelayanan praktek mahasiswa"
"Puskesmas Pleret","https://www.google.com/maps/search/?api=1&query=Puskesmas%20Pleret&query_place_id=ChIJj4ZDADZUei4R85Qc5_bhuRg","5","Anim","https://www.google.com/maps/reviews/data=!4m8!14m7!1m6!2m5!1sCi9DQUlRQUNvZENodHljRjlvT2xKaldHTmtVWFJPVWxaMGRtdE5iRzVLU1ZnM1dHYxAB!2m1!1s0x0:0x18b9e1f6e71c94f3!3m1!1s2@1:CAIQACodChtycF9oOlJjWGNkUXROUlZ0dmtNbG5KSVg3WGc%7C%7C?hl=id",
"Puskesmas Pleret","https://www.google.com/maps/search/?api=1&query=Puskesmas%20Pleret&query_place_id=ChIJj4ZDADZUei4R85Qc5_bhuRg","5","abahtonton family","https://www.google.com/maps/reviews/data=!4m8!14m7!1m6!2m5!1sCi9DQUlRQUNvZENodHljRjlvT2toeFlXeFFTRE5KUlZCNFZ6ZG5NWGRvVW5ocU9VRRAB!2m1!1s0x0:0x18b9e1f6e71c94f3!3m1!1s2@1:CAIQACodChtycF9oOkhxYWxQSDNJRVB4VzdnMXdoUnhqOUE%7C%7C?hl=id","Mantab pelayananannya"
"Puskesmas Pleret","https://www.google.com/maps/search/?api=1&query=Puskesmas%20Pleret&query_place_id=ChIJj4ZDADZUei4R85Qc5_bhuRg","1","Widi Arni","https://www.google.com/maps/reviews/data=!4m8!14m7!1m6!2m5!1sCi9DQUlRQUNvZENodHljRjlvT21OVVRtaEpZMjFqWjB0WlZITkVYemxUVFdaamVXYxAB!2m1!1s0x0:0x18b9e1f6e71c94f3!3m1!1s2@1:CAIQACodChtycF9oOmNUTmhJY21jZ0tZVHNEXzlTTWZjeWc%7C%7C?hl=id","Sudah bagus pelayanannya ramah. Tapi tolong pendaftaran pake nomor antrian. Mana saya tau depan belakang saya.
Malu lah dikira nyerobot antrian."
"Puskesmas Pleret","https://www.google.com/maps/search/?api=1&query=Puskesmas%20Pleret&query_place_id=ChIJj4ZDADZUei4R85Qc5_bhuRg","1","Nara Moment","https://www.google.com/maps/reviews/data=!4m8!14m7!1m6!2m5!1sCi9DQUlRQUNvZENodHljRjlvT25SNFdrdEthalZXVGtkdVdtdDFjelpPYmpCWE5YYxAB!2m1!1s0x0:0x18b9e1f6e71c94f3!3m1!1s2@1:CAIQACodChtycF9oOnR4WktKajVWTkduWmt1czZObjBXNXc%7C%7C?hl=id","Pemeriksaan catin gk lengkap
Mau isi aplikasi elsmil bingung datanya gk ada cuma ada hb doang"
"Puskesmas Pleret","https://www.google.com/maps/search/?api=1&query=Puskesmas%20Pleret&query_place_id=ChIJj4ZDADZUei4R85Qc5_bhuRg","1","Ipcs","https://www.google.com/maps/reviews/data=!4m8!14m7!1m6!2m5!1sCi9DQUlRQUNvZENodHljRjlvT2tsSmJHRmFabGhaU2kxamNtVmhUV3h6UjNwRGVXYxAB!2m1!1s0x0:0x18b9e1f6e71c94f3!3m1!1s2@1:CAIQACodChtycF9oOklJbGFaZlhZSi1jcmVhTWxzR3pDeWc%7C%7C?hl=id","Poli luar nya sangat sangat lambat
Tidak secepat di puskesmas lain
Antri 12 nomor bisa sampai 3 jam sendiri

Jadi pikir"" lagi kalau mau periksa di poli luar di puskesmas pleret"
"Puskesmas Pleret","https://www.google.com/maps/search/?api=1&query=Puskesmas%20Pleret&query_place_id=ChIJj4ZDADZUei4R85Qc5_bhuRg","4","AWL","https://www.google.com/maps/reviews/data=!4m8!14m7!1m6!2m5!1sCi9DQUlRQUNvZENodHljRjlvT20xWGIydHpkbVZ6ZEZobldYaEtPWE10ZVZOTFIzYxAB!2m1!1s0x0:0x18b9e1f6e71c94f3!3m1!1s2@1:CAIQACodChtycF9oOm1Xb2tzdmVzdFhnWXhKOXMteVNLR3c%7C%7C?hl=id","Udah beberapa kali periksa kesini suka sama para perawat di sini telaten dan ramah,terakhir kmrin kesini salah di kasih no antrian anak Bayi Di kasih ke ruangan dewasa setelah ngantri lama ehh ternyata salah Ruangan harus masuk lagi ruang Kia11 Akhirnya dapet terakhir saran kalau salah dari petugas sana mending di dahulukan karna kasihan kita sudah ngantri dulu ternyata salah petugasnya masih harus antri ulang 10ke26 duhh lamanya"
"Puskesmas Pleret","https://www.google.com/maps/search/?api=1&query=Puskesmas%20Pleret&query_place_id=ChIJj4ZDADZUei4R85Qc5_bhuRg","5","Septiyana Windi","https://www.google.com/maps/reviews/data=!4m8!14m7!1m6!2m5!1sCi9DQUlRQUNvZENodHljRjlvT2tobmVVVlZORU13VDJkS2FVcGpWUzFvTFZCRFdYYxAB!2m1!1s0x0:0x18b9e1f6e71c94f3!3m1!1s2@1:CAIQACodChtycF9oOkhneUVVNEMwT2dKaUpjVS1oLVBDWXc%7C%7C?hl=id","Pelayanan cepat dan memuaskan"
"Puskesmas Pleret","https://www.google.com/maps/search/?api=1&query=Puskesmas%20Pleret&query_place_id=ChIJj4ZDADZUei4R85Qc5_bhuRg","4","TitimDwi Handayani","https://www.google.com/maps/reviews/data=!4m8!14m7!1m6!2m5!1sCi9DQUlRQUNvZENodHljRjlvT2tGWU9VaEJOVzkzUjJWelZESkRVVmxSVjJod2FIYxAB!2m1!1s0x0:0x18b9e1f6e71c94f3!3m1!1s2@1:CAIQACodChtycF9oOkFYOUhBNW93R2VzVDJDUVlRV2hwaHc%7C%7C?hl=id",
"Puskesmas Pleret","https://www.google.com/maps/search/?api=1&query=Puskesmas%20Pleret&query_place_id=ChIJj4ZDADZUei4R85Qc5_bhuRg","5","Ayu Lestari","https://www.google.com/maps/reviews/data=!4m8!14m7!1m6!2m5!1sCi9DQUlRQUNvZENodHljRjlvT2xSNE1XMHhTVUpyWWw5cFlYRTRURlo0Y25wRVNtYxAB!2m1!1s0x0:0x18b9e1f6e71c94f3!3m1!1s2@1:CAIQACodChtycF9oOlR4MW0xSUJrYl9pYXE4TFZ4cnpESmc%7C%7C?hl=id","Pelayanan ramah ,cepat dan nyaman"
"Puskesmas Pleret","https://www.google.com/maps/search/?api=1&query=Puskesmas%20Pleret&query_place_id=ChIJj4ZDADZUei4R85Qc5_bhuRg","5","Nabilah Nurul Hana","https://www.google.com/maps/reviews/data=!4m8!14m7!1m6!2m5!1sCi9DQUlRQUNvZENodHljRjlvT21rNVMwWnFSRW90Vm1wa1NrWnRVVmsyVkcxV1dIYxAB!2m1!1s0x0:0x18b9e1f6e71c94f3!3m1!1s2@1:CAIQACodChtycF9oOmk5S0ZqREotVmpkSkZtUVk2VG1WWHc%7C%7C?hl=id","Alhamdulillah.. saya puas dengan pelayanan di Puskesmas Pleret. Saya priksa ANC terpadu di sana. Petugas, bidan, dokter, dan perawat melayani dengan baik, ramah, dan informatif. Saya merasa sangat terbantu. Terima kasih, semoga fasilitas dan pelayanan dapat semakin baik."
"Puskesmas Pleret","https://www.google.com/maps/search/?api=1&query=Puskesmas%20Pleret&query_place_id=ChIJj4ZDADZUei4R85Qc5_bhuRg","5","Naufal Gumilang","https://www.google.com/maps/reviews/data=!4m8!14m7!1m6!2m5!1sCi9DQUlRQUNvZENodHljRjlvT2t4dU0wZG5TRlJqVDE5U05UWm5kbnBzY0cxbGJWRRAB!2m1!1s0x0:0x18b9e1f6e71c94f3!3m1!1s2@1:CAIQACodChtycF9oOkxuM0dnSFRjT19SNTZndnpscG1lbVE%7C%7C?hl=id","Pelayanannya memuaskan"
"Puskesmas Pleret","https://www.google.com/maps/search/?api=1&query=Puskesmas%20Pleret&query_place_id=ChIJj4ZDADZUei4R85Qc5_bhuRg","5","Rahmad Arifin","https://www.google.com/maps/reviews/data=!4m8!14m7!1m6!2m5!1sCi9DQUlRQUNvZENodHljRjlvT21JMWVFdFVjbWRwVURONVZHRlZPVXBmZGsxRFpHYxAB!2m1!1s0x0:0x18b9e1f6e71c94f3!3m1!1s2@1:CAIQACodChtycF9oOmI1eEtUcmdpUDN5VGFVOUpfdk1DZGc%7C%7C?hl=id","👍👍👍"
"Puskesmas Pleret","https://www.google.com/maps/search/?api=1&query=Puskesmas%20Pleret&query_place_id=ChIJj4ZDADZUei4R85Qc5_bhuRg","1","aditya muhammad","https://www.google.com/maps/reviews/data=!4m8!14m7!1m6!2m5!1sCi9DQUlRQUNvZENodHljRjlvT25Gb2NHcHpRVVZVYlRkVlp6VmlVREpxWVdnNVFtYxAB!2m1!1s0x0:0x18b9e1f6e71c94f3!3m1!1s2@1:CAIQACodChtycF9oOnFocGpzQUVUbTdVZzViUDJqYWg5Qmc%7C%7C?hl=id",
"Puskesmas Pleret","https://www.google.com/maps/search/?api=1&query=Puskesmas%20Pleret&query_place_id=ChIJj4ZDADZUei4R85Qc5_bhuRg","5","Witna Ningsih","https://www.google.com/maps/reviews/data=!4m8!14m7!1m6!2m5!1sCi9DQUlRQUNvZENodHljRjlvT21kZlVHbHpPV04wTFc4NVVEQjBSR054V1VwNVIwRRAB!2m1!1s0x0:0x18b9e1f6e71c94f3!3m1!1s2@1:CAIQACodChtycF9oOmdfUGlzOWN0LW85UDB0RGNxWUp5R0E%7C%7C?hl=id","Baarokallooh
Pelayan giginya baik banget
Dokter dan perawatnya sopan"" Banget
Trimakasih
Semoga selalu dalam lindungan Alloh SWT
🤲🤲🤲"
"Puskesmas Pleret","https://www.google.com/maps/search/?api=1&query=Puskesmas%20Pleret&query_place_id=ChIJj4ZDADZUei4R85Qc5_bhuRg","5","Jelita Retyaningsih","https://www.google.com/maps/reviews/data=!4m8!14m7!1m6!2m5!1sCi9DQUlRQUNvZENodHljRjlvT2xSSlUwbFFkMWxrVnpKaGVHRk1OVmR5UzBJdFlsRRAB!2m1!1s0x0:0x18b9e1f6e71c94f3!3m1!1s2@1:CAIQACodChtycF9oOlRJU0lQd1lkVzJheGFMNVdyS0ItYlE%7C%7C?hl=id","ramahh humble untuk kabagtu"
"Puskesmas Pleret","https://www.google.com/maps/search/?api=1&query=Puskesmas%20Pleret&query_place_id=ChIJj4ZDADZUei4R85Qc5_bhuRg","5","Yulia Bendes","https://www.google.com/maps/reviews/data=!4m8!14m7!1m6!2m5!1sCi9DQUlRQUNvZENodHljRjlvT2xJeVZVcG5RV1JXUWxCZll6TkNMVWRoUldkcU4xRRAB!2m1!1s0x0:0x18b9e1f6e71c94f3!3m1!1s2@1:CAIQACodChtycF9oOlIyVUpnQWRWQlBfYzNCLUdhRWdqN1E%7C%7C?hl=id",
"Puskesmas Pleret","https://www.google.com/maps/search/?api=1&query=Puskesmas%20Pleret&query_place_id=ChIJj4ZDADZUei4R85Qc5_bhuRg","2","Wahyu agung Wicaksono","https://www.google.com/maps/reviews/data=!4m8!14m7!1m6!2m5!1sCi9DQUlRQUNvZENodHljRjlvT2tWeFRIWkVORms1TVhweGFsSnhOM0Z4ZUVKVVZFRRAB!2m1!1s0x0:0x18b9e1f6e71c94f3!3m1!1s2@1:CAIQACodChtycF9oOkVxTHZENFk5MXpxalJxN3FxeEJUVEE%7C%7C?hl=id","Plis tolong untuk pintu bisa dibuka pada saat pemeriksaan berlangsung. Jika memang untuk mainan anak waktu ibunya pemeriksaan ya dibuka, padahal petugas banyak didalam masa pintu tidak diperhatikan. Lebih ke sering bermain hp. Pelayanan juga agak kurang ramah untuk hari ini terlebih ada mbak2 magang mungkin ya. Pada saat pemerikaan bidan juga tidak didalam ruangan dan tidak ada pemberitahuan tunggu sebentar atau bidan sedang keluar. Saran saya mau pelayanan bayar pribadi atau bpjs untuk dilayani dengan baik dan ramah."
"Puskesmas Pleret","https://www.google.com/maps/search/?api=1&query=Puskesmas%20Pleret&query_place_id=ChIJj4ZDADZUei4R85Qc5_bhuRg","5","Atikah Maratiningrum","https://www.google.com/maps/reviews/data=!4m8!14m7!1m6!2m5!1sCi9DQUlRQUNvZENodHljRjlvT21WM2VGOVJWR2xUT0RWUGNsZHRhbXhLV1VoaU0zYxAB!2m1!1s0x0:0x18b9e1f6e71c94f3!3m1!1s2@1:CAIQACodChtycF9oOmV3eF9RVGlTODVPcldtamxKWUhiM3c%7C%7C?hl=id",
"Puskesmas Pleret","https://www.google.com/maps/search/?api=1&query=Puskesmas%20Pleret&query_place_id=ChIJj4ZDADZUei4R85Qc5_bhuRg","5","MayandiyoChannel","https://www.google.com/maps/reviews/data=!4m8!14m7!1m6!2m5!1sCi9DQUlRQUNvZENodHljRjlvT25aVlRtaEhiemRKTm1ZeUxUVlZjbVJrVnpOSVkxRRAB!2m1!1s0x0:0x18b9e1f6e71c94f3!3m1!1s2@1:CAIQACodChtycF9oOnZVTmhHbzdJNmYyLTVVcmRkVzNIY1E%7C%7C?hl=id","Buat masnya yg jaga diruang konsul gizi,elu asik mas!🤙🏻"
"Puskesmas Pleret","https://www.google.com/maps/search/?api=1&query=Puskesmas%20Pleret&query_place_id=ChIJj4ZDADZUei4R85Qc5_bhuRg","5","Dino Berutu","https://www.google.com/maps/reviews/data=!4m8!14m7!1m6!2m5!1sCi9DQUlRQUNvZENodHljRjlvT2xoVlEwVnFibkpJYWkwemRtSnRNVUpaU1VOQmRtYxAB!2m1!1s0x0:0x18b9e1f6e71c94f3!3m1!1s2@1:CAIQACodChtycF9oOlhVQ0VqbnJIai0zdmJtMUJZSUNBdmc%7C%7C?hl=id","Pelayanan ramah dan bersahabat. Para Nakes memiliki kompetensi baik dan manusiawi. Diberkahi para nakes dan pelayanan di Puskesmas Pleret. Tetap rendah hati dan up grade kompetensi"
"Puskesmas Pleret","https://www.google.com/maps/search/?api=1&query=Puskesmas%20Pleret&query_place_id=ChIJj4ZDADZUei4R85Qc5_bhuRg","5","Novita Kamaru","https://www.google.com/maps/reviews/data=!4m8!14m7!1m6!2m5!1sCi9DQUlRQUNvZENodHljRjlvT21kU1QyUXpkVlozV0doVGExWnhNVFprYkd0TGFtYxAB!2m1!1s0x0:0x18b9e1f6e71c94f3!3m1!1s2@1:CAIQACodChtycF9oOmdST2QzdVZ3WGhTa1ZxMTZkbGtLamc%7C%7C?hl=id",
"Puskesmas Pleret","https://www.google.com/maps/search/?api=1&query=Puskesmas%20Pleret&query_place_id=ChIJj4ZDADZUei4R85Qc5_bhuRg","5","Rainy Mitha.e","https://www.google.com/maps/reviews/data=!4m8!14m7!1m6!2m5!1sCi9DQUlRQUNvZENodHljRjlvT25KM1FuYzRhVWxhY1hoeVMzTTViVzlpY1hOcFgxRRAB!2m1!1s0x0:0x18b9e1f6e71c94f3!3m1!1s2@1:CAIQACodChtycF9oOnJ3Qnc4aUlacXhyS3M5bW9icXNpX1E%7C%7C?hl=id",
"Puskesmas Pleret","https://www.google.com/maps/search/?api=1&query=Puskesmas%20Pleret&query_place_id=ChIJj4ZDADZUei4R85Qc5_bhuRg","5","Razan Jayen","https://www.google.com/maps/reviews/data=!4m8!14m7!1m6!2m5!1sCi9DQUlRQUNvZENodHljRjlvT214RGQxazNRMnBXYkU5RWFGcHpZM1YwTUc1MGVYYxAB!2m1!1s0x0:0x18b9e1f6e71c94f3!3m1!1s2@1:CAIQACodChtycF9oOmxDd1k3Q2pWbE9EaFpzY3V0MG50eXc%7C%7C?hl=id","Periksa hamil gratis,bidan ramah,pelayanan cepat asalkan daftar dulu...😊 Tempatnya nyaman..."
"Puskesmas Pleret","https://www.google.com/maps/search/?api=1&query=Puskesmas%20Pleret&query_place_id=ChIJj4ZDADZUei4R85Qc5_bhuRg","5","Nurna listi","https://www.google.com/maps/reviews/data=!4m8!14m7!1m6!2m5!1sCi9DQUlRQUNvZENodHljRjlvT21oRlpVWjZRMUJ3TmtSdU4xZE1TVGR3YzNscFpuYxAB!2m1!1s0x0:0x18b9e1f6e71c94f3!3m1!1s2@1:CAIQACodChtycF9oOmhFZUZ6Q1BwNkRuN1dMSTdwc3lpZnc%7C%7C?hl=id","Pelayanannya ramah,puskesmasnya Bersih"
"Puskesmas Pleret","https://www.google.com/maps/search/?api=1&query=Puskesmas%20Pleret&query_place_id=ChIJj4ZDADZUei4R85Qc5_bhuRg","5","Riza Narulita","https://www.google.com/maps/reviews/data=!4m8!14m7!1m6!2m5!1sCi9DQUlRQUNvZENodHljRjlvT25aRWMyaG1OVGQ1YWtwRGFIaHFTRlJGTFdGRlVGRRAB!2m1!1s0x0:0x18b9e1f6e71c94f3!3m1!1s2@1:CAIQACodChtycF9oOnZEc2hmNTd5akpDaHhqSFRFLWFFUFE%7C%7C?hl=id","Pelayanan sangat baik, cepat, ramah"
"Puskesmas Pleret","https://www.google.com/maps/search/?api=1&query=Puskesmas%20Pleret&query_place_id=ChIJj4ZDADZUei4R85Qc5_bhuRg","5","nova karniaty","https://www.google.com/maps/reviews/data=!4m8!14m7!1m6!2m5!1sCi9DQUlRQUNvZENodHljRjlvT2tWSU1FMXFkbXRPZWxweFZETlJOSFpCTVVWdWVVRRAB!2m1!1s0x0:0x18b9e1f6e71c94f3!3m1!1s2@1:CAIQACodChtycF9oOkVIME1qdmtOelpxVDNRNHZBMUVueUE%7C%7C?hl=id","ramah,pelayanan baik cepat ,lumayan bersih"
