"title","url","stars","name","reviewUrl","text"
"Puskesmas Sewon II","https://www.google.com/maps/search/?api=1&query=Puskesmas%20Sewon%20II&query_place_id=ChIJE446Lk9Wei4RoIvHItkY-i4","5","TEGUH ARIYANTO","https://www.google.com/maps/reviews/data=!4m8!14m7!1m6!2m5!1sCi9DQUlRQUNvZENodHljRjlvT201TVkydGtVMG80ZDNWVVFWSm1TekZHVDNaNVNWRRAB!2m1!1s0x0:0x2efa18d922c78ba0!3m1!1s2@1:CAIQACodChtycF9oOm5MY2tkU0o4d3VUQVJmSzFGT3Z5SVE%7C%7C?hl=id",
"Puskesmas Sewon II","https://www.google.com/maps/search/?api=1&query=Puskesmas%20Sewon%20II&query_place_id=ChIJE446Lk9Wei4RoIvHItkY-i4","5","Devia Anggraini (Devi)","https://www.google.com/maps/reviews/data=!4m8!14m7!1m6!2m5!1sCi9DQUlRQUNvZENodHljRjlvT25oMFNEQkJRMnBVV2xCVlpUVXdiakE1UW5ablozYxAB!2m1!1s0x0:0x2efa18d922c78ba0!3m1!1s2@1:CAIQACodChtycF9oOnh0SDBBQ2pUWlBVZTUwbjA5QnZnZ3c%7C%7C?hl=id","First datang ke psikolog karna ke inginkan sendiri, awal nya iseng, dan alhamdulillah ada psikolog nya dan psikolog nya super duper ramah humble merangkul banget, staf2 yang lain juga sangat ramah. Pelayanan sangat bagus, yg hitungnya aku baru pertama ke pus sewon 2 dan bukan faskes ku tapi tidak di bedakan sama sekali.

Jangan lupa kepsikolog pus sewon 2 yaa, karna psikolog bukan hanya untuk masalah yg berat tapi bisa jadi sahabats untuk tempat sharing terbaik dan aman."
"Puskesmas Sewon II","https://www.google.com/maps/search/?api=1&query=Puskesmas%20Sewon%20II&query_place_id=ChIJE446Lk9Wei4RoIvHItkY-i4","1","akun cantik","https://www.google.com/maps/reviews/data=!4m8!14m7!1m6!2m5!1sCi9DQUlRQUNvZENodHljRjlvT201dmN6STViRXB3WlRCVU1qWTVSV3N3Y0ZaWWFYYxAB!2m1!1s0x0:0x2efa18d922c78ba0!3m1!1s2@1:CAIQACodChtycF9oOm5vczI5bEpwZTBUMjY5RWswcFZYaXc%7C%7C?hl=id","tolong untuk dokter jika memeriksa pasien dengan diagnosa yang benar, sering sekali periksa dengan dokter laki”didiagnosa yang berbeda beda dan tidak ada penyelesaian, bahkan pernah tindakan kuku dengan beliau tapi hasilnya tidak bagus, padahal dulu pernah tindakan kuku juga tapi bagus hasil nya."
"Puskesmas Sewon II","https://www.google.com/maps/search/?api=1&query=Puskesmas%20Sewon%20II&query_place_id=ChIJE446Lk9Wei4RoIvHItkY-i4","5","Tantri","https://www.google.com/maps/reviews/data=!4m8!14m7!1m6!2m5!1sCi9DQUlRQUNvZENodHljRjlvT25RNGRXVk9ZMGN6YURCcGFVWlBZMUowUlRKcFFWRRAB!2m1!1s0x0:0x2efa18d922c78ba0!3m1!1s2@1:CAIQACodChtycF9oOnQ4dWVOY0czaDBpaUZPY1J0RTJpQVE%7C%7C?hl=id","Sebagai pendatang ini termasuk puskesmas yg bagus, pelayanan ramah & satset
Tapi pasiennya juga entah sengaja atau gimana namanya dipanggil sampe berkali² gak nyaut, pas udah kelewat baru nyaut

Buat kalian yg kesini saran aja kalo nomor antrean belum dipanggil, yg fokus gais
Kasian petugasnya manggilnya dari pake speaker sampe dipanggil manual padahal,

Saran aja buat management tambahin security dibagian pendaftaran depan sama lansia
Soalnya tadi dibagian depan petugasnya dibentak² pasien perkara ditanya data pasien,
sama kalo di lansia kadang pengantar gak mau ngasih tempat duduk ke pasien,
Sama biar kalo mau tanya² gak perlu ganggu dokter yg jaga, kita bisa tanya ke security nya

Semua petugas yg saya temui hari ini ramah², bag.informasi, pendaftaran , bagian lansia, kasir, terutama Dokter dibagian lab
Kalau bagian lain belum coba, terimakasih Ibu Dokter Lab & team, anak saya gak trauma disuntik, happy banget dia cerita²🤗🤗🤗"
"Puskesmas Sewon II","https://www.google.com/maps/search/?api=1&query=Puskesmas%20Sewon%20II&query_place_id=ChIJE446Lk9Wei4RoIvHItkY-i4","1","Utia Kafafa","https://www.google.com/maps/reviews/data=!4m8!14m7!1m6!2m5!1sCi9DQUlRQUNvZENodHljRjlvT2tZd1dWcGlPRGx0VkVObFl6Z3lXWFl4VDJsT2NsRRAB!2m1!1s0x0:0x2efa18d922c78ba0!3m1!1s2@1:CAIQACodChtycF9oOkYwWVpiODltVENlYzgyWXYxT2lOclE%7C%7C?hl=id","perbaiki layananmu, dokternya jg tuh ditanya. saya udh bilang sakit apa dari kapan malah dikira sok diagnosis sendiri, sakit dikasih pereda nyeri doang ga dikasih obat ngilangin penyakitnya. ganti tuh layanin masyarakat yg layak!!!"
"Puskesmas Sewon II","https://www.google.com/maps/search/?api=1&query=Puskesmas%20Sewon%20II&query_place_id=ChIJE446Lk9Wei4RoIvHItkY-i4","5","Ika Ika","https://www.google.com/maps/reviews/data=!4m8!14m7!1m6!2m5!1sCi9DQUlRQUNvZENodHljRjlvT210Qk5EUlNVbVY2VkRsalpWSmFObk5zVFhVMU5VRRAB!2m1!1s0x0:0x2efa18d922c78ba0!3m1!1s2@1:CAIQACodChtycF9oOmtBNDRSUmV6VDljZVJaNnNsTXU1NUE%7C%7C?hl=id",
"Puskesmas Sewon II","https://www.google.com/maps/search/?api=1&query=Puskesmas%20Sewon%20II&query_place_id=ChIJE446Lk9Wei4RoIvHItkY-i4","3","Riris Lestariana","https://www.google.com/maps/reviews/data=!4m8!14m7!1m6!2m5!1sCi9DQUlRQUNvZENodHljRjlvT21kZlkyUndiR2M0UkhSa0xVMUlMVlJGT0ZGUk1tYxAB!2m1!1s0x0:0x2efa18d922c78ba0!3m1!1s2@1:CAIQACodChtycF9oOmdfY2RwbGc4RHRkLU1ILVRFOFFRMmc%7C%7C?hl=id","Hadehhhh farmasinya lelet.
Trs itu anak magangnya, udah tau salah antri ga ditunjukin mana tempat antri yg bnr, udah nunggunya lama! Ternyata salah tempat, pantesan saya ga dipanggil"""
"Puskesmas Sewon II","https://www.google.com/maps/search/?api=1&query=Puskesmas%20Sewon%20II&query_place_id=ChIJE446Lk9Wei4RoIvHItkY-i4","5","Todoroki Murayama","https://www.google.com/maps/reviews/data=!4m8!14m7!1m6!2m5!1sCi9DQUlRQUNvZENodHljRjlvT2xRMFlWaDZSRGMzWXpkdFJFVjBPVGswYWpsV2FuYxAB!2m1!1s0x0:0x2efa18d922c78ba0!3m1!1s2@1:CAIQACodChtycF9oOlQ0YVh6RDc3YzdtREV0OTk0ajlWanc%7C%7C?hl=id","Syarat untuk Tes catin apa saja ya yg perlu dibawa?"
"Puskesmas Sewon II","https://www.google.com/maps/search/?api=1&query=Puskesmas%20Sewon%20II&query_place_id=ChIJE446Lk9Wei4RoIvHItkY-i4","5","Septia Nur Aliffah","https://www.google.com/maps/reviews/data=!4m8!14m7!1m6!2m5!1sCi9DQUlRQUNvZENodHljRjlvT21oVVNFTlhhRzlNY0djNU1HOTROMDFVTjFReFptYxAB!2m1!1s0x0:0x2efa18d922c78ba0!3m1!1s2@1:CAIQACodChtycF9oOmhUSENXaG9McGc5MG94N01UN1QxZmc%7C%7C?hl=id","Pelayanan cepat dan ramah"
"Puskesmas Sewon II","https://www.google.com/maps/search/?api=1&query=Puskesmas%20Sewon%20II&query_place_id=ChIJE446Lk9Wei4RoIvHItkY-i4","5","Gelis Indriani","https://www.google.com/maps/reviews/data=!4m8!14m7!1m6!2m5!1sCi9DQUlRQUNvZENodHljRjlvT2xWd01IaHlORVZ3Y0RscGRYVlNia054WkZoSGRYYxAB!2m1!1s0x0:0x2efa18d922c78ba0!3m1!1s2@1:CAIQACodChtycF9oOlVwMHhyNEVwcDlpdXVSbkNxZFhHdXc%7C%7C?hl=id","Pendaftarannya cepat,ramah, dan jos jissss bestii mantabbb 🤩🤩🤩"
"Puskesmas Sewon II","https://www.google.com/maps/search/?api=1&query=Puskesmas%20Sewon%20II&query_place_id=ChIJE446Lk9Wei4RoIvHItkY-i4","5","faadhilah labiib","https://www.google.com/maps/reviews/data=!4m8!14m7!1m6!2m5!1sCi9DQUlRQUNvZENodHljRjlvT21zNE4weFZYMVprVm1adlUxZERabGxmWlZWaGIwRRAB!2m1!1s0x0:0x2efa18d922c78ba0!3m1!1s2@1:CAIQACodChtycF9oOms4N0xVX1ZkVmZvU1dDZllfZVVhb0E%7C%7C?hl=id","pendaftaran ramah"
"Puskesmas Sewon II","https://www.google.com/maps/search/?api=1&query=Puskesmas%20Sewon%20II&query_place_id=ChIJE446Lk9Wei4RoIvHItkY-i4","5","Laksamana Muda","https://www.google.com/maps/reviews/data=!4m8!14m7!1m6!2m5!1sCi9DQUlRQUNvZENodHljRjlvT2xGak1XbEtkbVpUUTA5cFpubEdRWEJqUVZoalJuYxAB!2m1!1s0x0:0x2efa18d922c78ba0!3m1!1s2@1:CAIQACodChtycF9oOlFjMWlKdmZTQ09pZnlGQXBjQVhjRnc%7C%7C?hl=id","Kemaren ngurus surat utk caten, Alhamdulillah lancar semua, rutenya dri pendaftaran bawa ktp trs kasir, lanjut skrining di ckg, cek lab, ambil darah& ambil sampel urin, tunggu hasilnya, trs ketemu dokter, semacam acc(?), trs ke gizi, lanjut KIA buat nanya soal tt, trs ke kasir lagi nggk bayar cuma diarahin ke resep buat nebus vitamin, seru pwoll"
"Puskesmas Sewon II","https://www.google.com/maps/search/?api=1&query=Puskesmas%20Sewon%20II&query_place_id=ChIJE446Lk9Wei4RoIvHItkY-i4","1","Luqman","https://www.google.com/maps/reviews/data=!4m8!14m7!1m6!2m5!1sCi9DQUlRQUNvZENodHljRjlvT2tsaU1tVnZhbWszTWtJeVJuZHhYMnhIVjE5bWFHYxAB!2m1!1s0x0:0x2efa18d922c78ba0!3m1!1s2@1:CAIQACodChtycF9oOkliMmVvamk3MkIyRndxX2xHV19maGc%7C%7C?hl=id","Antri obat 1 jam lebih, padahal bukan obat racikan."
"Puskesmas Sewon II","https://www.google.com/maps/search/?api=1&query=Puskesmas%20Sewon%20II&query_place_id=ChIJE446Lk9Wei4RoIvHItkY-i4","1","one piece","https://www.google.com/maps/reviews/data=!4m8!14m7!1m6!2m5!1sCi9DQUlRQUNvZENodHljRjlvT2xVd2JYcEJPRXROV1RWbVUwcFVWVzA0TWpSUGQyYxAB!2m1!1s0x0:0x2efa18d922c78ba0!3m1!1s2@1:CAIQACodChtycF9oOlUwbXpBOEtNWTVmU0pUVW04MjRPd2c%7C%7C?hl=id","sesuai rating."
"Puskesmas Sewon II","https://www.google.com/maps/search/?api=1&query=Puskesmas%20Sewon%20II&query_place_id=ChIJE446Lk9Wei4RoIvHItkY-i4","5","Faiqotun Nurul Ulya","https://www.google.com/maps/reviews/data=!4m8!14m7!1m6!2m5!1sCi9DQUlRQUNvZENodHljRjlvT25rd00wVm5UbnBrY0hGblNtazNjM0p6VFRKdVNFRRAB!2m1!1s0x0:0x2efa18d922c78ba0!3m1!1s2@1:CAIQACodChtycF9oOnkwM0VnTnpkcHFnSmk3c3JzTTJuSEE%7C%7C?hl=id",
"Puskesmas Sewon II","https://www.google.com/maps/search/?api=1&query=Puskesmas%20Sewon%20II&query_place_id=ChIJE446Lk9Wei4RoIvHItkY-i4","1","Deni Ar","https://www.google.com/maps/reviews/data=!4m8!14m7!1m6!2m5!1sCi9DQUlRQUNvZENodHljRjlvT2s1c1RHeEdhMHA2TUZOM1JIRlJOSEpFYmpGRk9FRRAB!2m1!1s0x0:0x2efa18d922c78ba0!3m1!1s2@1:CAIQACodChtycF9oOk5sTGxGa0p6MFN3RHFRNHJEbjFFOEE%7C%7C?hl=id","Saya ingin memberi ulasan karena saya agak sedikit kesal dengan petugas gizinya, saya datang duluan tapi  malah yang masuk dulu yang baru saja datang tanpa antri(mentang2 kenal) lalu yang ga kenal antriannya diserobot, kemudian saya waktu imunisasi ataupun periksa di puskesmas atau RS jika bertemu dengan bidan, dokter, dsa, perawat atau siapapun petugas medis ketika melihat saya menggendong anak dengan gendongan mshape gada yang menegur malah dari hamil sblm lahiran sudha diedusikan tentang gendongan mshape, namun petugas gizi malah mengatakan bahwa itu dipekeh lanjut saya jelaskan jika ibu mshape tapi tetap saja dibilang gaboleh lah, gaboleh lama2 kasian anaknya, malah kaya ibu2 kampung yang sering julid ke tetangga,masa petugas puskesmas ga upgrade tentang ilmu gendongan mshape? saya gendong posisi mshape dari usianya 1,5 bulan skrg usianya 7 bulan Alhamdulillah tidak papa apalagi dibilang nanti kakinya ngangkang nyatanya tetanggw saya sampe tk tidak papa juga tuh, kader posyandu juga paham apa itu mshape karna katanya sering belajar dari pihak puskesmas juga, sedangkan petugas gizinya saja malah tidak tau ilmunya,mohon diperbaiki lagi ya agar tidk mendahulukan orang yang mentang2 dikenal daripada yang antri lebih dulu, di mohon diupgrade juga ilmunya tentang gendongan mshape, terimakasih 🙏"
"Puskesmas Sewon II","https://www.google.com/maps/search/?api=1&query=Puskesmas%20Sewon%20II&query_place_id=ChIJE446Lk9Wei4RoIvHItkY-i4","4","Eka Septiani","https://www.google.com/maps/reviews/data=!4m8!14m7!1m6!2m5!1sCi9DQUlRQUNvZENodHljRjlvT25kSlFtMUlhMTluZW1abmJHdENhR0ZHZFhCMFpXYxAB!2m1!1s0x0:0x2efa18d922c78ba0!3m1!1s2@1:CAIQACodChtycF9oOndJQm1Ia19nemZnbGtCaGFGdXB0ZWc%7C%7C?hl=id",
"Puskesmas Sewon II","https://www.google.com/maps/search/?api=1&query=Puskesmas%20Sewon%20II&query_place_id=ChIJE446Lk9Wei4RoIvHItkY-i4","1","M hasim Hasim","https://www.google.com/maps/reviews/data=!4m8!14m7!1m6!2m5!1sCi9DQUlRQUNvZENodHljRjlvT21ZeWJ6RnRNVVppVGpsMGMyUlNRV05sWkMxMVEwRRAB!2m1!1s0x0:0x2efa18d922c78ba0!3m1!1s2@1:CAIQACodChtycF9oOmYybzFtMUZiTjl0c2RSQWNlZC11Q0E%7C%7C?hl=id","Puskesmas pelayanan jelek mau minta rujukan aja di persulit , makanya saya mending bayar daripada ribet
Pertama kali periksa kandungan disini ibunya yg cek BB judes bgt saya bilang kalo mau periksa di dr kandungan tp sana malah bilang nanti mahal dll dikiranya saya gak mampu bayar apa!"
"Puskesmas Sewon II","https://www.google.com/maps/search/?api=1&query=Puskesmas%20Sewon%20II&query_place_id=ChIJE446Lk9Wei4RoIvHItkY-i4","5","Althaf Fath","https://www.google.com/maps/reviews/data=!4m8!14m7!1m6!2m5!1sCi9DQUlRQUNvZENodHljRjlvT21sMVZVVlpNM2hxZVZsWVdtSkxOVzFpTm1od1psRRAB!2m1!1s0x0:0x2efa18d922c78ba0!3m1!1s2@1:CAIQACodChtycF9oOml1VUVZM3hqeVlYWmJLNW1iNmhwZlE%7C%7C?hl=id","Ada Pelayanan CKG, sangat membantu masyarakat"
"Puskesmas Sewon II","https://www.google.com/maps/search/?api=1&query=Puskesmas%20Sewon%20II&query_place_id=ChIJE446Lk9Wei4RoIvHItkY-i4","5","Fendi Heri","https://www.google.com/maps/reviews/data=!4m8!14m7!1m6!2m5!1sCi9DQUlRQUNvZENodHljRjlvT2xCTlZUUXdkazlHTFUxQlEyNWxRV1ZvTUdGVVZIYxAB!2m1!1s0x0:0x2efa18d922c78ba0!3m1!1s2@1:CAIQACodChtycF9oOlBNVTQwdk9GLU1BQ25lQWVoMGFUVHc%7C%7C?hl=id","Pelayanan bagus,,kami puas"
"Puskesmas Sewon II","https://www.google.com/maps/search/?api=1&query=Puskesmas%20Sewon%20II&query_place_id=ChIJE446Lk9Wei4RoIvHItkY-i4","5","Suwarlin","https://www.google.com/maps/reviews/data=!4m8!14m7!1m6!2m5!1sCi9DQUlRQUNvZENodHljRjlvT2s1V1IwVmFZVnA0UjJFd1J6RmxaMDR6WTBoVlZWRRAB!2m1!1s0x0:0x2efa18d922c78ba0!3m1!1s2@1:CAIQACodChtycF9oOk5WR0VaYVp4R2EwRzFlZ04zY0hVVVE%7C%7C?hl=id","Pelayanan baik"
"Puskesmas Sewon II","https://www.google.com/maps/search/?api=1&query=Puskesmas%20Sewon%20II&query_place_id=ChIJE446Lk9Wei4RoIvHItkY-i4","5","mamine salma_fathan","https://www.google.com/maps/reviews/data=!4m8!14m7!1m6!2m5!1sCi9DQUlRQUNvZENodHljRjlvT25CblZXVkRkMkZHVERGS01taFRXWEZyU0hsdVVsRRAB!2m1!1s0x0:0x2efa18d922c78ba0!3m1!1s2@1:CAIQACodChtycF9oOnBnVWVDd2FGTDFKMmhTWXFrSHluUlE%7C%7C?hl=id","Petugas urusan kesehatan ramah & sangat memuaskan"
"Puskesmas Sewon II","https://www.google.com/maps/search/?api=1&query=Puskesmas%20Sewon%20II&query_place_id=ChIJE446Lk9Wei4RoIvHItkY-i4","5","Fransisca Galang","https://www.google.com/maps/reviews/data=!4m8!14m7!1m6!2m5!1sCi9DQUlRQUNvZENodHljRjlvT2pSNGJFODRPVWhWYkZRMGNIZEhhVmRmTkhaZlpVRRAB!2m1!1s0x0:0x2efa18d922c78ba0!3m1!1s2@1:CAIQACodChtycF9oOjR4bE84OUhVbFQ0cHdHaVdfNHZfZUE%7C%7C?hl=id","Mantapp kalii kakak"
"Puskesmas Sewon II","https://www.google.com/maps/search/?api=1&query=Puskesmas%20Sewon%20II&query_place_id=ChIJE446Lk9Wei4RoIvHItkY-i4","5","suparjo budisantosa","https://www.google.com/maps/reviews/data=!4m8!14m7!1m6!2m5!1sCi9DQUlRQUNvZENodHljRjlvT2w5SGJVSjJXRzUzYTBabGVDMUZVa2g1UTJ0a01FRRAB!2m1!1s0x0:0x2efa18d922c78ba0!3m1!1s2@1:CAIQACodChtycF9oOl9HbUJ2WG53a0ZleC1FUkh5Q2tkMEE%7C%7C?hl=id",
"Puskesmas Sewon II","https://www.google.com/maps/search/?api=1&query=Puskesmas%20Sewon%20II&query_place_id=ChIJE446Lk9Wei4RoIvHItkY-i4","1","Yogo Hendra R","https://www.google.com/maps/reviews/data=!4m8!14m7!1m6!2m5!1sCi9DQUlRQUNvZENodHljRjlvT2tGUlJuUkxTbmxzZVVKdVRGbzFXVm81V2psSmNtYxAB!2m1!1s0x0:0x2efa18d922c78ba0!3m1!1s2@1:CAIQACodChtycF9oOkFRRnRLSnlseUJuTFo1WVo5WjlJcmc%7C%7C?hl=id","Pelayanan Lama,jam kerja jam brapa ? Datang jam brapa ? Kayaknya gampangin orang2 ny"
"Puskesmas Sewon II","https://www.google.com/maps/search/?api=1&query=Puskesmas%20Sewon%20II&query_place_id=ChIJE446Lk9Wei4RoIvHItkY-i4","1","Linda Maulidya","https://www.google.com/maps/reviews/data=!4m8!14m7!1m6!2m5!1sCi9DQUlRQUNvZENodHljRjlvT2tSaFZWRlhNamhuWTFwbWQyeGlialZSY1ZOelIxRRAB!2m1!1s0x0:0x2efa18d922c78ba0!3m1!1s2@1:CAIQACodChtycF9oOkRhVVFXMjhnY1pmd2xibjVRcVNzR1E%7C%7C?hl=id","Mnta rujukn k bedah ank mlh ditulis bedah aja. Alhasil gbsa dipke, pdhl udh dksh surat rujukn dr rs. Dokternya ga teliti dan terlalu bertele2 bgt. Mau cetak ulang hrs antri ulang, tlong ya perbaikin kinerjanya jgn bsa ketus sm pasien aj"
"Puskesmas Sewon II","https://www.google.com/maps/search/?api=1&query=Puskesmas%20Sewon%20II&query_place_id=ChIJE446Lk9Wei4RoIvHItkY-i4","4","Busur Andi","https://www.google.com/maps/reviews/data=!4m8!14m7!1m6!2m5!1sCi9DQUlRQUNvZENodHljRjlvT2pGb1pUaHdOV2x2ZERONFpVZFVSMHh1V25sRFZWRRAB!2m1!1s0x0:0x2efa18d922c78ba0!3m1!1s2@1:CAIQACodChtycF9oOjFoZThwNWlvdDN4ZUdUR0xuWnlDVVE%7C%7C?hl=id","Tempat parkir mobil kurang, bisa dibenahi lagi... Untuk pelayanan sudah baik dan cepat....."
"Puskesmas Sewon II","https://www.google.com/maps/search/?api=1&query=Puskesmas%20Sewon%20II&query_place_id=ChIJE446Lk9Wei4RoIvHItkY-i4","3","Oktavinda Rachmawati","https://www.google.com/maps/reviews/data=!4m8!14m7!1m6!2m5!1sCi9DQUlRQUNvZENodHljRjlvT2tobGRrbzNMVGQwTjI5d1ltOURZa3M1Uld4MWFuYxAB!2m1!1s0x0:0x2efa18d922c78ba0!3m1!1s2@1:CAIQACodChtycF9oOkhldko3LTd0N29wYm9DYks5RWx1anc%7C%7C?hl=id",
"Puskesmas Sewon II","https://www.google.com/maps/search/?api=1&query=Puskesmas%20Sewon%20II&query_place_id=ChIJE446Lk9Wei4RoIvHItkY-i4","4","siti istiqomah","https://www.google.com/maps/reviews/data=!4m8!14m7!1m6!2m5!1sCi9DQUlRQUNvZENodHljRjlvT25WNGRYRjBWbGc1VG1kaVEwUTVSMU5WU3paMlpHYxAB!2m1!1s0x0:0x2efa18d922c78ba0!3m1!1s2@1:CAIQACodChtycF9oOnV4dXF0Vlg5TmdiQ0Q5R1NVSzZ2ZGc%7C%7C?hl=id","terimakasii puskesmas (community health center) lansia ..tiyang sepuh didahulukan🙏🏻... dan accessibility waktu 2020 dimudahkan..pengalaman menemukan sekola lanjutan 💌☺️ masyaAllah tabarakallah"
"Puskesmas Sewon II","https://www.google.com/maps/search/?api=1&query=Puskesmas%20Sewon%20II&query_place_id=ChIJE446Lk9Wei4RoIvHItkY-i4","5","Edo Sinambela (Fernando)","https://www.google.com/maps/reviews/data=!4m8!14m7!1m6!2m5!1sCi9DQUlRQUNvZENodHljRjlvT25sWFdWVm9ZbEF3TFZWVFNuSmxRblJ3UjFocFJtYxAB!2m1!1s0x0:0x2efa18d922c78ba0!3m1!1s2@1:CAIQACodChtycF9oOnlXWVVoYlAwLVVTSnJlQnRwR1hpRmc%7C%7C?hl=id","Pelayanan sgt bagus, cepat ga berlama lama,dan alurnya jelas TDK membingungkan.. Nakesnya HUMANIS sekali.....  Thanks Puskesmas Sewon 2.. God nless"
"Puskesmas Sewon II","https://www.google.com/maps/search/?api=1&query=Puskesmas%20Sewon%20II&query_place_id=ChIJE446Lk9Wei4RoIvHItkY-i4","5","Reni Rahmawati","https://www.google.com/maps/reviews/data=!4m8!14m7!1m6!2m5!1sCi9DQUlRQUNvZENodHljRjlvT2tSamRtdHdlSEl3T0Y5T09HaHJZbGN5VG5wZlZrRRAB!2m1!1s0x0:0x2efa18d922c78ba0!3m1!1s2@1:CAIQACodChtycF9oOkRjdmtweHIwOF9OOGhrYlcyTnpfVkE%7C%7C?hl=id",
"Puskesmas Sewon II","https://www.google.com/maps/search/?api=1&query=Puskesmas%20Sewon%20II&query_place_id=ChIJE446Lk9Wei4RoIvHItkY-i4","5","Yovita Adriana","https://www.google.com/maps/reviews/data=!4m8!14m7!1m6!2m5!1sCi9DQUlRQUNvZENodHljRjlvT21sS1ptMVhlVE5HZFhkNWMzTnpkR1JaTkhBMlRYYxAB!2m1!1s0x0:0x2efa18d922c78ba0!3m1!1s2@1:CAIQACodChtycF9oOmlKZm1XeTNGdXd5c3NzdGRZNHA2TXc%7C%7C?hl=id","pelayanannya baik, semua petugas membantu dengan baik"
"Puskesmas Sewon II","https://www.google.com/maps/search/?api=1&query=Puskesmas%20Sewon%20II&query_place_id=ChIJE446Lk9Wei4RoIvHItkY-i4","5","Adna Maharani","https://www.google.com/maps/reviews/data=!4m8!14m7!1m6!2m5!1sCi9DQUlRQUNvZENodHljRjlvT2tJeldtOUxjemt3WHpGSmVtdFNka3hWTjNwVlNtYxAB!2m1!1s0x0:0x2efa18d922c78ba0!3m1!1s2@1:CAIQACodChtycF9oOkIzWm9LczkwXzFJemtSdkxVN3pVSmc%7C%7C?hl=id","Pelayanannya sangat bagus dan memuaskan"
"Puskesmas Sewon II","https://www.google.com/maps/search/?api=1&query=Puskesmas%20Sewon%20II&query_place_id=ChIJE446Lk9Wei4RoIvHItkY-i4","5","Rafa Lubena","https://www.google.com/maps/reviews/data=!4m8!14m7!1m6!2m5!1sCi9DQUlRQUNvZENodHljRjlvT2xKQ1ZXMVZhWHBLWWpGME1FWmpPRXRMTFdaTVJWRRAB!2m1!1s0x0:0x2efa18d922c78ba0!3m1!1s2@1:CAIQACodChtycF9oOlJCVW1VaXpKYjF0MEZjOEtLLWZMRVE%7C%7C?hl=id","Puskesmas sewon II memiliki pelayanan yang ramah, cepat, dan baik"
"Puskesmas Sewon II","https://www.google.com/maps/search/?api=1&query=Puskesmas%20Sewon%20II&query_place_id=ChIJE446Lk9Wei4RoIvHItkY-i4","5","tanaya fadhillah","https://www.google.com/maps/reviews/data=!4m8!14m7!1m6!2m5!1sCi9DQUlRQUNvZENodHljRjlvT2t4RWFVNTBXblo0TXpkUmRrdEhZMk50YW5FNGJtYxAB!2m1!1s0x0:0x2efa18d922c78ba0!3m1!1s2@1:CAIQACodChtycF9oOkxEaU50WnZ4MzdRdktHY2NtanE4bmc%7C%7C?hl=id","Lokasi puskesmas sangat strategis, pelayanan sangat ramah & cepat, tersedia berbagai layanan dan kegiatan yg mendukung kesehatan masyarakat"
"Puskesmas Sewon II","https://www.google.com/maps/search/?api=1&query=Puskesmas%20Sewon%20II&query_place_id=ChIJE446Lk9Wei4RoIvHItkY-i4","1","Fitri Andriyani","https://www.google.com/maps/reviews/data=!4m8!14m7!1m6!2m5!1sCi9DQUlRQUNvZENodHljRjlvT2xGSlFsQnRkbXM1WkhCaU1FUlRORXRaVWpGV2VYYxAB!2m1!1s0x0:0x2efa18d922c78ba0!3m1!1s2@1:CAIQACodChtycF9oOlFJQlBtdms5ZHBiMERTNEtZUjFWeXc%7C%7C?hl=id","Pelayanan kurang ramah,,"
"Puskesmas Sewon II","https://www.google.com/maps/search/?api=1&query=Puskesmas%20Sewon%20II&query_place_id=ChIJE446Lk9Wei4RoIvHItkY-i4","5","Yeshie Kurnia","https://www.google.com/maps/reviews/data=!4m8!14m7!1m6!2m5!1sChZDSUhNMG9nS0VJQ0FnSUQ1LXZIc2JnEAE!2m1!1s0x0:0x2efa18d922c78ba0!3m1!1s2@1:CIHM0ogKEICAgID5-vHsbg%7C%7C?hl=id","Periksa utk yg batuk demam dipoli infeksius pelayanan cepat karyawan ramah ramah. Kemarin antar anak vaksin tgl 7 okt juga tempatnya nyaman dan pelayanan memuaskan"
"Puskesmas Sewon II","https://www.google.com/maps/search/?api=1&query=Puskesmas%20Sewon%20II&query_place_id=ChIJE446Lk9Wei4RoIvHItkY-i4","1","fajar riyanto","https://www.google.com/maps/reviews/data=!4m8!14m7!1m6!2m5!1sCi9DQUlRQUNvZENodHljRjlvT2xrMmFtOW5VblpUVDBGNlpGbDBibmczVFhvdFJXYxAB!2m1!1s0x0:0x2efa18d922c78ba0!3m1!1s2@1:CAIQACodChtycF9oOlk2am9nUnZTT0F6ZFl0bng3TXotRWc%7C%7C?hl=id","Pelayanan lama / buruk"
"Puskesmas Sewon II","https://www.google.com/maps/search/?api=1&query=Puskesmas%20Sewon%20II&query_place_id=ChIJE446Lk9Wei4RoIvHItkY-i4","5","Rizma Oktavia","https://www.google.com/maps/reviews/data=!4m8!14m7!1m6!2m5!1sCi9DQUlRQUNvZENodHljRjlvT2pSclZtbE1kR05wYlZSdlRuaFNWVGRzVUc1YVZIYxAB!2m1!1s0x0:0x2efa18d922c78ba0!3m1!1s2@1:CAIQACodChtycF9oOjRrVmlMdGNpbVRvTnhSVTdsUG5aVHc%7C%7C?hl=id","Hari ini periksa di KIA, cukup nyaman,antrian tdk terlalu lama, semoga pelayanan nya selalu ditingkatkan lebih baik ya kak"
"Puskesmas Sewon II","https://www.google.com/maps/search/?api=1&query=Puskesmas%20Sewon%20II&query_place_id=ChIJE446Lk9Wei4RoIvHItkY-i4","5","Siti Badiyah","https://www.google.com/maps/reviews/data=!4m8!14m7!1m6!2m5!1sCi9DQUlRQUNvZENodHljRjlvT21KS09WWkxhekF4TkhRemJIVTJja2xEVmtobFVuYxAB!2m1!1s0x0:0x2efa18d922c78ba0!3m1!1s2@1:CAIQACodChtycF9oOmJKOVZLazAxNHQzbHU2cklDVkhlUnc%7C%7C?hl=id","Pelayanannya baik 🙏"
"Puskesmas Sewon II","https://www.google.com/maps/search/?api=1&query=Puskesmas%20Sewon%20II&query_place_id=ChIJE446Lk9Wei4RoIvHItkY-i4","1","Asken S Lumban Tobing","https://www.google.com/maps/reviews/data=!4m8!14m7!1m6!2m5!1sCi9DQUlRQUNvZENodHljRjlvT25SNWMzUkhhalZMUkZZeVlrTm1WbEo2WlVnd2MzYxAB!2m1!1s0x0:0x2efa18d922c78ba0!3m1!1s2@1:CAIQACodChtycF9oOnR5c3RHajVLRFYyYkNmVlJ6ZUgwc3c%7C%7C?hl=id","Pelayanannya buruk sekali."
"Puskesmas Sewon II","https://www.google.com/maps/search/?api=1&query=Puskesmas%20Sewon%20II&query_place_id=ChIJE446Lk9Wei4RoIvHItkY-i4","5","Raymond Almer","https://www.google.com/maps/reviews/data=!4m8!14m7!1m6!2m5!1sCi9DQUlRQUNvZENodHljRjlvT2xGRFgzazNlVlp0VTNkb1RXeHhVbUZwYlVsaFRrRRAB!2m1!1s0x0:0x2efa18d922c78ba0!3m1!1s2@1:CAIQACodChtycF9oOlFDX3k3eVZtU3doTWxxUmFpbUlhTkE%7C%7C?hl=id",
"Puskesmas Sewon II","https://www.google.com/maps/search/?api=1&query=Puskesmas%20Sewon%20II&query_place_id=ChIJE446Lk9Wei4RoIvHItkY-i4","2","Welly Setya","https://www.google.com/maps/reviews/data=!4m8!14m7!1m6!2m5!1sCi9DQUlRQUNvZENodHljRjlvT21WbFFWTXdUWFl0V0MxeVJXRndZVWRTYmxaTE5FRRAB!2m1!1s0x0:0x2efa18d922c78ba0!3m1!1s2@1:CAIQACodChtycF9oOmVlQVMwTXYtWC1yRWFwYUdSblZLNEE%7C%7C?hl=id","Infeksius pasien banyak dokter cuma 1. Nunggunya lama bgt"
"Puskesmas Sewon II","https://www.google.com/maps/search/?api=1&query=Puskesmas%20Sewon%20II&query_place_id=ChIJE446Lk9Wei4RoIvHItkY-i4","1","axelin olivia achmad","https://www.google.com/maps/reviews/data=!4m8!14m7!1m6!2m5!1sCi9DQUlRQUNvZENodHljRjlvT2tocFZHRnVMVlZqY25KMVdrMUllRm8xUzFCWGJVRRAB!2m1!1s0x0:0x2efa18d922c78ba0!3m1!1s2@1:CAIQACodChtycF9oOkhpVGFuLVVjcnJ1Wk1IeFo1S1BXbUE%7C%7C?hl=id","Kecuali untuk ibu yg diruangan ini semoga tidak terjadi ke pasien lain ya ibu.  niat cuma mau tanya ""ruangan KIA dimana? Apa berkasnya ditinggal atau bagaimana"" karena kita pasien pertama kali juga jadi gatau . Stelah dijawab ketus ibunya langsung menyuruh dg ketus ""tutup"" . Padahal saya belum selesai ngomong.
Baca di beberapa ulasan memang dapat perlakuan yg sama . Besok2 dijaga sikap dan etika nya ya Bu apalagi bekerja di pelayanan publik ga semua orang terima dengan respon ibu termasuk saya . Thank u !! Semoga pelayanan semakin ditingkat kan lagi ya"
"Puskesmas Sewon II","https://www.google.com/maps/search/?api=1&query=Puskesmas%20Sewon%20II&query_place_id=ChIJE446Lk9Wei4RoIvHItkY-i4","1","Dava maulana yusuf","https://www.google.com/maps/reviews/data=!4m8!14m7!1m6!2m5!1sCi9DQUlRQUNvZENodHljRjlvT2s1M1RuUkRYMDUxVEhablRrUXhZMjl3VmxNek5YYxAB!2m1!1s0x0:0x2efa18d922c78ba0!3m1!1s2@1:CAIQACodChtycF9oOk53TnRDX051THZnTkQxY29wVlMzNXc%7C%7C?hl=id","tolong lah kalau udah dikasih kritik sama saran itu di perbaiki bukan malah sama aja"
"Puskesmas Sewon II","https://www.google.com/maps/search/?api=1&query=Puskesmas%20Sewon%20II&query_place_id=ChIJE446Lk9Wei4RoIvHItkY-i4","1","biasana","https://www.google.com/maps/reviews/data=!4m8!14m7!1m6!2m5!1sCi9DQUlRQUNvZENodHljRjlvT2xCQ1gwWlJRMHd5Y1hOVFJGaEJjMDQzV25SaFVVRRAB!2m1!1s0x0:0x2efa18d922c78ba0!3m1!1s2@1:CAIQACodChtycF9oOlBCX0ZRQ0wycXNTRFhBc043WnRhUUE%7C%7C?hl=id","pasien itu sudah capek sama sakitnya, jangan dibikin capek lagi sama sikap dokternya yang gak ""nguwongke"". kejadian yg saya alami, saya masuk ruang periksa sudah di akhir pelayanan (mungkin juga pasien terakhir) setelah tanya jawab keluhan, dokter minta kertas antrian, distempel untuk antrian obat. setelah itu keluar ruangan. saya masih aja duduk di kursi periksa di ruangan itu. setelah beberapa saat dokternya dari meja luar bilang, ""sudah selesai, ke kasir..."" saya jawab ""oh ya, makasih dok"" tapi dalam hati saya ya ngganjel, emang gak bisa ya bilang baik2 sebelum dia keluar ruangan itu, ""setelah ini ke kasir ya..."" misalnya. kok malah ninggalin gak.berucap apa2 setelah itu kasih tau dari luar ruangan.
siapa itu dokter perempuan yang ada di ruang periksa 1?
saya yakin dokter2 itu pintar, cerdas, tapi kalau sudah pelayanan ke masyarakat apalagi puskesmas yang notabene yang datang orang2 menengah ke bawah yang kurang pengalaman, kurang wawasan, yang gak pinter, mbok ya tolong diarahkan, dilayani dengan baik, atitude-nya itu lho diperbaiki. jangan nglayani kok jutek seperti itu. kapus atau kadinas mohon dibina yang seperti itu.
pelayanan pendaftaran, pelayanan perawat yg di meja tensi, pelayanan farmasi sudah bagus semua. tempat juga rapi, tertata, nyaman.
cuma itu tadi yang bikin sebel."
